ID;Nazwa;Marka;Model;Kategoria;Opis;Cena;URL_zdjecia
441;Buty NIKE;NIKE ;Air Max Excee CD5432 104 White/Aura/Pale Ivory ;Sportowe damskie;Wygodny fason marki NIKE. Cholewka solidnie wykoñczona - Skóra naturalna - Licowa, Zamsz, Materia³ - Materia³. Wk³adka to materia³. Podeszwa przyjazna dla stopy: wysokogatunkowe tworzywo. Buty wzbogacono o technologiê Max Air. Codzienna, wygodna propozycja w dobrym stylu. ;http://www.eobuwie.com.pl/media/catalog/product/cache/image/650x650/0/0/0000207985773_01_rz.jpg
442;Trekkingi SALEWA;Salewa ;Alp Trainer Mid Gtx GORE-TEX 64006-0365 Dark Denim/Charcoal ;Sportowe damskie;Buty outdoorowe Jr Alp Trainer Mid Gtx stworzono dla najm³odszych mi³oœników górskich przygód. Trekkingi posiadaj¹ membranê GORE-TEX® Performance Comfort Footwear, która zabezpiecza stopê przed wod¹, a tak¿e skutecznie odprowadza pot na zewn¹trz cholewki. Elastyczna wk³adka Ortholite ma w³aœciwoœci antybakteryjne i antygrzybicze, daje poczucie œwie¿oœci przez d³ugi czas. Podeszwa zewnêtrzna Michelin Tech Sole zapewnia pewny krok nawet w trudnych warunkach pogodowych, zaœ antypoœlizgowa podeszwa z technologi¹ OCsystem gwarantuje stabilnoœæ na oblodzonych powierzchniach. ;http://www.eobuwie.com.pl/media/catalog/product/cache/image/650x650/0/0/0000200370422_01_sw.jpg
443;Sneakersy VANS;Vans ;Sk8-Hi Mte 2.0 Dx VN0A4P3I2TI1 (Mte) Black/Cam ;Sportowe damskie;Przyci¹gaj¹ce uwagê buty marki Vans. W cholewce dominuje Skóra naturalna - Licowa, Skóra ekologiczna - Skóra ekologiczna. Wk³adka to materia³. Podeszwa to wysokogatunkowe tworzywo. Buty na co dzieñ - ponadczasowe i uniwersalne. ;http://www.eobuwie.com.pl/media/catalog/product/cache/image/650x650/0/0/0000207852839_01_rz.jpg
444;Buty NIKE;NIKE ;Air Max 270 React (GS) BQ0103 401 Midnight Navy/Metallic Silver ;Sportowe damskie;Wygodny fason marki NIKE. Wygodnie wyprofilowana cholewka to Skóra ekologiczna - Skóra ekologiczna, Materia³ - Materia³, Tworzywo - Wysokogatunkowe tworzywo. Wk³adka to materia³. Podeszwa - wysokogatunkowe tworzywo. Buty wzbogacono o technologiê Nike Air, Nike React. Ten model bêdzie doskona³ym uzupe³nieniem codziennego stroju. ;http://www.eobuwie.com.pl/media/catalog/product/cache/image/650x650/0/0/0000207996939_01_rz.jpg
445;Sneakersy CONVERSE;Converse ;Ctas Hi 568660C Farro/Gold/White ;Sportowe damskie;Propozycja marki Converse. Do charakteru butów pasuje cholewka: Skóra ekologiczna - Skóra ekologiczna. We wnêtrzu wk³adka: materia³. Materia³ podeszwy to wysokogatunkowe tworzywo. Jeœli ci¹gle pozostajesz w ruchu wybierz buty na p³askiej podeszwie. ;http://www.eobuwie.com.pl/media/catalog/product/cache/image/650x650/0/0/0000207592780_01_ks.jpg
446;Sneakersy NEW BALANCE;New Balance ;WL311BAG Szary ;Sportowe damskie;Propozycja marki New Balance. Wygodnie wyprofilowana cholewka to Materia³ - Materia³. Komfort noszenia podnosi wk³adka: materia³. Podeszwa przyjazna dla stopy: wysokogatunkowe tworzywo. Model wyposa¿ono w technologiê EVA. Ten model bêdzie doskona³ym uzupe³nieniem codziennego stroju. ;http://www.eobuwie.com.pl/media/catalog/product/cache/image/650x650/0/0/0000207744844_01_sw.jpg
447;Buty adidas;adidas, adidas Originals ;Falcon W G26880 Cblack/Cblack/Grefiv ;Sportowe damskie;Wygodny fason marki adidas. Cholewka solidnie wykoñczona - Skóra naturalna - Nubuk, Materia³ - Materia³. Komfort noszenia podnosi wk³adka: materia³. Podeszwa przyjazna dla stopy: wysokogatunkowe tworzywo. W butach zastosowano technologiê EVA, Torsion. Codzienna, wygodna propozycja w dobrym stylu. ;http://www.eobuwie.com.pl/media/catalog/product/cache/image/650x650/0/0/0000201282878_01_rz_1.jpg
448;Buty Reebok;Reebok, Reebok Classic ;Evzn FV7931 Trgry1/insred/Vecnav ;Sportowe damskie;Lekkie sneakersy o sportowym fasonie Reebok. Wygodnie wyprofilowana cholewka to Skóra ekologiczna - Skóra ekologiczna, Materia³ - Materia³. W œrodku buty posiadaj¹ wyœció³kê - materia³. Wk³adka to materia³. Podeszwa - wysokogatunkowe tworzywo. Model wyposa¿ono w technologiê EVA. Kobiece i przyjazne dla stopy, bêd¹ baz¹ dla ca³ego stroju. ;http://www.eobuwie.com.pl/media/catalog/product/cache/image/650x650/0/0/0000206872791_01_rz.jpg
449;Buty NIKE;NIKE ;Nike Air Max 2090 DC4461 001 Black/Metallic Gold/White ;Sportowe damskie;Przyci¹gaj¹ce uwagê buty marki NIKE. Cholewka wyprofilowana z najlepszych surowców: Skóra naturalna - Zamsz, Materia³ - Materia³. We wnêtrzu butów znajduje siê wk³adka: materia³. Wygodê zwiêksza odpowiednia podeszwa: wysokogatunkowe tworzywo. Buty wzbogacono o technologiê Air Max, Max Air, Nike Air, TPU. Fason podkreœlaj¹ detale: ozdoba jest odpinana, z³oty metal. Miejski styl i swobodna elegancja. ;http://www.eobuwie.com.pl/media/catalog/product/cache/image/650x650/0/0/0000208064866_01_rz.jpg
450;Tenisówki VANS;Vans ;Authentic VN-0 EE3BLK Black ;Sportowe damskie;Kolejny raz Vans Of The Wall udowadnia, ¿e obuwie marki jest bezkonkurencyjne. Buty z grub¹ podeszw¹ o gumowanym spodzie. Tak¹ warstwê trudno zedrzeæ nawet na ostrym betonie, ale gruba podeszwa nie zaburza dynamiki ruchu. Kolory? Uniwersalne, czerñ i biel, wbrew pozorom najmodniejsze zestawienie sezonu. Przewiewne, dobrze trzymaj¹ siê stopy dziêki sznurowaniu na 8 dziurek. Swobodny styl jest synonimem marki, pozwól sobie na odrobinê luzu razem z Vans of The Wall. ;http://www.eobuwie.com.pl/media/catalog/product/cache/image/650x650/0/7/0700053288515_trampki_vans_-_authentic_vee3blk_black_ak_01.jpg
451;Trampki CONVERSE;Converse ;CT All Star M7650-22 White ;Sportowe damskie;Marka Converse to niekwestionowany lider na rynku obuwia sportowego. Kultowe trampki znane s¹ na ca³ym œwiecie z jakoœci wykonania i ciekawego wzornictwa.  Gumowana podeszwa zabezpiecza przed upadkiem na œliskich powierzchniach. Najlepsze jakoœciowo materia³y,  z których wykonano cholewê i podeszwê sprawiaj¹, ¿e ¿adne inne trampki nie moga równaæ siê  z butami firmy Converse. Bia³y model to œwietny wybór do ubrañ w ró¿nym stylu - sprawdzi siê w trakcie porannego joggingu, w szkole, ale tak¿e jako dodatek do marynarki w mniej oficjalnych sytuacjach.;http://www.eobuwie.com.pl/media/catalog/product/cache/image/650x650/0/0/0000005426577_01_pp.jpg
452;Trampki CONVERSE;Converse ;CT A/S Seasnl H 1J793 Charcoal ;Sportowe damskie;Przyci¹gaj¹ce uwagê Converse. W cholewce dominuje Materia³ - Materia³. Materia³ podeszwy to guma. Ponadczasowa klasyka gatunku. ;http://www.eobuwie.com.pl/media/catalog/product/cache/image/650x650/0/0/0000191157330_01_pac_1.jpg
453;Sneakersy NEW BALANCE;New Balance ;WL574CLA Granatowy ;Sportowe damskie;Propozycja marki New Balance. Wygodnie wyprofilowana cholewka to Skóra naturalna - Nubuk. Wk³adka to materia³. Podeszwa - wysokogatunkowe tworzywo. W butach zastosowano technologiê ENCAP, EVA. Codzienna, wygodna propozycja w dobrym stylu. ;http://www.eobuwie.com.pl/media/catalog/product/cache/image/650x650/0/0/0000207744431_01_rz.jpg
454;Buty NIKE;NIKE ;Zoom Pulse CT1629 002 Vast Grey/University Gold/Pink ;Sportowe damskie;Propozycja marki NIKE. Wygodnie wyprofilowana cholewka to Skóra ekologiczna - Skóra ekologiczna. Komfort noszenia podnosi wk³adka: materia³. Podeszwa przyjazna dla stopy: wysokogatunkowe tworzywo. W butach zastosowano technologiê Nike Air, Nike Zoom. Codzienna, wygodna propozycja w dobrym stylu. ;http://www.eobuwie.com.pl/media/catalog/product/cache/image/650x650/0/0/0000208157865_01_pl.jpg
455;Buty adidas;adidas, adidas Originals ;Superstar J FU7713 Cblack/Cblack/Cblack ;Sportowe damskie;W propozycjach marki adidas dzieciêce, sznurowane trzewiki. Wierzchnia czêœæ butów tworzy Skóra naturalna - Licowa. We wnêtrzu materia³, co sprawia, ¿e buty zachowuj¹ dobre w³aœciwoœci higieniczne Wk³adka w tych butach to materia³, zwiêksza komfort noszenia. Podeszwa - wysokogatunkowe tworzywo - izoluje od pod³o¿a. Buty zapewniaj¹ zdrowy rozwój stopy i komfort noszenia. ;http://www.eobuwie.com.pl/media/catalog/product/cache/image/650x650/0/0/0000206764409_01_ksz.jpg
456;Buty adidas;adidas, adidas Originals ;Multix J FX6230 Crywht/Ftwwht/Cblack ;Sportowe damskie;Wygodne, sznurowane trzewiki dzieciêce marki adidas. Wytrzyma³a cholewka to Materia³ - Materia³, Tworzywo - Wysokogatunkowe tworzywo. We wnêtrzu materia³, co sprawia, ¿e buty zachowuj¹ dobre w³aœciwoœci higieniczne We wnêtrzu butów znajduje siê wk³adka: materia³. W podeszwie zastosowano wysokogatunkowe tworzywo. Buty odpowiadaj¹ potrzebom rozwijaj¹cej siê stopy, zapewniaj¹c jej swobodê ruchu, ale tak¿e lekk¹ stabilizacjê. ;http://www.eobuwie.com.pl/media/catalog/product/cache/image/650x650/0/0/0000207669697_01_rz.jpg
457;Buty NIKE;NIKE ;Air Max 270 React (GS) BQ0103 007 Gunsmoke/Reflect Silver ;Sportowe damskie;Nowy model marki NIKE. Do charakteru butów pasuje cholewka: Materia³ - Materia³. We wnêtrzu wk³adka: materia³. Materia³ podeszwy to wysokogatunkowe tworzywo. Model wyposa¿ono w technologiê Nike Air, Nike React. Ten model bêdzie doskona³ym uzupe³nieniem codziennego stroju. ;http://www.eobuwie.com.pl/media/catalog/product/cache/image/650x650/0/0/0000208129879_01_pl.jpg
458;Buty NIKE;NIKE ;Air Max Excee CD5432 600 Washed Coral/Black/White ;Sportowe damskie;Propozycja marki NIKE. Wygodnie wyprofilowana cholewka to Skóra naturalna - Licowa, Zamsz, Materia³ - Materia³. Wk³adka to materia³. Podeszwa przyjazna dla stopy: wysokogatunkowe tworzywo. Buty wzbogacono o technologiê Max Air. Codzienna, wygodna propozycja w dobrym stylu. ;http://www.eobuwie.com.pl/media/catalog/product/cache/image/650x650/0/0/0000207985797_01_rz.jpg
459;Buty NIKE;NIKE ;Sb Charge Suede (Gs) CT3112 401 Mystic Navy/Starfish ;Sportowe damskie;W propozycjach marki NIKE dzieciêce, sznurowane trzewiki. Wytrzyma³a cholewka to Skóra naturalna - Zamsz. We wnêtrzu materia³, co sprawia, ¿e buty zachowuj¹ dobre w³aœciwoœci higieniczne We wnêtrzu butów znajduje siê wk³adka: materia³. Podeszwa - wysokogatunkowe tworzywo - izoluje od pod³o¿a. Model wyposa¿ono w technologiê SolarSoft. Buty gwarantuj¹ wygodê na co dzieñ i nie ograniczaj¹ ruchu stopy. ;http://www.eobuwie.com.pl/media/catalog/product/cache/image/650x650/0/0/0000207885998_01_jb_kopia.jpg
460;Buty adidas;adidas, adidas Performance ;Duramo Sl FW3221 Legend Ink/Grey Six/Tech Indigo ;Sportowe damskie;Buty biegowe marki adidas. Cholewka solidnie wykoñczona - Materia³ - Materia³, Tworzywo - Wysokogatunkowe tworzywo. Komfort noszenia podnosi wk³adka: materia³. Amortyzuj¹ca podeszwa to wysokogatunkowe tworzywo. Model wyposa¿ono w technologiê Ortholite. Amortyzacja i wsparcie stopy - to odpowiedni fason treningowy. ;http://www.eobuwie.com.pl/media/catalog/product/cache/image/650x650/0/0/0000206757692_01_rz.jpg
461;Buty adidas;adidas, adidas Performance ;Nova Flow EH1377 Cblck/Ftwwht/Lgrani ;Sportowe damskie;Nowy model biegowy marki adidas. Cholewka solidnie wykoñczona - Materia³ - Materia³, Tworzywo - Wysokogatunkowe tworzywo. Komfort noszenia podnosi wk³adka: materia³. Lepsz¹ amortyzacjê uzyskano dziêki podeszwie - to wysokogatunkowe tworzywo. Model wyposa¿ono w technologiê adiWEAR, Cloudfoam, Ortholite. Amortyzacja i wsparcie stopy - to odpowiedni fason treningowy. ;http://www.eobuwie.com.pl/media/catalog/product/cache/image/650x650/0/0/0000206703057_01_pac.jpg
462;Buty ASICS;Asics ;Jolt 2 Gs 1014A035 Graphite Grey/Lime Zest 024 ;Sportowe damskie;Nowy model biegowy marki Asics. Wygodnie wyprofilowana cholewka to Skóra ekologiczna - Skóra ekologiczna, Materia³ - Materia³. Komfort noszenia podnosi wk³adka: materia³. Lepsz¹ amortyzacjê uzyskano dziêki podeszwie - to wysokogatunkowe tworzywo. Model wyposa¿ono w technologiê EVA. To model doskona³y do treningu biegowego. ;http://www.eobuwie.com.pl/media/catalog/product/cache/image/650x650/0/0/0000207911222_01_rz.jpg
463;Buty ASICS;Asics ;Patriot 11 Gs 1014A070 Tuna Blue/Black 401 ;Sportowe damskie;Dzieciêce buty biegowe ASICS PATRIOT 11 GS zosta³y zaprojektowane w takim sposób, aby u³atwiæ m³odym sportowcom wejœcie w œwiat biegania. G³ówn¹ zalet¹ tego modelu jest prosta i lekka konstrukcja, posiadaj¹ca wszystkie funkcjonalne cechy buta biegowego. Podeszwa œrodkowa z pianki EVA zapewnia dobr¹ amortyzacj¹, a usztywniony zapiêtek utrzymuje stopê w odpowiednim po³o¿eniu. Podeszwa zewnêtrzna z trudnoœcieralnej gumy wêglowej gwarantuje dobr¹ przyczepnoœæ na zró¿nicowanej nawierzchni, natomiast dziêki siateczkowej cholewie stopa ma zapewniony odpowiedni poziom wentylacji.;http://www.eobuwie.com.pl/media/catalog/product/cache/image/650x650/0/0/0000206524928_01_mf_2.jpg
464;Buty adidas;adidas, adidas Performance ;Rockadia Trail 3.0 FW5287 Black ;Sportowe damskie;Buty biegowe marki adidas. Odporna cholewka to Materia³ - Materia³, Tworzywo - Wysokogatunkowe tworzywo. Wk³adka to materia³. Podeszwa przyjazna dla stopy: wysokogatunkowe tworzywo. Model wyposa¿ono w technologiê adiWEAR, Cloudfoam, Ortholite. Jeœli jesteœ ci¹gle w ruchu wybierz buty na p³askiej podeszwie. ;http://www.eobuwie.com.pl/media/catalog/product/cache/image/650x650/0/0/0000206766908_02_mg.jpg
465;Buty SALOMON;Salomon ;Trailster 2 Gtx W GORE-TEX 409638 25 W0 Navy Blazer/Sargasso Sea/Flint Stone ;Sportowe damskie;Biegowy model marki Salomon. Odporna cholewka to Skóra ekologiczna - Skóra ekologiczna, Materia³ - Materia³, Tworzywo - Wysokogatunkowe tworzywo. Komfort noszenia podnosi wk³adka: materia³. Podeszwa przyjazna dla stopy: wysokogatunkowe tworzywo. W butach zastosowano technologiê Contagrip, EnergyCell+, GORE-TEX® Extended Comfort Footwear, Ortholite, Sensifit. Codzienna, wygodna propozycja w dobrym stylu. ;http://www.eobuwie.com.pl/media/catalog/product/cache/image/650x650/0/0/0000206957856_01_tm.jpg
466;Buty ARC'TERYX;Arc'teryx ;Norvan Sl W 072974-439470 Interia/Astro Eden ;Sportowe damskie;Biegowy model marki Arc'teryx. Odporna cholewka to Materia³ - Materia³, Tworzywo - Wysokogatunkowe tworzywo. Komfort noszenia podnosi wk³adka: materia³. Podeszwa - wysokogatunkowe tworzywo. Buty wzbogacono o technologiê Megagrip, TPU, Vibram. Codzienna, wygodna propozycja w dobrym stylu. ;http://www.eobuwie.com.pl/media/catalog/product/cache/image/650x650/0/0/0000207975910_01_mk_1.jpg
467;Buty COLUMBIA;Columbia ;Trans Alps™ F.K.T. III BL0107 Cobalt Blue/Fuchsia 408 ;Sportowe damskie;Buty do biegania marki Columbia. Odporna cholewka to Materia³ - Materia³, Tworzywo - Wysokogatunkowe tworzywo. Komfort noszenia podnosi wk³adka: materia³. Materia³ podeszwy to wysokogatunkowe tworzywo. W butach zastosowano technologiê FluidFoam, Trail Shield. Codzienna, wygodna propozycja w dobrym stylu. ;http://www.eobuwie.com.pl/media/catalog/product/cache/image/650x650/0/0/0000207587113_01_wj.jpg
468;Buty ECCO;ECCO ;Biom Fjuel 83751301001 Black ;Sportowe damskie;Czy wiesz, ¿e technologia BIOM doskonale amortyzuje i pozwala poruszaæ siê w naturalny sposób, umacniaj¹c jednoczeœnie miêœnie i stawy? Dlatego pó³buty z nowej kolekcji Ecco spe³ni¹ oczekiwania wymagaj¹cych klientek! Niezwykle wytrzyma³a, czarna skóra jaka przyjemnie uk³ada siê na nodze i odpowiednio j¹ wspiera. Technologia Strobel dodatkowo amortyzuje, zapewnia giêtkoœæ i lekkoœæ. Miêkka wk³adka dopasowuje siê do naturalnego kszta³tu stopy, a skórzana wyœció³ka znacznie podnosi komfort u¿ytkowania. Elastyczna podeszwa z poliuretanu (PU) zosta³a przymocowana za pomoc¹ metody bezpoœredniego wtrysku (technologia DIP). Wstawki z gumy i termoplastycznego poliuretanu (TPU) odznaczaj¹ siê bardzo dobr¹ przyczepnoœci¹ i odpornoœci¹ na czynniki zewnêtrzne. Zachwyæ wszystkich atrakcyjnymi i niesamowicie wygodnymi pó³butami Ecco! ;http://www.eobuwie.com.pl/media/catalog/product/cache/image/650x650/p/o/poprawka_0000197773121_ecco_-_biom_fjuel_83751301001_black__kc_01.jpg
469;Buty adidas;adidas, adidas Performance ;Tensaur Run K EG4126 Shopnk/Ftwwht/Lgrani 1 ;Sportowe damskie;W propozycjach marki adidas dzieciêce, sznurowane buty. Wierzchnia czêœæ butów tworzy Materia³ - Materia³. Wnêtrze obuwia stanowi materia³. Nie zabrak³o ch³onnej wk³adki, to materia³. Podeszwa - wysokogatunkowe tworzywo - izoluje od pod³o¿a. Model wyposa¿ono w technologiê EVA. Buty odpowiadaj¹ potrzebom rozwijaj¹cej siê stopy, zapewniaj¹c jej swobodê ruchu, ale tak¿e lekk¹ stabilizacjê. ;http://www.eobuwie.com.pl/media/catalog/product/cache/image/650x650/0/0/0000206766571_01_mt.jpg
470;Buty Reebok;Reebok ;Flexagon Energy Tr 2.0 FW8315 Maroon/Glapnk/Pugry3 ;Sportowe damskie;Nowy model marki Reebok. Do charakteru butów pasuje cholewka: Materia³ - Materia³. Wk³adka to materia³. Podeszwa przyjazna dla stopy: wysokogatunkowe tworzywo. Buty wzbogacono o technologiê EVA, FuelFoam. Codzienna, wygodna propozycja w dobrym stylu. ;http://www.eobuwie.com.pl/media/catalog/product/cache/image/650x650/0/0/0000206766465_01_rz.jpg
471;Trekkingi JACK WOLFSKIN;Jack Wolfskin ;Mtn Attack 3 Texapore Mid K 4034081 D Dark Blue/Orange ;Sportowe damskie;W kolekcji marki Jack Wolfskin wygodne buty na zimniejsze dni. Wierzchnia czêœæ butów to Skóra ekologiczna - Skóra ekologiczna, Materia³ - Materia³. We wnêtrzu butów zastosowano materia³. Nie zabrak³o wk³adki: materia³. Podeszwa to wysokogatunkowe tworzywo, bezpieczna nawet na œliskiej powierzchni. W butach zastosowano technologiê Cushion Pad, EVA, Multifunctional Grip System, Texapore. Buty posiadaj¹ ozdobê, to metal. Idealne nawet na d³ugie piesze wycieczki, trwa³e i wygodne. ;http://www.eobuwie.com.pl/media/catalog/product/cache/image/650x650/0/0/0000207529847_01_rz.jpg
472;Trekkingi ELBRUS;Elbrus ;Wadi Mid Teen Camel/Black ;Sportowe damskie;W kolekcji marki Elbrus wygodne buty na zimniejsze dni. Cholewka o podwy¿szonej odpornoœci to Skóra ekologiczna - Skóra ekologiczna, Materia³ - Materia³. We wnêtrzu materia³, co sprawia, ¿e buty zachowuj¹ dobre w³aœciwoœci higieniczne. Wk³adka w tych butach to materia³, zwiêksza komfort noszenia. Podeszwa: wysokogatunkowe tworzywo, posiada dobr¹ przyczepnoœæ i chroni przed upadkami. W butach zastosowano technologiê EVA, TPR. Ciekawie wykoñczone, chroni¹ przed nisk¹ temperatur¹. ;http://www.eobuwie.com.pl/media/catalog/product/cache/image/650x650/0/0/0000208229326_01_mg.jpg
473;Trekkingi COLUMBIA;Columbia ;Ivo Trail BL0825 Zinc/Dark Fuch 492 ;Sportowe damskie;Przeznaczone do wycieczek outdoorowych buty marki Columbia. Cholewka o podwy¿szonej odpornoœci Skóra naturalna - Zamsz, Materia³ - Materia³. Komfort noszenia podnosi wk³adka: materia³. Podeszwa o dobrej trakcji to wysokogatunkowe tworzywo. W butach zastosowano technologiê Omni-Grip™, Techlite. To bezpieczne obuwie terenowe. ;http://www.eobuwie.com.pl/media/catalog/product/cache/image/650x650/0/0/0000207587069_01_rz.jpg
474;Trekkingi JACK WOLFSKIN;Jack Wolfskin ;Vojo 3 Texapore Mid W 4042471 Tarmac Grey/Pink ;Sportowe damskie;Nowa propozycja marki Jack Wolfskin. Cholewka o podwy¿szonej odpornoœci Skóra naturalna - Welur, Materia³ - Materia³. Wk³adka to materia³. Podeszwa o dobrej trakcji to wysokogatunkowe tworzywo. W butach zastosowano technologiê EVA, Texapore. Fason posiada ozdobê, na która sk³ada siê srebrny metal. Dobre buty dla wymagaj¹cych u¿ytkowników. ;http://www.eobuwie.com.pl/media/catalog/product/cache/image/650x650/0/0/0000207531390_01_mg_1.jpg
475;Trekkingi JACK WOLFSKIN;Jack Wolfskin ;Downhill Texapore Mid W 4044141 Burgundy/Pink ;Sportowe damskie;Nowa propozycja marki Jack Wolfskin. Cholewka butów to Skóra ekologiczna - Skóra ekologiczna, Materia³ - Materia³. Komfort noszenia podnosi wk³adka: materia³. Podeszwa o dobrej trakcji to wysokogatunkowe tworzywo. Buty wzbogacono o technologiê Multifunctional Grip System, Texapore. Fason posiada ozdobê, na która sk³ada siê srebrny metal. To bezpieczne obuwie terenowe. ;http://www.eobuwie.com.pl/media/catalog/product/cache/image/650x650/0/0/0000207531543_01_pl.jpg
476;Tenisówki VANS;Vans ;Old Skool VN000D3HBKA Black ;Sportowe damskie;Wygodne trampki marki Vans. W cholewce dominuje Skóra ekologiczna - Skóra ekologiczna, Materia³ - Materia³. Podeszwa butów to guma. To buty, które bêd¹ podstaw¹ wielu stylizacji. ;http://www.eobuwie.com.pl/media/catalog/product/cache/image/650x650/0/0/0000198004446_vans-old_skool_vd3hbka_black_black_kc_01.jpg
477;Trampki CONVERSE;Converse ;Ctas Hi 167870C Navy/White/Black ;Sportowe damskie;Przyci¹gaj¹ce uwagê Converse. Cholewka butów to Materia³ - Materia³. Materia³ podeszwy to guma. Oldschoolowy fason nigdy nie wychodzi z mody. ;http://www.eobuwie.com.pl/media/catalog/product/cache/image/650x650/0/0/0000207434554_01_ksz.jpg
478;Tenisówki DC;DC ;Trase Platform ADGS300104 Black/Pink (Bbp) ;Sportowe damskie;Lekkie, sznurowane buty marki DC. Wytrzyma³a cholewka to Materia³ - Materia³. Wnêtrze oddychaj¹ce, jego g³ównym sk³adnikiem jest materia³. Nie zabrak³o ch³onnej wk³adki, to materia³. Podeszwa - guma - izoluje od pod³o¿a. W butach zastosowano technologiê NatureTex Ultra. Buty odpowiadaj¹ potrzebom rozwijaj¹cej siê stopy, zapewniaj¹c jej swobodê ruchu, ale tak¿e lekk¹ stabilizacjê. ;http://www.eobuwie.com.pl/media/catalog/product/cache/image/650x650/0/0/0000207398580_01_kt.jpg
479;Trampki CONVERSE;Converse ;CT Ox 132174C Black ;Sportowe damskie;Przyci¹gaj¹ce uwagê Converse. Lekki wygl¹d zawdziêczaj¹ cholewce: Skóra naturalna - Licowa. Podeszwa to guma. Ponadczasowa klasyka gatunku. ;http://www.eobuwie.com.pl/media/catalog/product/cache/image/650x650/7/4/743578-converse-132174c-cz-001_kopia.jpg
480;Trampki CONVERSE;Converse ;Ct Shoreline Slip 537080C Athletic Navy ;Sportowe damskie;Modna propozycja marki Converse. Lekki wygl¹d zawdziêczaj¹ cholewce: materia³ - materia³. Podeszwa butów to guma. To buty, które bêd¹ podstaw¹ wielu stylizacji.;http://www.eobuwie.com.pl/media/catalog/product/cache/image/650x650/0/0/0000058035320_01_ab.jpg
481;Sneakersy NEW BALANCE;New Balance ;WL574VAC Bia³y Kolorowy ;Sportowe damskie;Nowy model marki New Balance. Wygodnie wyprofilowana cholewka to Skóra naturalna - Zamsz, Materia³ - Materia³. Wk³adka to materia³. Podeszwa przyjazna dla stopy: wysokogatunkowe tworzywo. W butach zastosowano technologiê ENCAP, EVA. Jeœli ci¹gle pozostajesz w ruchu wybierz buty na p³askiej podeszwie. ;http://www.eobuwie.com.pl/media/catalog/product/cache/image/650x650/0/0/0000207744578_01_rz.jpg
482;Buty NIKE;NIKE ;Air Max 200 (GS) AT5627 008 Off Noir/Iced Lilac/Smoke Grey ;Sportowe damskie;Propozycja marki NIKE. Cholewka solidnie wykoñczona - Skóra ekologiczna - Skóra ekologiczna, Materia³ - Materia³. We wnêtrzu wk³adka: materia³. Podeszwa - wysokogatunkowe tworzywo. Model wyposa¿ono w technologiê Cushlon, Max Air. Ten model bêdzie doskona³ym uzupe³nieniem codziennego stroju. ;http://www.eobuwie.com.pl/media/catalog/product/cache/image/650x650/0/0/0000208129862_01_pl.jpg
483;Sneakersy NEW BALANCE;New Balance ;WL426LD1 Bia³y Ró¿owy ;Sportowe damskie;Wygodny fason marki New Balance. Wygodnie wyprofilowana cholewka to Skóra ekologiczna - Skóra ekologiczna, Materia³ - Materia³. We wnêtrzu wk³adka: materia³. Podeszwa przyjazna dla stopy: wysokogatunkowe tworzywo. Ten model bêdzie doskona³ym uzupe³nieniem codziennego stroju. ;http://www.eobuwie.com.pl/media/catalog/product/cache/image/650x650/0/0/0000207744387_01_rz.jpg
484;Trekkingi HI-TEC;Hi-Tec ;Beston Wo's AVS-SS19-HT-01-Q1 Mid Grey/Turquoise ;Sportowe damskie;Nowa propozycja marki Hi-Tec. Cholewka o podwy¿szonej odpornoœci Materia³ - Materia³, Tworzywo - Wysokogatunkowe tworzywo. Komfort noszenia podnosi wk³adka: materia³. Podeszwa odpowiednia do mokrych i œliskich powierzchni: wysokogatunkowe tworzywo. Dobre buty dla wymagaj¹cych u¿ytkowników. ;http://www.eobuwie.com.pl/media/catalog/product/cache/image/650x650/0/0/0000201257005_01_pp.jpg
485;Buty NIKE;NIKE ;Nike Air Max 270 React CZ0364 600 Pink Foam/White/Digital Pink ;Sportowe damskie;Propozycja marki NIKE. Wygodnie wyprofilowana cholewka to Skóra naturalna - Licowa, Materia³ - Materia³, Tworzywo - Wysokogatunkowe tworzywo. Komfort noszenia podnosi wk³adka: materia³. Podeszwa - wysokogatunkowe tworzywo. W butach zastosowano technologiê Max Air, Nike React. Ten model bêdzie doskona³ym uzupe³nieniem codziennego stroju. ;http://www.eobuwie.com.pl/media/catalog/product/cache/image/650x650/0/0/0000207997080_01_ks.jpg
486;Buty Reebok;Reebok, Reebok Classic ;Ex-O-Fit Hi 3478 Black Int ;Sportowe damskie;Miejski styl i wygoda od marki Reebok. Cholewka miêkko uk³ada siê na stopie Skóra naturalna - Licowa. W œrodku buty posiadaj¹ wyœció³kê - materia³. We wnêtrzu butów znajduje siê wk³adka: materia³. Podeszwa - wysokogatunkowe tworzywo. Ten model bêdzie doskona³ym uzupe³nieniem codziennego stroju. ;http://www.eobuwie.com.pl/media/catalog/product/cache/image/650x650/0/0/0000198761134_reebok-3478_black_int_ap_001.jpg
487;Buty NIKE;NIKE ;Wmns Venture Runner CK2948 002 Light Bone/White/Light Bone ;Sportowe damskie;Wygodny fason marki NIKE. Cholewka solidnie wykoñczona - Skóra naturalna - Zamsz, Materia³ - Materia³. We wnêtrzu wk³adka: materia³. Podeszwa - wysokogatunkowe tworzywo. Codzienna, wygodna propozycja w dobrym stylu. ;http://www.eobuwie.com.pl/media/catalog/product/cache/image/650x650/0/0/0000208129909_01_ki.jpg
