ID;Nazwa;Marka;Model;Kategoria;Opis;Cena;URL_zdjecia
295;Japonki SALOMON;Salomon ;Rx Break 4.0 407448 27 M0 Black/Black/White ;Klapki i sanda³y mêskie;Japonki marki Salomon. Materia³ zewnêtrzny to Materia³ - Materia³, Tworzywo - Wysokogatunkowe tworzywo Wewnêtrzn¹ czêœæ tworzy materia³, tworzywo. Nie zabrak³o wk³adki: tworzywo . Podeszwa to wysokogatunkowe tworzywo. W butach zastosowano technologiê 360 Rubber Traction, Contagrip, EnergyCell+, EVA, Non-Marking, OS Muscle, OS Tendon. Swobodna, lekka propozycja na lato. ;http://www.eobuwie.com.pl/media/catalog/product/cache/image/650x650/0/0/0000200809878_01_pp.jpg
296;Klapki SALOMON;Salomon ;Rx Slide 4.0 406732 27 M0 Black/Ebony/White ;Klapki i sanda³y mêskie;Uniwersalna propozycja marki Salomon. Cholewka dopasowuje siê do stopy, to Materia³ - Materia³. We wnêtrzu materia³. Komfort noszenia podnosi wk³adka: tworzywo . Podeszwa: wysokogatunkowe tworzywo, pasuje do fasonu. Model wyposa¿ono w technologiê 3D Mesh, Contagrip, EnergyCell+, EVA, Non-Marking, OS Muscle, OS Tendon. Przyjazne dla stopy, bêd¹ baz¹ dla ca³ego stroju. ;http://www.eobuwie.com.pl/media/catalog/product/cache/image/650x650/0/0/0000200809250_01_mt.jpg
297;Klapki SALOMON;Salomon ;Rx Slide 4.0 406731 27 M0 Poseidon/Navy Blazer/Taos Taupe ;Klapki i sanda³y mêskie;Kolejna, udana propozycja marki Salomon. Cholewka dopasowuje siê do stopy, to Materia³ - Materia³. materia³ we wnêtrzu butów. Wk³adka to tworzywo . wysokogatunkowe tworzywo tworzy podeszwê butów. W butach zastosowano technologiê 3D Mesh, Contagrip, EnergyCell+, EVA, Non-Marking, OS Muscle, OS Tendon. Ten model bêdzie doskona³ym uzupe³nieniem codziennego stroju. ;http://www.eobuwie.com.pl/media/catalog/product/cache/image/650x650/0/0/0000200809243_01_ts.jpg
298;Klapki EA7 EMPORIO ARMANI;EA7 Emporio Armani ;XCP001 XCC22 00002 Black ;Klapki i sanda³y mêskie;Klapki marki EA7 Emporio Armani. Wygodnie wyprofilowana cholewka to Tworzywo - Wysokogatunkowe tworzywo. Wk³adka to tworzywo . Podeszwa - wysokogatunkowe tworzywo. Ten model bêdzie doskona³ym uzupe³nieniem codziennego stroju. ;http://www.eobuwie.com.pl/media/catalog/product/cache/image/650x650/0/0/0000200877150_01_mk.jpg
299;Klapki Reebok;Reebok ;Fulgere Slide CN6467 Black ;Klapki i sanda³y mêskie;Kolejna, udana propozycja marki Reebok. Wygodnie wyprofilowana cholewka to Tworzywo - Wysokogatunkowe tworzywo. We wnêtrzu materia³. Komfort noszenia podnosi wk³adka: tworzywo . Podeszwa: wysokogatunkowe tworzywo, izoluje od pod³o¿a. Buty wzbogacono o technologiê EVA. Ten model bêdzie doskona³ym uzupe³nieniem codziennego stroju. ;http://www.eobuwie.com.pl/media/catalog/product/cache/image/650x650/0/0/0000200879499_pl_1_.jpg
300; Klapki adidas;adidas, adidas Performance ;adilette Aqua F35543 Cblack/Ftwwhat/Cblack ;Klapki i sanda³y mêskie;Dla aktywnych odpowiedni¹ propozycj¹ bêd¹ klapki od adidas. O komforcie modelu decyduje wykonanie - cholewka to: Tworzywo - Wysokogatunkowe tworzywo. Wygodê noszenia podnosi wyœció³ka: tworzywo. Komfort noszenia podnosi wk³adka: tworzywo . Podeszwa butów to wysokogatunkowe tworzywo. Swobodna, ciekawa propozycja stworzona z myœl¹ o wygodzie noszenia. ;http://www.eobuwie.com.pl/media/catalog/product/cache/image/650x650/0/0/0000200858586_01_ks.jpg
301;Sneakersy CALVIN KLEIN JEANS;Calvin Klein Jeans ;Tanya R0651 Black/Gold ;Pó³buty damskie;Wygodny fason marki Calvin Klein Jeans. Cholewka solidnie wykoñczona - Skóra naturalna - Zamsz, Skóra ekologiczna - Skóra ekologiczna, Materia³ - Materia³. Komfort noszenia podnosi wk³adka: materia³. Materia³ podeszwy to wysokogatunkowe tworzywo. Ten model bêdzie doskona³ym uzupe³nieniem codziennego stroju. ;http://www.eobuwie.com.pl/media/catalog/product/cache/image/650x650/0/0/0000199734526_1__ki.jpg
302;Buty adidas;adidas, adidas Originals ;Falcon W B28128 Ftwwht/Ftwwht/Crywht ;Pó³buty damskie;Przyci¹gaj¹ce uwagê buty marki adidas. W cholewce dominuje Skóra naturalna - Licowa, Nubuk, Skóra ekologiczna - Skóra ekologiczna, Materia³ - Materia³. Wk³adka to materia³. Wygodê zwiêksza odpowiednia podeszwa: wysokogatunkowe tworzywo. W butach zastosowano technologiê EVA, Ortholite, Torsion. Stylowe i przyjemne w noszeniu. ;http://www.eobuwie.com.pl/media/catalog/product/cache/image/650x650/0/0/0000200854335_01_dd_3.jpg
303;Buty NIKE;NIKE ;Mx-720-818 CI3869 001 Black/Metallic Silver/Black ;Pó³buty damskie;Klasyczna propozycja marki NIKE. W cholewce dominuje Skóra ekologiczna - Skóra ekologiczna, Materia³ - Materia³. Wk³adka to materia³. Wygodê zwiêksza odpowiednia podeszwa: wysokogatunkowe tworzywo. Model wyposa¿ono w technologiê Air Max, Dual Density. Stylowe i przyjemne w noszeniu. ;http://www.eobuwie.com.pl/media/catalog/product/cache/image/650x650/0/0/0000207985803_01_rz.jpg
304;Sneakersy SPRANDI;Sprandi ;WP07-7099-23 Cobalt Blue ;Pó³buty damskie;Wygodny fason marki Sprandi. Wygodnie wyprofilowana cholewka to Skóra ekologiczna - Skóra ekologiczna. Wk³adka to materia³. Podeszwa przyjazna dla stopy: wysokogatunkowe tworzywo. Jeœli ci¹gle pozostajesz w ruchu wybierz buty na p³askiej podeszwie. ;http://www.eobuwie.com.pl/media/catalog/product/cache/image/650x650/5/9/5903419616433_01_rz.jpg
305;Sneakersy EVA LONGORIA;Eva Longoria ;EL-18-02-0000268 636 ;Pó³buty damskie;Nowy model marki Eva Longoria. Cholewka solidnie wykoñczona - Skóra naturalna - Licowa, Zamsz. Komfort noszenia podnosi wk³adka: skóra. Podeszwa - wysokogatunkowe tworzywo. Si³a tkwi w detalu - tutaj jest to z³oty metal. Codzienna, wygodna propozycja w dobrym stylu. ;http://www.eobuwie.com.pl/media/catalog/product/cache/image/650x650/0/0/0000207721951_01_rz.jpg
306;Sneakersy TOMMY HILFIGER;Tommy Hilfiger ;Stud City Snea FW0FW03229 Rwb 020 ;Pó³buty damskie;Tommy Hilfiger znany jest przede wszystkim z doskona³ej jakoœci polówek, ale marka ma do zaoferowania du¿o wiêcej. W tym uniwersalne i eleganckie obuwie, ³¹cz¹ce klasykê ze sportowym stylem ale wyraŸnie odcinaj¹ce siê od obuwia wyczynowego.Tommy Hilfiger Stud City to uniwersalne sneakersy damskie, dla kobiet wymagaj¹cych i ceni¹cych dobry styl. Granatowe Tommy Hilfiger Stud City to kwintesencja eleganckiego, ale zarazem sportowego wygl¹du. Na nodze prezentuj¹ siê zgrabnie i podkreœlaj¹ sylwetkê.Tommy Hilfiger Stud City wyró¿nia z t³umu granatowy zamsz, b³yszcz¹ca skóra, czerwona lamówka ³¹cz¹ca podeszwê z cholewk¹ i logotyp marki wykonany z cyrkonii na boku obuwia. Model jest przeznaczony do u¿ytku codziennego.;http://www.eobuwie.com.pl/media/catalog/product/cache/image/650x650/0/0/0000200528311_01_dd.jpg
307;Sneakersy LACOSTE;Lacoste ;Carnaby Evo Bl 2 Suj 7-37SUJ0012B53 Wht/Pnk ;Pó³buty damskie;W propozycjach marki Lacoste dzieciêce, sznurowane buty. Skóra ekologiczna - Skóra ekologiczna to wierzchni¹ czêœæ cholewki. We wnêtrzu materia³, co sprawia, ¿e buty zachowuj¹ dobre w³aœciwoœci higieniczne. Nie zabrak³o ch³onnej wk³adki, to materia³. W podeszwie zastosowano wysokogatunkowe tworzywo. Buty wzbogacono o technologiê Ortholite. Buty gwarantuj¹ wygodê na co dzieñ i nie ograniczaj¹ ruchu stopy. ;http://www.eobuwie.com.pl/media/catalog/product/cache/image/650x650/0/0/0000201012192_01_pz.jpg
308;Sneakersy KARL LAGERFELD;KARL LAGERFELD ;KL61616 White Lthr/Text w/Blk ;Pó³buty damskie;Wygodny fason marki KARL LAGERFELD. Wygodnie wyprofilowana cholewka to Skóra naturalna - Licowa, Materia³ - Materia³. We wnêtrzu wk³adka: skóra. Podeszwa przyjazna dla stopy: wysokogatunkowe tworzywo. Si³a tkwi w detalu - tutaj jest to metal, ozdoba jest odpinana. Codzienna, wygodna propozycja w dobrym stylu. ;http://www.eobuwie.com.pl/media/catalog/product/cache/image/650x650/0/0/0000207560581_02_rz.jpg
309;Buty VIBRAM FIVEFINGERS;Vibram Fivefingers ;V-Trek 18W7401 Black/Gum ;Pó³buty damskie;Modna propozycja marki Vibram Fivefingers. Lekki wygl¹d zawdziêczaj¹ cholewce: Materia³ - Materia³. We wnêtrzu butów znajduje siê wk³adka: materia³. Podeszwa to wysokogatunkowe tworzywo. Buty wzbogacono o technologiê 4 mm Drop, Megagrip, Vibram. Buty na co dzieñ - ponadczasowe i uniwersalne. ;http://www.eobuwie.com.pl/media/catalog/product/cache/image/650x650/0/0/0000207492660_01_sw_1.jpg
310;Sneakersy GINO ROSSI;Gino Rossi ;Yuka DTI775-Y15-0878-9999-T 99/99 ;Pó³buty damskie;Wygodny fason marki Gino Rossi. Cholewka solidnie wykoñczona - Skóra naturalna - Licowa, Zamsz. Komfort noszenia podnosi wk³adka: skóra. Podeszwa przyjazna dla stopy: wysokogatunkowe tworzywo. Jeœli ci¹gle pozostajesz w ruchu wybierz buty na p³askiej podeszwie. ;http://www.eobuwie.com.pl/media/catalog/product/cache/image/650x650/0/0/0000206248527_01_tm.jpg
311;Sneakersy NEW BALANCE;New Balance ;WL574CLD Bia³y ;Pó³buty damskie;Przyci¹gaj¹ce uwagê buty marki New Balance. Cholewka wyprofilowana z najlepszych surowców: Skóra ekologiczna - Skóra ekologiczna. Wk³adka to materia³. Podeszwa to wysokogatunkowe tworzywo. Buty wzbogacono o technologiê ENCAP. Miejski styl i swobodna elegancja. ;http://www.eobuwie.com.pl/media/catalog/product/cache/image/650x650/0/0/0000207744448_01_rz.jpg
312;Buty NIKE;NIKE ;Air Max 200 AT6175 002 Pure Platinum/White/Cool Grey ;Pó³buty damskie;Nowy model marki NIKE. Cholewka solidnie wykoñczona - Skóra ekologiczna - Skóra ekologiczna, Materia³ - Materia³. We wnêtrzu wk³adka: materia³. Podeszwa - wysokogatunkowe tworzywo. Model wyposa¿ono w technologiê Air Max, Cushlon, Max Air, Nike Air, TPU. Ten model bêdzie doskona³ym uzupe³nieniem codziennego stroju. ;http://www.eobuwie.com.pl/media/catalog/product/cache/image/650x650/0/0/0000207996922_01_rz.jpg
313;Sneakersy BIG STAR;Big Star ;GG274083 Lt.Pink ;Pó³buty damskie;Nowy model marki BIG STAR. Cholewka solidnie wykoñczona - Skóra ekologiczna - Skóra ekologiczna. We wnêtrzu wk³adka: materia³. Podeszwa - wysokogatunkowe tworzywo. Jeœli ci¹gle pozostajesz w ruchu wybierz buty na p³askiej podeszwie. ;http://www.eobuwie.com.pl/media/catalog/product/cache/image/650x650/0/0/0000207434172_01_mg.jpg
314;Sneakersy TOGOSHI;Togoshi ;TG-22-05-000261 644 ;Pó³buty damskie;Nowy model marki Togoshi. Wygodnie wyprofilowana cholewka to Skóra naturalna - Licowa, Zamsz. Wk³adka to skóra ekologiczna. Podeszwa - wysokogatunkowe tworzywo. Jeœli ci¹gle pozostajesz w ruchu wybierz buty na p³askiej podeszwie. ;http://www.eobuwie.com.pl/media/catalog/product/cache/image/650x650/0/0/0000207460737_01_rz.jpg
315;Sneakersy TOMMY JEANS;Tommy Jeans ;High Cleated Tommy Jeans Sneaker EN0EN00948 Black BDS ;Pó³buty damskie;Ciekawa propozycja marki Tommy Jeans. Cholewka dopasowuje siê do stopy - Skóra naturalna - Licowa, Skóra ekologiczna - Skóra ekologiczna. Wnêtrze oddychaj¹ce: materia³. Wk³adka to materia³. Podeszwa to wysokogatunkowe tworzywo. Dobra alternatywa dla obcasów - wygodne koturny ;http://www.eobuwie.com.pl/media/catalog/product/cache/image/650x650/0/0/0000207168046_01_rz.jpg
316;Sneakersy PUMA;Puma ;Cali Superbold Jr 374270 01 Puma White/Burgundy ;Pó³buty damskie;Wygodne, sznurowane buty dzieciêce marki Puma. Wytrzyma³a cholewka to Skóra naturalna - Licowa, Skóra ekologiczna - Skóra ekologiczna. Wnêtrze oddychaj¹ce, jego g³ównym sk³adnikiem jest materia³. Wk³adka w tych butach to skóra ekologiczna, zwiêksza komfort noszenia. Podeszwa to wysokogatunkowe tworzywo. Buty gwarantuj¹ wygodê na co dzieñ i nie ograniczaj¹ ruchu stopy. ;http://www.eobuwie.com.pl/media/catalog/product/cache/image/650x650/0/0/0000207345164_01_mt.jpg
317;Sneakersy TRUSSARDI JEANS;Trussardi Jeans ;79A00549 P724 ;Pó³buty damskie;Wygodny fason marki Trussardi Jeans. Do charakteru butów pasuje cholewka: Skóra naturalna - Zamsz, Materia³ - Materia³. We wnêtrzu wk³adka: materia³. Materia³ podeszwy to wysokogatunkowe tworzywo. Ten model bêdzie doskona³ym uzupe³nieniem codziennego stroju. ;http://www.eobuwie.com.pl/media/catalog/product/cache/image/650x650/0/0/0000207539129_01_rz.jpg
318;Sneakersy NEW BALANCE;New Balance ;U410CB Granatowy ;Pó³buty damskie;Klasyczne sneakersy z nowej kolekcji New Balance przypadn¹ do gustu kobietom ceni¹cym modne i wygodne dodatki! Granatowa cholewka z przewiewnego materia³u zosta³a wzmocniona wstawkami z licowej skóry. Miêkki jêzyk niweluje nacisk klasycznego sznurowania. Tekstylna wyœció³ka oraz wk³adka pozwalaj¹ stopie oddychaæ. Elastyczna podeszwa œrodkowa lekko amortyzuje, natomiast antypoœlizgowy bie¿nik odznacza siê bardzo dobr¹ przyczepnoœci¹. Lekkie zakrzywienie obuwia pozwala na p³ynniejszy ruch. Szare logo New Balance podkreœla markê produktu. ;http://www.eobuwie.com.pl/media/catalog/product/cache/image/650x650/8/0/803577_new_balance_u410cb_classics_niebieski_ac_01.jpg
319;Buty adidas;adidas, adidas Originals ;X_Plr J BY9879 Cblack/Cblack/Cblack ;Pó³buty damskie;W tym sezonie postaw na oryginalne dodatki i wybierz buty z nowej kolekcji adidas Originals! Przewiewna cholewka z siateczki mesh wspó³gra z naturalnym ruchem nogi. Wzmocnienia z ekologicznej skóry po bokach stabilizuj¹ sylwetkê. Elastyczny system sznurowania z gumowym stoperem zapewnia optymalne dopasowanie i pozwala na szybkie zak³adanie. Wyjmowana (technologia adiFIT) wk³adka z antybakteryjn¹ technologi¹ Ortholite dostosowuje siê do kszta³tu stopy. Dziêki œrodkowej podeszwie z piank¹ EVA, która absorbuje wstrz¹sy, ka¿dy krok jest lekki. Antypoœlizgowy bie¿nik z odpornej na œcieranie gumy odznacza siê bardzo dobr¹ przyczepnoœci¹. ;http://www.eobuwie.com.pl/media/catalog/product/cache/image/650x650/0/0/0000199808715_1__jf.jpg
320;Sneakersy NEW BALANCE;New Balance ;WL393SP1 Ró¿owy ;Pó³buty damskie;Nowy model marki New Balance. Do charakteru butów pasuje cholewka: Skóra naturalna - Zamsz, Skóra ekologiczna - Skóra ekologiczna, Materia³ - Materia³. Komfort noszenia podnosi wk³adka: materia³. Materia³ podeszwy to wysokogatunkowe tworzywo. W butach zastosowano technologiê EVA. Codzienna, wygodna propozycja w dobrym stylu. ;http://www.eobuwie.com.pl/media/catalog/product/cache/image/650x650/0/0/0000208050678_01_mg.jpg
321;Sneakersy CALVIN KLEIN JEANS;Calvin Klein Jeans ;Reika R0666 Black/Silver ;Pó³buty damskie;Nowy model marki Calvin Klein Jeans. Wygodnie wyprofilowana cholewka to Materia³ - Materia³, Tworzywo - Wysokogatunkowe tworzywo. Wk³adka to materia³. Podeszwa - wysokogatunkowe tworzywo. Ten model bêdzie doskona³ym uzupe³nieniem codziennego stroju. ;http://www.eobuwie.com.pl/media/catalog/product/cache/image/650x650/0/0/0000199792618_1__ki.jpg
322;Buty Reebok;Reebok, Reebok Classic ;Cl Lthr 2232 White ;Pó³buty damskie;Nowy model marki Reebok. Wygodnie wyprofilowana cholewka to Skóra naturalna - Licowa. We wnêtrzu wk³adka: materia³. Podeszwa - wysokogatunkowe tworzywo. W butach zastosowano technologiê EVA. Codzienna, wygodna propozycja w dobrym stylu. ;http://www.eobuwie.com.pl/media/catalog/product/cache/image/650x650/0/0/0000191811454_01_sw.jpg
323;Sneakersy MICHAEL MICHAEL KORS;MICHAEL Michael Kors ;Spencer Trainer 43F0SPFS3D Camel ;Pó³buty damskie;Koturny od MICHAEL Michael Kors. Cholewka dopasowuje siê do stopy - Skóra naturalna - Zamsz, Skóra ekologiczna - Skóra ekologiczna, Materia³ - Materia³. Oparte na stabilnym koturnie o wysokoœci 8 cm. W œrodku buty posiadaj¹ wyœció³kê - materia³. Komfort noszenia podnosi wk³adka: materia³, skóra ekologiczna. Materia³ podeszwy to wysokogatunkowe tworzywo. Wysmuklaj¹ sylwetkê i sprawdzaj¹ siê w ró¿nych sytuacjach. ;http://www.eobuwie.com.pl/media/catalog/product/cache/image/650x650/0/0/0000207820111_01_mk.jpg
324;Trampki CONVERSE;Converse ;Ctas Ox 566728C White/Gold/Rose Maroon ;Pó³buty damskie;Modna propozycja marki Converse. Lekki wygl¹d zawdziêczaj¹ cholewce: Skóra ekologiczna - Skóra ekologiczna. Materia³ podeszwy to guma. Ponadczasowa klasyka gatunku. ;http://www.eobuwie.com.pl/media/catalog/product/cache/image/650x650/0/0/0000207021488_1_.jpg
325;Tenisówki VANS;Vans ;Old Skool VN000D3HY28 Black/White ;Pó³buty damskie;Przyci¹gaj¹ce uwagê Vans. Cholewka butów to Skóra naturalna - Licowa, Materia³ - Materia³. Materia³ podeszwy to guma. Ponadczasowa klasyka gatunku. ;http://www.eobuwie.com.pl/media/catalog/product/cache/image/650x650/0/0/0000197850310-vans-old_skool_d3hy28_black_white-ap-001.jpg
326;Tenisówki VANS;Vans ;Era VN0A4U398KI1 (Ditsy Floral)Blk/Truewht ;Pó³buty damskie;Wygodne, sznurowane buty dzieciêce marki Vans. Materia³ - Materia³ to wierzchni¹ czêœæ cholewki. We wnêtrzu materia³, skóra ekologiczna, co sprawia, ¿e buty zachowuj¹ dobre w³aœciwoœci higieniczne. We wnêtrzu butów znajduje siê wk³adka: materia³. W podeszwie zastosowano guma. Buty gwarantuj¹ wygodê na co dzieñ i nie ograniczaj¹ ruchu stopy. ;http://www.eobuwie.com.pl/media/catalog/product/cache/image/650x650/0/0/0000207373365_01_mg.jpg
327;Tenisówki BIG STAR;Big Star ;GG274087 Navy ;Pó³buty damskie;Wygodny fason marki BIG STAR. Do charakteru butów pasuje cholewka: Skóra ekologiczna - Skóra ekologiczna. We wnêtrzu wk³adka: materia³. Materia³ podeszwy to guma. Codzienna, wygodna propozycja w dobrym stylu. ;http://www.eobuwie.com.pl/media/catalog/product/cache/image/650x650/0/0/0000207434233_rz_1_.jpg
328;Sneakersy CALVIN KLEIN JEANS;Calvin Klein Jeans ;Beth R0648 Black/Gold ;Pó³buty damskie;Ciekawa propozycja marki Calvin Klein Jeans. O wygodzie butów decyduje cholewka: Skóra naturalna - Licowa, Zamsz, Materia³ - Materia³. Wygodn¹ alternatyw¹ dla obcasa jest koturn - w tym modelu ma wysokoœæ 8 cm. We wnêtrzu butów materia³. Komfort noszenia podnosi wk³adka: materia³. Materia³ podeszwy to wysokogatunkowe tworzywo. Dobra alternatywa dla obcasów - wygodne koturny ;http://www.eobuwie.com.pl/media/catalog/product/cache/image/650x650/0/0/0000199734441_1__ts.jpg
329;Sneakersy VANS;Vans ;Sk8-Hi Mte 2.0 Dx VN0A4P3I2UQ1 (Mte) Blue Block/Marshmlw ;Pó³buty damskie;Klasyczna propozycja marki Vans. Cholewka wyprofilowana z najlepszych surowców: Skóra naturalna - Zamsz. We wnêtrzu butów znajduje siê wk³adka: materia³. Podeszwa to guma. Model wyposa¿ono w technologiê MTE 360™, Ultra Cush. Buty na co dzieñ - ponadczasowe i uniwersalne. ;http://www.eobuwie.com.pl/media/catalog/product/cache/image/650x650/0/0/0000207852976_rz__01.jpg
330;Sneakersy GEOX;Geox ;D Leelu' G D94FFG 08522 C1000 White ;Pó³buty damskie;Wygodny fason marki Geox. Cholewka solidnie wykoñczona - Skóra naturalna - Licowa, Zamsz. Wk³adka to skóra. Podeszwa - wysokogatunkowe tworzywo. Buty wzbogacono o technologiê Geox Respira. Jeœli ci¹gle pozostajesz w ruchu wybierz buty na p³askiej podeszwie. ;http://www.eobuwie.com.pl/media/catalog/product/cache/image/650x650/0/0/0000208025409_01_rz.jpg
331;Sneakersy SPRANDI;Sprandi ;WP07-91305-01 Cobalt Blue ;Pó³buty damskie;Propozycja marki Sprandi. Cholewka solidnie wykoñczona - Skóra naturalna - Zamsz, Materia³ - Materia³. Wk³adka to materia³. Podeszwa - wysokogatunkowe tworzywo. Jeœli ci¹gle pozostajesz w ruchu wybierz buty na p³askiej podeszwie. ;http://www.eobuwie.com.pl/media/catalog/product/cache/image/650x650/5/9/5903419616372_01_rz.jpg
332;Szpilki GINO ROSSI;Gino Rossi ;DCK073-MIYA Beige 1 ;Pó³buty damskie;Zgrabny fason na obcasie od Gino Rossi. Cholewka przyjemnie wyprofilowana - Skóra naturalna - Licowa. Fason wyposa¿ono w obcas o wysokoœci 10,5 cm. We wnêtrzu butów wyœció³ka: skóra. Komfort noszenia podnosi wk³adka: skóra. Materia³ podeszwy to wysokogatunkowe tworzywo. Model na obcasie unosi sylwetkê i dodaje jej lekkoœci. ;http://www.eobuwie.com.pl/media/catalog/product/cache/image/650x650/5/9/5903698063287_01_pa.jpg
333;Szpilki TOMMY HILFIGER;Tommy Hilfiger ;Essential High Heel Pump FW0FW05136 Black BDS ;Pó³buty damskie;Model na obcasie TOMMY HILFIGER. Cholewka przyjemnie wyprofilowana - Materia³ - Materia³. Fason wyposa¿ono w obcas o wysokoœci 8,5 cm. Wnêtrze materia³. Wk³adka to skóra. Podeszwa - wysokogatunkowe tworzywo. Model na obcasie unosi sylwetkê i dodaje jej lekkoœci. ;http://www.eobuwie.com.pl/media/catalog/product/cache/image/650x650/0/0/0000207373440_01_mg_2.jpg
334;Szpilki R.POLAÑSKI;R.Polañski ;1042 Ró¿owy Lico ;Pó³buty damskie;Elegancka propozycja marki R.Polañski. Cholewka butów wykonana starannie - Skóra naturalna - Licowa. Fason wyposa¿ono w obcas o wysokoœci 9 cm. Wygodê noszenia podnosi wyœció³ka: skóra. Wk³adka to skóra. Podeszwa - wysokogatunkowe tworzywo. Kobiece, zgrabne podkreœlaj¹ liniê ³ydek i czyni¹ sylwetkê smuklejsz¹. ;http://www.eobuwie.com.pl/media/catalog/product/cache/image/650x650/0/0/0000208029926_01_bs_kopia.jpg
335;Szpilki GINO ROSSI;Gino Rossi ;Miya DCI563-CW7-0760-7700-0 83 ;Pó³buty damskie;Elegancka propozycja marki Gino Rossi. Cholewka butów wykonana starannie - Skóra naturalna - Zamsz. Sylwetkê podkreœla obcas o wysokoœci 10,5 cm. Wnêtrze skóra. Komfort noszenia podnosi wk³adka: skóra. Materia³ podeszwy to wysokogatunkowe tworzywo. Buty wyró¿nia ozdoba: srebrny metal. Kobiece, zgrabne podkreœlaj¹ liniê ³ydek i czyni¹ sylwetkê smuklejsz¹. ;http://www.eobuwie.com.pl/media/catalog/product/cache/image/650x650/0/0/0000206247209_01_pac.jpg
336;Sneakersy TOMMY HILFIGER;Tommy Hilfiger ;Tommy Retro Branded Sneaker FW0FW04305 Black 990 ;Pó³buty damskie;Nowy model marki TOMMY HILFIGER. Wygodnie wyprofilowana cholewka to Skóra naturalna - Licowa, Skóra ekologiczna - Skóra ekologiczna, Materia³ - Materia³. Komfort noszenia podnosi wk³adka: materia³. Podeszwa - wysokogatunkowe tworzywo. Jeœli ci¹gle pozostajesz w ruchu wybierz buty na p³askiej podeszwie. ;http://www.eobuwie.com.pl/media/catalog/product/cache/image/650x650/0/0/0000206273734_01_pz.jpg
337;Buty adidas;adidas, adidas Originals ; Superstar J EF5399 Ftwwht/Ftwwht/Ftwwht ;Pó³buty damskie;W propozycjach marki adidas dzieciêce, sznurowane trzewiki. Wierzchni¹ czêœæ cholewki stanowi Skóra naturalna - Licowa. We wnêtrzu materia³, co sprawia, ¿e buty zachowuj¹ dobre w³aœciwoœci higieniczne We wnêtrzu butów znajduje siê wk³adka: materia³. W podeszwie zastosowano wysokogatunkowe tworzywo. Model wyposa¿ono w technologiê Ortholite. Buty odpowiadaj¹ potrzebom rozwijaj¹cej siê stopy, zapewniaj¹c jej swobodê ruchu, ale tak¿e lekk¹ stabilizacjê. ;http://www.eobuwie.com.pl/media/catalog/product/cache/image/650x650/0/0/0000206708250_01_pac.jpg
338;Sneakersy EVA MINGE;Eva Minge ;EM-60-08-001123 110 ;Pó³buty damskie;Nowy model marki Eva Minge. Wygodnie wyprofilowana cholewka to Skóra naturalna - Licowa. Komfort noszenia podnosi wk³adka: skóra ekologiczna. Podeszwa - wysokogatunkowe tworzywo. Ten model bêdzie doskona³ym uzupe³nieniem codziennego stroju. ;http://www.eobuwie.com.pl/media/catalog/product/cache/image/650x650/0/0/0000207953758_01_bs_kopia.jpg
339;Sneakersy BIG STAR;Big Star ;GG274082 Navy ;Pó³buty damskie;Wygodny fason marki BIG STAR. Cholewka solidnie wykoñczona - Skóra ekologiczna - Skóra ekologiczna. Komfort noszenia podnosi wk³adka: materia³. Podeszwa przyjazna dla stopy: wysokogatunkowe tworzywo. Jeœli ci¹gle pozostajesz w ruchu wybierz buty na p³askiej podeszwie. ;http://www.eobuwie.com.pl/media/catalog/product/cache/image/650x650/0/0/0000207434158_01_mt.jpg
340;Sneakersy KARL LAGERFELD;KARL LAGERFELD ;KL61781 Black Glitter W/Silver ;Pó³buty damskie;Nowy model marki KARL LAGERFELD. Cholewka solidnie wykoñczona - Skóra naturalna - Licowa, Zamsz, Materia³ - Materia³. Komfort noszenia podnosi wk³adka: skóra. Podeszwa - wysokogatunkowe tworzywo. Jeœli ci¹gle pozostajesz w ruchu wybierz buty na p³askiej podeszwie. ;http://www.eobuwie.com.pl/media/catalog/product/cache/image/650x650/0/0/0000207560673_01_kt.jpg
341;Sneakersy NEW BALANCE;New Balance ;WL996WE Be¿owy ;Pó³buty damskie;Propozycja marki New Balance. Do charakteru butów pasuje cholewka: Skóra naturalna - Zamsz. Wk³adka to materia³. Podeszwa - wysokogatunkowe tworzywo. Buty wzbogacono o technologiê EVA. Ten model bêdzie doskona³ym uzupe³nieniem codziennego stroju. ;http://www.eobuwie.com.pl/media/catalog/product/cache/image/650x650/0/0/0000207744707_01_rz.jpg
342;Buty NIKE;NIKE ;Air Max 2090 (Gs) CJ4066 003 Platinum Tint/Blackened Blue ;Pó³buty damskie;Wygodny fason marki NIKE. Do charakteru butów pasuje cholewka: Materia³ - Materia³. Wk³adka to materia³. Podeszwa - wysokogatunkowe tworzywo. Buty wzbogacono o technologiê Air Max, Nike Air. Ten model bêdzie doskona³ym uzupe³nieniem codziennego stroju. ;http://www.eobuwie.com.pl/media/catalog/product/cache/image/650x650/0/0/0000208224727_01_ks.jpg
343;Sneakersy KARL LAGERFELD;KARL LAGERFELD ;KL61230 White Lthr ;Pó³buty damskie;Wygodny fason marki KARL LAGERFELD. Do charakteru butów pasuje cholewka: Skóra naturalna - Licowa. Wk³adka to skóra. Materia³ podeszwy to wysokogatunkowe tworzywo. Ten model bêdzie doskona³ym uzupe³nieniem codziennego stroju. ;http://www.eobuwie.com.pl/media/catalog/product/cache/image/650x650/0/0/0000201681138_01_ap.jpg
344;Pó³buty BALDOWSKI;Baldowski ;D03270-4330-001 Nappa Czarna ;Pó³buty damskie;Zgrabny fason na obcasie od Baldowski. Dobrze uk³adaj¹ca siê na stopie cholewka to Skóra naturalna - Licowa. Lekkoœci kroku dodaj¹ obcasy o wysokoœci 6 cm. Wnêtrze skóra. Wk³adka to skóra. Podeszwa - wysokogatunkowe tworzywo. Stylowa ozdoba dodaje butom wdziêku: ozdoba nie jest odpinana , z³oty metal. Model na obcasie unosi sylwetkê i dodaje jej lekkoœci. ;http://www.eobuwie.com.pl/media/catalog/product/cache/image/650x650/0/0/0000207640290_01_rz.jpg
