ID;Nazwa;Marka;Model;Kategoria;Opis;Cena;URL_zdjecia
1;Trzewiki NEW BALANCE;New Balance ;Classics H754LLB Br¹zowy ;Pó³buty mêskie;Modna propozycja marki New Balance. W cholewce dominuje Skóra naturalna - Licowa, Materia³ - Materia³. We wnêtrzu butów materia³. We wnêtrzu butów znajduje siê wk³adka: materia³. Wygodê zwiêksza odpowiednia podeszwa: wysokogatunkowe tworzywo. Stylowe i przyjemne w noszeniu buty codzienne. ;http://www.eobuwie.com.pl/media/catalog/product/cache/image/650x650/7/3/736627_new_balance_h754llb__01_kopia.jpg
2;Sneakersy EA7 EMPORIO ARMANI;EA7 Emporio Armani ;X8X027 XK050 M701 Triple Black/Gold ;Pó³buty mêskie;Klasyczna propozycja marki EA7 Emporio Armani. Cholewka wyprofilowana z najlepszych surowców: Skóra ekologiczna - Skóra ekologiczna, Materia³ - Materia³, Tworzywo - Wysokogatunkowe tworzywo. Posiadaj¹ wyœció³kê - to materia³. Wk³adka to materia³. Materia³ podeszwy to wysokogatunkowe tworzywo. Buty na co dzieñ - ponadczasowe i uniwersalne. ;http://www.eobuwie.com.pl/media/catalog/product/cache/image/650x650/0/0/0000206624154_1_.jpg
3;Buty adidas;adidas, adidas Originals ;Superstar FW2652 Conavy/Conavy/Owhite ;Pó³buty mêskie;Przyci¹gaj¹ce uwagê buty marki adidas. Cholewka wyprofilowana z najlepszych surowców: Skóra ekologiczna - Skóra ekologiczna, Materia³ - Materia³. We wnêtrzu butów materia³, skóra ekologiczna. Komfort noszenia podnosi wk³adka: materia³. Materia³ podeszwy to wysokogatunkowe tworzywo. Model wyposa¿ono w technologiê Ortholite. Stylowe i przyjemne w noszeniu buty codzienne. ;http://www.eobuwie.com.pl/media/catalog/product/cache/image/650x650/0/0/0000206875136_03_pl.jpg
4;Sneakersy CALVIN KLEIN JEANS;Calvin Klein Jeans ;Jerrold B4S0717 White/Silver ;Pó³buty mêskie;Klasyczna propozycja marki Calvin Klein Jeans. Cholewka wyprofilowana z najlepszych surowców: Materia³ - Materia³. We wnêtrzu butów skóra ekologiczna. Wk³adka to materia³. Wygodê zwiêksza odpowiednia podeszwa: wysokogatunkowe tworzywo. Stylowe i przyjemne w noszeniu buty codzienne. ;http://www.eobuwie.com.pl/media/catalog/product/cache/image/650x650/0/0/0000207763050_01_rz.jpg
5;Sneakersy RAGE AGE;Rage Age ; RA-15-02-000073 108 ;Pó³buty mêskie;Przyci¹gaj¹ce uwagê buty marki Rage Age. Lekki wygl¹d zawdziêczaj¹ cholewce: Skóra naturalna - Licowa. Posiadaj¹ wyœció³kê - to materia³, skóra ekologiczna. We wnêtrzu butów znajduje siê wk³adka: skóra ekologiczna. Materia³ podeszwy to wysokogatunkowe tworzywo. Te buty to miejski styl w dobrym wydaniu. ;http://www.eobuwie.com.pl/media/catalog/product/cache/image/650x650/0/0/0000207499874_01_rz.jpg
6;Sneakersy TOMMY HILFIGER;Tommy Hilfiger ;B2285RANSON 8C1 FM0FM03232 Twilight 005 ;Pó³buty mêskie;Modna propozycja marki TOMMY HILFIGER. W cholewce dominuje Skóra naturalna - Zamsz, Materia³ - Materia³. We wnêtrzu butów materia³. Wk³adka to materia³. Podeszwa to wysokogatunkowe tworzywo. Buty na co dzieñ - ponadczasowe i uniwersalne. ;http://www.eobuwie.com.pl/media/catalog/product/cache/image/650x650/0/0/0000207171022_01_rz.jpg
7;Sneakersy CALVIN KLEIN;Calvin Klein ;Parker B4F2281 Black ;Pó³buty mêskie;Modna propozycja marki Calvin Klein. Lekki wygl¹d zawdziêczaj¹ cholewce: Materia³ - Materia³. We wnêtrzu butów materia³. Komfort noszenia podnosi wk³adka: skóra ekologiczna. Podeszwa to wysokogatunkowe tworzywo. Te buty to miejski styl w dobrym wydaniu. ;http://www.eobuwie.com.pl/media/catalog/product/cache/image/650x650/0/0/0000207763906_01_mk.jpg
8;Sneakersy PUMA;Puma ;Vista Mid Wtr 369783 01 Puma Black/Puma White ;Pó³buty mêskie;Modna propozycja marki Puma. W cholewce dominuje Skóra naturalna - Licowa, Zamsz, Materia³ - Materia³. Wewnêtrzna wyœció³ka to futerko, ocieplenie. Wk³adka to materia³. Materia³ podeszwy to wysokogatunkowe tworzywo. W butach zastosowano technologiê CMEVA, SoftFoam. Stylowe i przyjemne w noszeniu buty codzienne. ;http://www.eobuwie.com.pl/media/catalog/product/cache/image/650x650/0/0/0000201258613_01_pp.jpg
9;Sneakersy NEW BALANCE;New Balance ;ML311CB2 Szary ;Pó³buty mêskie;Klasyczna propozycja marki New Balance. W cholewce dominuje Skóra naturalna - Zamsz, Materia³ - Materia³. Posiadaj¹ wyœció³kê - to materia³. We wnêtrzu butów znajduje siê wk³adka: materia³. Materia³ podeszwy to wysokogatunkowe tworzywo. Model wyposa¿ono w technologiê EVA. Stylowe i przyjemne w noszeniu buty codzienne. ;http://www.eobuwie.com.pl/media/catalog/product/cache/image/650x650/0/0/0000207744752_01_rz.jpg
10;Sneakersy NEW BALANCE;New Balance ;CM997HFV Bordowy ;Pó³buty mêskie;Modna propozycja marki New Balance. W cholewce dominuje Skóra naturalna - Zamsz, Materia³ - Materia³. Posiadaj¹ wyœció³kê - to materia³. Wk³adka to materia³. Podeszwa to wysokogatunkowe tworzywo. Buty na co dzieñ - ponadczasowe i uniwersalne. ;http://www.eobuwie.com.pl/media/catalog/product/cache/image/650x650/0/0/0000207743878_01_kt.jpg
11;Sneakersy LACOSTE;Lacoste ;Novas 0120 1 Sma 7-40SMA0012082 Wht/Grn ;Pó³buty mêskie;Klasyczna propozycja marki Lacoste. Cholewka wyprofilowana z najlepszych surowców: Skóra naturalna - Licowa, Skóra ekologiczna - Skóra ekologiczna. Wewnêtrzna wyœció³ka to materia³. We wnêtrzu butów znajduje siê wk³adka: materia³. Podeszwa to wysokogatunkowe tworzywo. Model wyposa¿ono w technologiê Ortholite. Stylowe i przyjemne w noszeniu buty codzienne. ;http://www.eobuwie.com.pl/media/catalog/product/cache/image/650x650/0/0/0000207816756_01_ki.jpg
12;Trekkingi MERRELL;Merrell ;Annex Trak Low J91803 Sodalite ;Pó³buty mêskie;Buty outdoorowe marki Merrell. Cholewka butów to Skóra naturalna - Nubuk, Materia³ - Materia³. We wnêtrzu butów znajduje siê wk³adka: materia³. Podeszwa o dobrej trakcji to wysokogatunkowe tworzywo. Buty wzbogacono o technologiê EVA, Merrell Select FIT.ECO, Protective Rubber Toe Cap, Vibram. Idealne buty na bardziej wymagaj¹cy teren. ;http://www.eobuwie.com.pl/media/catalog/product/cache/image/650x650/0/0/0000199855115_1__ek.jpg
13;Trekkingi MERRELL;Merrell ;Alverstone J48529 Castlerock ;Pó³buty mêskie;Buty outdoorowe marki Merrell. Wytrzyma³a cholewka to Skóra naturalna - Zamsz, Materia³ - Materia³, Tworzywo - Wysokogatunkowe tworzywo. Komfort noszenia podnosi wk³adka: materia³. Podeszwa odpowiednia do mokrych i œliskich powierzchni: wysokogatunkowe tworzywo. W butach zastosowano technologiê EVA, Merrell Select Fresh, Merrell Select Grip. Idealne buty na bardziej wymagaj¹cy teren. ;http://www.eobuwie.com.pl/media/catalog/product/cache/image/650x650/0/0/0000206313676_01_mf.jpg
14;Trekkingi SALOMON;Salomon ;Xa Collider 411135 38 V0 Red Ochre/Black/Cherry Tomato ;Pó³buty mêskie;W kolekcji marki Salomon na uwagê zas³uguje ten model. Wytrzyma³a cholewka to Skóra ekologiczna - Skóra ekologiczna, Materia³ - Materia³. Wk³adka to materia³. Podeszwa odpowiednia do mokrych i œliskich powierzchni: wysokogatunkowe tworzywo. W butach zastosowano technologiê Contagrip, EnergyCell+, Ortholite. To bezpieczne obuwie terenowe. ;http://www.eobuwie.com.pl/media/catalog/product/cache/image/650x650/0/0/0000208142410_01_pa.jpg
15;Sneakersy TOGOSHI;Togoshi ;TG-12-05-000295 609 ;Pó³buty mêskie;Klasyczna propozycja marki Togoshi. Cholewka wyprofilowana z najlepszych surowców: Skóra naturalna - Licowa, Zamsz, Materia³ - Materia³. Wewnêtrzna wyœció³ka to materia³. Komfort noszenia podnosi wk³adka: materia³. Podeszwa to wysokogatunkowe tworzywo. Model wyposa¿ono w technologiê CoolMax. Buty na co dzieñ - ponadczasowe i uniwersalne. ;http://www.eobuwie.com.pl/media/catalog/product/cache/image/650x650/0/0/0000207565883_01_ki.jpg
16;Sneakersy TOMMY JEANS;Tommy Jeans ;Midcut Lace Up Vulc EM0EM00485BDS Black BDS ;Pó³buty mêskie;Przyci¹gaj¹ce uwagê buty marki Tommy Jeans. Cholewka wyprofilowana z najlepszych surowców: Materia³ - Materia³. Wewnêtrzna wyœció³ka to materia³. We wnêtrzu butów znajduje siê wk³adka: materia³. Wygodê zwiêksza odpowiednia podeszwa: wysokogatunkowe tworzywo. Te buty to miejski styl w dobrym wydaniu. ;http://www.eobuwie.com.pl/media/catalog/product/cache/image/650x650/0/0/0000207161092_01_ts.jpg
17;Trekkingi THE NORTH FACE;The North Face ;Back To Berkeley Low Wp NF0A4OBSU6V1 Coffee Brown/Tnf Black ;Pó³buty mêskie;Buty outdoorowe marki The North Face. Cholewka butów to Skóra naturalna - Nubuk. Wk³adka to materia³. Podeszwa o dobrej trakcji to wysokogatunkowe tworzywo. Buty wzbogacono o technologiê DryVent™, EVA, Icepick, Ortholite, TPU, Winter Grip. Dobre buty dla wymagaj¹cych u¿ytkowników. ;http://www.eobuwie.com.pl/media/catalog/product/cache/image/650x650/0/0/0000207580299_01_rz.jpg
18;Sneakersy CALVIN KLEIN JEANS;Calvin Klein Jeans ;Joele B4S0716 Black ;Pó³buty mêskie;Klasyczna propozycja marki Calvin Klein Jeans. Lekki wygl¹d zawdziêczaj¹ cholewce: Skóra ekologiczna - Skóra ekologiczna, Materia³ - Materia³. Posiadaj¹ wyœció³kê - to materia³, skóra ekologiczna. We wnêtrzu butów znajduje siê wk³adka: materia³. Wygodê zwiêksza odpowiednia podeszwa: wysokogatunkowe tworzywo. Stylowe i przyjemne w noszeniu buty codzienne. ;http://www.eobuwie.com.pl/media/catalog/product/cache/image/650x650/0/0/0000207762978_01_rz.jpg
19;Sneakersy TOMMY HILFIGER;Tommy Hilfiger ;Iconic Suede Runner FM0FM03001 Desert Sky DW5 ;Pó³buty mêskie;Przyci¹gaj¹ce uwagê buty marki TOMMY HILFIGER. W cholewce dominuje Skóra naturalna - Zamsz, Skóra ekologiczna - Skóra ekologiczna. Wewnêtrzna wyœció³ka to materia³. We wnêtrzu butów znajduje siê wk³adka: materia³. Podeszwa to wysokogatunkowe tworzywo. Te buty to miejski styl w dobrym wydaniu. ;http://www.eobuwie.com.pl/media/catalog/product/cache/image/650x650/0/0/0000207371019_01_rz.jpg
20;Sneakersy NEW BALANCE;New Balance ;U410CB Granatowy ;Pó³buty mêskie;Klasyczne sneakersy z nowej kolekcji New Balance przypadn¹ do gustu kobietom ceni¹cym modne i wygodne dodatki! Granatowa cholewka z przewiewnego materia³u zosta³a wzmocniona wstawkami z licowej skóry. Miêkki jêzyk niweluje nacisk klasycznego sznurowania. Tekstylna wyœció³ka oraz wk³adka pozwalaj¹ stopie oddychaæ. Elastyczna podeszwa œrodkowa lekko amortyzuje, natomiast antypoœlizgowy bie¿nik odznacza siê bardzo dobr¹ przyczepnoœci¹. Lekkie zakrzywienie obuwia pozwala na p³ynniejszy ruch. Szare logo New Balance podkreœla markê produktu. ;http://www.eobuwie.com.pl/media/catalog/product/cache/image/650x650/8/0/803577_new_balance_u410cb_classics_niebieski_ac_01.jpg
21;Buty adidas;adidas, adidas Originals ;Continental 80 G27707 Cblack/Scarle/Conavy ;Pó³buty mêskie;Przyci¹gaj¹ce uwagê buty marki adidas. W cholewce dominuje Skóra naturalna - Licowa, Skóra ekologiczna - Skóra ekologiczna. We wnêtrzu butów materia³. Wk³adka to materia³. Materia³ podeszwy to wysokogatunkowe tworzywo. Buty wzbogacono o technologiê EVA, Ortholite. Buty na co dzieñ - ponadczasowe i uniwersalne. ;http://www.eobuwie.com.pl/media/catalog/product/cache/image/650x650/0/0/0000200855547_01_kch.jpg
22;Sneakersy NEW BALANCE;New Balance ;ML574SKD Czerwony ;Pó³buty mêskie;Klasyczna propozycja marki New Balance. Lekki wygl¹d zawdziêczaj¹ cholewce: Skóra naturalna - Zamsz, Materia³ - Materia³. Wewnêtrzna wyœció³ka to materia³. We wnêtrzu butów znajduje siê wk³adka: materia³. Wygodê zwiêksza odpowiednia podeszwa: wysokogatunkowe tworzywo. Model wyposa¿ono w technologiê ENCAP. Buty na co dzieñ - ponadczasowe i uniwersalne. ;http://www.eobuwie.com.pl/media/catalog/product/cache/image/650x650/0/0/0000208050654_01_bs_kopia.jpg
23;Pó³buty WOJAS;Wojas ;8045-53 J. Br¹z ;Pó³buty mêskie;Modna propozycja marki Wojas. W cholewce dominuje Skóra naturalna - Licowa. Posiadaj¹ wyœció³kê - to materia³, skóra. Wk³adka to skóra. Wygodê zwiêksza odpowiednia podeszwa: wysokogatunkowe tworzywo. Stylowe i przyjemne w noszeniu buty codzienne. ;http://www.eobuwie.com.pl/media/catalog/product/cache/image/650x650/0/0/0000206340986_01_kt.jpg
24;Pó³buty MERRELL;Merrell ;Jungle Moc J60825 Czarny ;Pó³buty mêskie;Pó³buty Jungle Moc stworzono z myœl¹ o mê¿czyznach, ceni¹cych sobie solidne wykonanie i styl. Model ten stanowi idealne uzupe³nienie miejskiego outfitu. Cholewkê wykonano z wysokiej jakoœci zamszu, natomiast wnêtrze obszyto przyjemnym w dotyku materia³em. Wk³adka z pianki EVA zapewnia komfort noszenia, zaœ zastosowany w butach system Merrell Select Fresh niweluje przykre zapachy. ;http://www.eobuwie.com.pl/media/catalog/product/cache/image/650x650/7/5/750166-merrell-j60825-czarny-01_kopia.jpg
25;Pó³buty BUGATTI;Bugatti ;312-85406-4100-4100 Dark Blue ;Pó³buty mêskie;Przyci¹gaj¹ce uwagê buty marki Bugatti. Lekki wygl¹d zawdziêczaj¹ cholewce: Skóra naturalna - Licowa. Wewnêtrzna wyœció³ka to materia³. Wk³adka to skóra. Materia³ podeszwy to wysokogatunkowe tworzywo. Buty na co dzieñ - ponadczasowe i uniwersalne. ;http://www.eobuwie.com.pl/media/catalog/product/cache/image/650x650/0/0/0000207915794_01_jb_kopia.jpg
26;Pó³buty SERGIO BARDI;Sergio Bardi ;MI08-C535-537-16EO Grey ;Pó³buty mêskie;Klasyczna propozycja marki Sergio Bardi. W cholewce dominuje Skóra naturalna - Nubuk. Wewnêtrzna wyœció³ka to materia³, skóra. Komfort noszenia podnosi wk³adka: skóra. Wygodê zwiêksza odpowiednia podeszwa: wysokogatunkowe tworzywo. Stylowe i przyjemne w noszeniu buty codzienne. ;http://www.eobuwie.com.pl/media/catalog/product/cache/image/650x650/5/9/5903698145587_01_rz.jpg
27;Sneakersy FILA;Fila ;Disruptor Low 1010262.1FG White ;Pó³buty mêskie;Fila Disruptor 2 s¹ butem, który idealnie trafia w gusta wspó³czesnej m³odzie¿y. To m. in. powrót tego modelu na rynek spowodowa³ olbrzymie zainteresowanie mark¹ Fila i mod¹, któr¹ mo¿na by³o obserwowaæ w po³owie lat 90. Chodzi oczywiœcie o trend ugly shoes lub, jak kto woli, dad shoes. Podobnie jak 25 lat temu, tak i teraz s¹ hitem sprzeda¿owym, szczególnie wœród kobiet. W 2018 roku Fila Disruptor 2 zosta³y okrzykniête butem roku – nasze klientki oceniaj¹ Fila Disruptor 2 jako wygodne i warte swojej ceny.Bia³e Fila Disruptor na nogach gwiazdPopularnoœæ Fila Disruptor 2 wynika nie tylko z ich wygl¹du i wygody. Promocji sprzyja³ tak¿e widok tego modelu na nogach najwiêkszych œwiatowych gwiazd i influencerów. Szlak przeciera³ guru mody ulicznej ostatnich lat, projektant Gosha Rubichinskiy, na wybiegach prezentuj¹c kolekcje marki Fila. W Fila Disruptor 2 chodzi³y tak¿e Emily Ratajkowski czy Dakota Fanning, a w Polsce nosi³a je na przyk³ad Marcelina Zawadzka. W³aœciwie od premiery Fila Disruptor 2 sta³y siê jednym z ulubionych butów influencerek, instagramerek, a tak¿e ka¿dej zwracaj¹cej uwagê na modê kobiety, która pod¹¿a za trendami.Prostota dziêki materia³omCholewka butów wykonana jest z bia³ej skóry oraz materia³ów syntetycznych, które nadaj¹ obuwiu luksusowego wygl¹du, a przy obecnych trendach pasuj¹ do wielu damskich stylizacji i codziennego u¿ytku. Zawdziêczamy to barwie buta, uniwersalnemu kolorowi bia³emu, a tak¿e prostej, ale przyci¹gaj¹cej wzrok konstrukcji. Pomimo masywnego wygl¹du but jest lekki. Dziêki zastosowanej piance EVA obuwie wa¿y zaledwie 378 gramów.  ;http://www.eobuwie.com.pl/media/catalog/product/cache/image/650x650/0/0/0000200728674_01_ts_1.jpg
28;Sneakersy NEW BALANCE;New Balance ;ML565CPC Granatowy ;Pó³buty mêskie;Klasyczna propozycja marki New Balance. Cholewka wyprofilowana z najlepszych surowców: Skóra naturalna - Licowa, Zamsz, Materia³ - Materia³. Posiadaj¹ wyœció³kê - to materia³. We wnêtrzu butów znajduje siê wk³adka: materia³. Podeszwa to wysokogatunkowe tworzywo. Stylowe i przyjemne w noszeniu buty codzienne. ;http://www.eobuwie.com.pl/media/catalog/product/cache/image/650x650/0/0/0000206902184_01_ki.jpg
29;Buty NIKE;NIKE ;Air Max 90 Ltr CZ5594 001 Black/Black/Black ;Pó³buty mêskie;Klasyczna propozycja marki NIKE. Cholewka wyprofilowana z najlepszych surowców: Skóra naturalna - Licowa, Skóra ekologiczna - Skóra ekologiczna. We wnêtrzu butów materia³. We wnêtrzu butów znajduje siê wk³adka: materia³. Wygodê zwiêksza odpowiednia podeszwa: wysokogatunkowe tworzywo. Buty wzbogacono o technologiê Air Max, Max Air, Nike Air. Stylowe i przyjemne w noszeniu buty codzienne. ;http://www.eobuwie.com.pl/media/catalog/product/cache/image/650x650/0/0/0000208060141_01_rz.jpg
30;Trampki BIG STAR;Big Star ;DD174259 Black ;Pó³buty mêskie;Modna propozycja marki BIG STAR. W cholewce dominuje Skóra ekologiczna - Skóra ekologiczna. Posiadaj¹ wyœció³kê - to materia³. We wnêtrzu butów znajduje siê wk³adka: materia³. Podeszwa to guma. Te buty to miejski styl w dobrym wydaniu. ;http://www.eobuwie.com.pl/media/catalog/product/cache/image/650x650/0/0/0000200912448_01_de.jpg
31;Tenisówki TOMMY HILFIGER;Tommy Hilfiger ;Harlow 1D FM0FM00596 Midnight 403 ;Pó³buty mêskie;Przywitaj nowy sezon w atrakcyjnych tenisówkach Tommy Hilfiger! Starannie wykoñczona cholewka z przewiewnego materia³u przyjemnie uk³ada siê na nodze, co wiêcej wspó³gra z jej naturalnym ruchem. Miêkki jêzyk niweluje nacisk tradycyjnego sznurowania, a tekstylna wk³adka dostosowuje siê do kszta³tu stopy. Wytrzyma³a podeszwa (2cm)z odpornej na œcieranie gumy odpowiednio wspiera sylwetkê. Wyszywane logo Tommy Hilfiger podkreœla markê obuwia. ;http://www.eobuwie.com.pl/media/catalog/product/cache/image/650x650/0/0/0000199097713_tommy-fm0fm00596_harlow_1d_403_az_01.jpg
32;Tenisówki VANS;Vans ;Old Skool VN000D3HY28 Black/White ;Pó³buty mêskie;Przyci¹gaj¹ce uwagê Vans. Cholewka butów to Skóra naturalna - Licowa, Materia³ - Materia³. Materia³ podeszwy to guma. Ponadczasowa klasyka gatunku. ;http://www.eobuwie.com.pl/media/catalog/product/cache/image/650x650/0/0/0000197850310-vans-old_skool_d3hy28_black_white-ap-001.jpg
33;Tenisówki BUGATTI;Bugatti ;325-89804-6950 1063 ;Pó³buty mêskie;Przyci¹gaj¹ce uwagê buty marki Bugatti. W cholewce dominuje Materia³ - Materia³. Wewnêtrzna wyœció³ka to materia³. We wnêtrzu butów znajduje siê wk³adka: materia³. Wygodê zwiêksza odpowiednia podeszwa: guma. Te buty to miejski styl w dobrym wydaniu. ;http://www.eobuwie.com.pl/media/catalog/product/cache/image/650x650/0/0/0000208005722_02_wj.jpg
34;Tenisówki TOMMY JEANS;Tommy Jeans ;Essential Leather Sneaker White YBR ;Pó³buty mêskie;Klasyczna propozycja marki Tommy Jeans. Cholewka wyprofilowana z najlepszych surowców: Skóra naturalna - Licowa. Wewnêtrzna wyœció³ka to materia³. We wnêtrzu butów znajduje siê wk³adka: materia³. Materia³ podeszwy to guma. Te buty to miejski styl w dobrym wydaniu. ;http://www.eobuwie.com.pl/media/catalog/product/cache/image/650x650/0/0/0000207370975_01_rz.jpg
35;Sneakersy NEW BALANCE;New Balance ;GM500KSW Czarny ;Pó³buty mêskie;Przyci¹gaj¹ce uwagê buty marki New Balance. Lekki wygl¹d zawdziêczaj¹ cholewce: Skóra ekologiczna - Skóra ekologiczna, Materia³ - Materia³. Wewnêtrzna wyœció³ka to materia³. Wk³adka to materia³. Materia³ podeszwy to wysokogatunkowe tworzywo. Buty na co dzieñ - ponadczasowe i uniwersalne. ;http://www.eobuwie.com.pl/media/catalog/product/cache/image/650x650/0/0/0000200373423_01_kt.jpg
36;Sneakersy NEW BALANCE;New Balance ;ML515OTY Szary ;Pó³buty mêskie;Przyci¹gaj¹ce uwagê buty marki New Balance. W cholewce dominuje Skóra naturalna - Zamsz, Materia³ - Materia³. Posiadaj¹ wyœció³kê - to materia³. Wk³adka to materia³. Wygodê zwiêksza odpowiednia podeszwa: wysokogatunkowe tworzywo. Buty na co dzieñ - ponadczasowe i uniwersalne. ;http://www.eobuwie.com.pl/media/catalog/product/cache/image/650x650/0/0/0000207027763_01_kt.jpg
37;Sneakersy NEW BALANCE;New Balance ;ML393LR1 Zielony ;Pó³buty mêskie;Modna propozycja marki New Balance. Cholewka wyprofilowana z najlepszych surowców: Skóra naturalna - Nubuk, Zamsz. Wewnêtrzna wyœció³ka to materia³. Wk³adka to materia³. Podeszwa to wysokogatunkowe tworzywo. Stylowe i przyjemne w noszeniu buty codzienne. ;http://www.eobuwie.com.pl/media/catalog/product/cache/image/650x650/0/0/0000207981461_01_mg_1.jpg
38;Sneakersy LASOCKI FOR MEN;Lasocki For Men ;MB-TUCKSON-01 Cobalt Blue ;Pó³buty mêskie;Modna propozycja marki Lasocki For Men. Lekki wygl¹d zawdziêczaj¹ cholewce: Skóra naturalna - Zamsz, Materia³ - Materia³. We wnêtrzu butów materia³. We wnêtrzu butów znajduje siê wk³adka: materia³. Wygodê zwiêksza odpowiednia podeszwa: wysokogatunkowe tworzywo. W butach zastosowano technologiê Light Outsole. Stylowe i przyjemne w noszeniu buty codzienne. ;http://www.eobuwie.com.pl/media/catalog/product/cache/image/650x650/5/9/5903419667862_01_rz.jpg
39;Sneakersy NEW BALANCE;New Balance ;Classics U410SKG Czarny ;Pó³buty mêskie;Klasyczna propozycja marki New Balance. Cholewka wyprofilowana z najlepszych surowców: Skóra naturalna - Licowa, Zamsz. Posiadaj¹ wyœció³kê - to materia³. We wnêtrzu butów znajduje siê wk³adka: materia³. Buty na co dzieñ - ponadczasowe i uniwersalne. ;http://www.eobuwie.com.pl/media/catalog/product/cache/image/650x650/7/2/726815_new_balance_u410skg__01_kopia.jpg
40;Buty adidas;adidas, adidas Originals ;Swift Run Rf FV5358 Ftwwht/Cblack/Ftwwht ;Pó³buty mêskie;Klasyczna propozycja marki adidas. W cholewce dominuje Materia³ - Materia³. Posiadaj¹ wyœció³kê - to materia³. We wnêtrzu butów znajduje siê wk³adka: materia³. Materia³ podeszwy to wysokogatunkowe tworzywo. Buty wzbogacono o technologiê EVA. Buty na co dzieñ - ponadczasowe i uniwersalne. ;http://www.eobuwie.com.pl/media/catalog/product/cache/image/650x650/0/0/0000206759894_01_rz.jpg
41;Sneakersy ECCO;ECCO ;Astir 52320452302 True Navy/Ombre/Marine/Medieval ;Pó³buty mêskie;Modna propozycja marki ECCO. Cholewka wyprofilowana z najlepszych surowców: Skóra naturalna - Licowa. Posiadaj¹ wyœció³kê - to materia³, skóra. Wk³adka to skóra. Materia³ podeszwy to poliuretan. Model wyposa¿ono w technologiê DIP, PHORENE™, PU (Poliuretan). Buty na co dzieñ - ponadczasowe i uniwersalne. ;http://www.eobuwie.com.pl/media/catalog/product/cache/image/650x650/0/0/0000207697980_01_sw.jpg
42;Sneakersy LASOCKI FOR MEN;Lasocki For Men ;MB-TARO-01 Cobalt Blue ;Pó³buty mêskie;Modna propozycja marki Lasocki For Men. Cholewka wyprofilowana z najlepszych surowców: Skóra naturalna - Zamsz, Materia³ - Materia³. Posiadaj¹ wyœció³kê - to materia³. Wk³adka to materia³. Materia³ podeszwy to wysokogatunkowe tworzywo. Model wyposa¿ono w technologiê Light Outsole. Te buty to miejski styl w dobrym wydaniu. ;http://www.eobuwie.com.pl/media/catalog/product/cache/image/650x650/5/9/5903419729768_01_rz.jpg
43;Sneakersy CALVIN KLEIN JEANS;Calvin Klein Jeans ;Ron S0506 Indigo/Silver ;Pó³buty mêskie;Przyci¹gaj¹ce uwagê buty marki Calvin Klein Jeans. Lekki wygl¹d zawdziêczaj¹ cholewce: Materia³ - Materia³, Tworzywo - Wysokogatunkowe tworzywo. We wnêtrzu butów materia³. We wnêtrzu butów znajduje siê wk³adka: materia³. Wygodê zwiêksza odpowiednia podeszwa: wysokogatunkowe tworzywo. Stylowe i przyjemne w noszeniu buty codzienne. ;http://www.eobuwie.com.pl/media/catalog/product/cache/image/650x650/0/0/0000201055021_01_pl.jpg
44;Sneakersy NEW BALANCE;New Balance ;MT574ATD Czarny ;Pó³buty mêskie;Klasyczna propozycja marki New Balance. W cholewce dominuje Skóra naturalna - Zamsz. Posiadaj¹ wyœció³kê - to materia³. Komfort noszenia podnosi wk³adka: materia³. Wygodê zwiêksza odpowiednia podeszwa: wysokogatunkowe tworzywo. Model wyposa¿ono w technologiê ENCAP, EVA. Buty na co dzieñ - ponadczasowe i uniwersalne. ;http://www.eobuwie.com.pl/media/catalog/product/cache/image/650x650/0/0/0000207744233_01_rz.jpg
45;Buty NIKE;NIKE ;Air Max 200 CT1262 102 White/Laser Orange/Eggplant ;Pó³buty mêskie;Przyci¹gaj¹ce uwagê buty marki NIKE. Lekki wygl¹d zawdziêczaj¹ cholewce: Skóra ekologiczna - Skóra ekologiczna, Materia³ - Materia³. Wewnêtrzna wyœció³ka to materia³. Wk³adka to materia³. Wygodê zwiêksza odpowiednia podeszwa: wysokogatunkowe tworzywo. Buty wzbogacono o technologiê Air Max, Cushlon, Max Air, TPU. Te buty to miejski styl w dobrym wydaniu. ;http://www.eobuwie.com.pl/media/catalog/product/cache/image/650x650/0/0/0000207997028_01_mg.jpg
46;Buty adidas;adidas, adidas Originals ;Zx Flux FW0028 Blue/Ftwwht/Solred ;Pó³buty mêskie;Przyci¹gaj¹ce uwagê buty marki adidas. Lekki wygl¹d zawdziêczaj¹ cholewce: Materia³ - Materia³, Tworzywo - Wysokogatunkowe tworzywo. Posiadaj¹ wyœció³kê - to materia³. Komfort noszenia podnosi wk³adka: materia³. Materia³ podeszwy to wysokogatunkowe tworzywo. W butach zastosowano technologiê Torsion, TPU. Te buty to miejski styl w dobrym wydaniu. ;http://www.eobuwie.com.pl/media/catalog/product/cache/image/650x650/0/0/0000206873910_01_rz.jpg
47;Sneakersy EA7 EMPORIO ARMANI;EA7 Emporio Armani ;X8X070 XK165 M701 Triple Black/Gold ;Pó³buty mêskie;Klasyczna propozycja marki EA7 Emporio Armani. W cholewce dominuje Skóra ekologiczna - Skóra ekologiczna, Materia³ - Materia³. We wnêtrzu butów materia³. Wk³adka to materia³. Materia³ podeszwy to wysokogatunkowe tworzywo. Buty na co dzieñ - ponadczasowe i uniwersalne. ;http://www.eobuwie.com.pl/media/catalog/product/cache/image/650x650/0/0/0000207287778_01_rz.jpg
