ID;Nazwa;Marka;Model;Kategoria;Opis;Cena;URL_zdjecia
147;Trekkingi HI-TEC;Hi-Tec ;Caroni Mid AVSAW17-HT-01 Camel/Black ;Sportowe mêskie;Marka Hi-Tec prezentuje udany model outdoorowy. Wytrzyma³a cholewka to Skóra ekologiczna - Skóra ekologiczna, Materia³ - Materia³. Wk³adka to materia³. Podeszwa z traperem to wysokogatunkowe tworzywo. Dobre buty dla wymagaj¹cych u¿ytkowników. ;http://www.eobuwie.com.pl/media/catalog/product/cache/image/650x650/0/0/0000200872803_01_dd.jpg
148;Trekkingi JACK WOLFSKIN;Jack Wolfskin ;Vojo 2 Texapore Mid M 4042461 Khaki/Phantom ;Sportowe mêskie;W propozycjach Jack Wolfskin kolejny ponadczasowy model. Wierzchnia czêœæ butów to Skóra naturalna - Zamsz, Materia³ - Materia³. We wnêtrzu materia³, co sprawia, ¿e buty zachowuj¹ dobre w³aœciwoœci higieniczne We wnêtrzu butów znajduje siê wk³adka: materia³. Podeszwa z traperem to wysokogatunkowe tworzywo. W butach zastosowano technologiê EVA, PU (Poliuretan), Texapore. Masywniejszy fason, o surowym, ciekawym wykoñczeniu. ;http://www.eobuwie.com.pl/media/catalog/product/cache/image/650x650/0/0/0000207531376_01_pa.jpg
149;Trekkingi CMP;CMP ;Rigel Mid Trekking Shoes Wp 3Q12947 Asphalt/Syrah 62BN ;Sportowe mêskie;W kolekcji marki CMP na uwagê zas³uguje ten model. Wytrzyma³a cholewka to Skóra naturalna - Zamsz, Materia³ - Materia³, Tworzywo - Wysokogatunkowe tworzywo. Wk³adka to materia³. Podeszwa z traperem to wysokogatunkowe tworzywo. W butach zastosowano technologiê Clima Protect®, CMP Full On Grip, EVA, Ortholite, TPU, Waterproof. Idealne buty na bardziej wymagaj¹cy teren. ;http://www.eobuwie.com.pl/media/catalog/product/cache/image/650x650/0/0/0000200712666_01_kch.jpg
150;Buty adidas;adidas, adidas Performance ;Terrex Cc Daroga BC0980 Cblack/Cwhite/Cblack ;Sportowe mêskie;W kolekcji marki adidas na uwagê zas³uguje ten model. Wytrzyma³a cholewka to Skóra ekologiczna - Skóra ekologiczna, Materia³ - Materia³. We wnêtrzu butów znajduje siê wk³adka: materia³. Podeszwa o dobrej trakcji to wysokogatunkowe tworzywo. W butach zastosowano technologiê Climacool, EVA, Traxion. Idealne buty na bardziej wymagaj¹cy teren. ;http://www.eobuwie.com.pl/media/catalog/product/cache/image/650x650/0/0/0000200856964_01_ek.jpg
151;Trekkingi JACK WOLFSKIN;Jack Wolfskin ;Vojo 3 Texapore Mid M 4042461 Brown/Phantom ;Sportowe mêskie;W kolekcji marki Jack Wolfskin na uwagê zas³uguje ten model. Cholewka o podwy¿szonej odpornoœci Skóra naturalna - Welur, Materia³ - Materia³. Komfort noszenia podnosi wk³adka: materia³. Podeszwa odpowiednia do mokrych i œliskich powierzchni: wysokogatunkowe tworzywo. Buty wzbogacono o technologiê EVA, PU (Poliuretan), Texapore. To bezpieczne obuwie terenowe. ;http://www.eobuwie.com.pl/media/catalog/product/cache/image/650x650/0/0/0000207531369_01_rz.jpg
152;Trekkingi MERRELL;Merrell ;Ontario 85 Mid Wp J84961 Olive ;Sportowe mêskie;W propozycjach Merrell kolejny ponadczasowy model. Cholewka o podwy¿szonej odpornoœci to Skóra naturalna - Zamsz, Materia³ - Materia³. Wnêtrze oddychaj¹ce, jego g³ównym sk³adnikiem jest materia³. W butach zastosowano ch³onn¹ wk³adkê, to materia³. Podeszwa z traperem to wysokogatunkowe tworzywo. Buty wzbogacono o technologiê CORDURA®, Kinder-Fit, Megagrip, Merrell Select Fresh, Merrell Select Grip, Vibram. Idealne na piesze wycieczki, trwa³e i wygodne. ;http://www.eobuwie.com.pl/media/catalog/product/cache/image/650x650/0/0/0000207867758_01_rz_3.jpg
153;Trekkingi JACK WOLFSKIN;Jack Wolfskin ;Vojo 3 Wt Texapore Mid M 4042461 Black/Burly Yellow XT ;Sportowe mêskie;Buty outdoorowe marki Jack Wolfskin. Cholewka butów to Skóra naturalna - Welur, Materia³ - Materia³. We wnêtrzu butów znajduje siê wk³adka: materia³. Podeszwa odpowiednia do mokrych i œliskich powierzchni: wysokogatunkowe tworzywo. Model wyposa¿ono w technologiê EVA, PU (Poliuretan), Texapore. Dobre buty dla wymagaj¹cych u¿ytkowników. ;http://www.eobuwie.com.pl/media/catalog/product/cache/image/650x650/0/0/0000207531352_01_rz.jpg
154;Trekkingi DOLOMITE;Dolomite ;Cinquantaquattro High Fg Gtx GORE-TEX 247958-1076011 Gunmetal Grey ;Sportowe mêskie;Buty outdoorowe marki Dolomite. Cholewka butów to Skóra naturalna - Nubuk, Skóra ekologiczna - Skóra ekologiczna. We wnêtrzu butów znajduje siê wk³adka: materia³. Podeszwa o dobrej trakcji to wysokogatunkowe tworzywo. Buty wzbogacono o technologiê GORE-TEX® Performance Comfort Footwear, Vibram. Dobre buty dla wymagaj¹cych u¿ytkowników. ;http://www.eobuwie.com.pl/media/catalog/product/cache/image/650x650/0/0/0000206291424_01_ts_1.jpg
155;Trampki CONVERSE;Converse ;All Star Ox M7652C Optical White ;Sportowe mêskie;Modna propozycja marki Converse. Lekki wygl¹d zawdziêczaj¹ cholewce: Materia³ - Materia³. Wewnêtrzna wyœció³ka to materia³. Komfort noszenia podnosi wk³adka: materia³. Podeszwa to guma. Stylowe i przyjemne w noszeniu buty codzienne. ;http://www.eobuwie.com.pl/media/catalog/product/cache/image/650x650/0/0/0000076522222_01_ts.jpg
156;Buty NIKE;NIKE ;Revolution 5 BQ3204 002 Black/White/Anthracite ;Sportowe mêskie;Buty biegowe marki NIKE. Oddychaj¹ca cholewka to Materia³ - Materia³, Tworzywo - Wysokogatunkowe tworzywo. Komfort noszenia podnosi wk³adka: materia³. Podeszwa o w³aœciwoœciach amortyzuj¹cych to wysokogatunkowe tworzywo. Buty wzbogacono o technologiê 10 mm Offset. To model doskona³y do treningu biegowego.  ;http://www.eobuwie.com.pl/media/catalog/product/cache/image/650x650/0/0/0000207366572_01_pl.jpg
157;Buty adidas;adidas, adidas Performance ;Runfalcon F36202 Actred/Ftwwht/Cblack ;Sportowe mêskie;Buty do biegania marki adidas. Oddychaj¹ca cholewka to Skóra ekologiczna - Skóra ekologiczna, Materia³ - Materia³, Tworzywo - Wysokogatunkowe tworzywo. Komfort noszenia podnosi wk³adka: materia³. Lepsz¹ amortyzacjê uzyskano dziêki podeszwie - to wysokogatunkowe tworzywo. Model wyposa¿ono w technologiê 10 mm Drop, EVA. To model doskona³y do treningu biegowego. ;http://www.eobuwie.com.pl/media/catalog/product/cache/image/650x650/0/0/0000206716101_01_pc.jpg
158;Buty NIKE;NIKE ;Legend React AA1625 407 Obsidian Mist/Black ;Sportowe mêskie;Buty biegowe marki NIKE. Wygodnie wyprofilowana cholewka to Materia³ - Materia³, Tworzywo - Wysokogatunkowe tworzywo. Wk³adka to materia³. Amortyzuj¹ca podeszwa to wysokogatunkowe tworzywo. Model wyposa¿ono w technologiê Nike React. Anatomicznie wyprofilowane, sprawdzaj¹ siê na krótszych i d³u¿szych dystansach. ;http://www.eobuwie.com.pl/media/catalog/product/cache/image/650x650/0/0/0000207996885_01_rz.jpg
159;Buty SAUCONY;Saucony ;Aya S70460-2 Wht/Blu/Lt Blu ;Sportowe mêskie;Buty do biegania marki Saucony. Cholewka solidnie wykoñczona - Skóra ekologiczna - Skóra ekologiczna, Materia³ - Materia³, Tworzywo - Wysokogatunkowe tworzywo. We wnêtrzu wk³adka: materia³. Lepsz¹ amortyzacjê uzyskano dziêki podeszwie - to wysokogatunkowe tworzywo. W butach zastosowano technologiê CMEVA, EVA, Xt-600. Anatomicznie wyprofilowane, sprawdzaj¹ siê na krótszych i d³u¿szych dystansach. ;http://www.eobuwie.com.pl/media/catalog/product/cache/image/650x650/0/0/0000206243355_01_ki.jpg
160;Buty NIKE;NIKE ;Air Max Excee CD4165 100 White/Black/Pure Platinum  ;Sportowe mêskie;Przyci¹gaj¹ce uwagê buty marki NIKE. W cholewce dominuje Skóra naturalna - Licowa, Skóra ekologiczna - Skóra ekologiczna, Materia³ - Materia³. Posiadaj¹ wyœció³kê - to materia³. We wnêtrzu butów znajduje siê wk³adka: materia³. Materia³ podeszwy to wysokogatunkowe tworzywo. Buty wzbogacono o technologiê Air Max, Nike Air. Stylowe i przyjemne w noszeniu buty codzienne. ;http://www.eobuwie.com.pl/media/catalog/product/cache/image/650x650/0/0/0000207371248_01_sw.jpg
161;Sneakersy NEW BALANCE;New Balance ;CT1500SH Szary ;Sportowe mêskie;Klasyczna propozycja marki New Balance. Lekki wygl¹d zawdziêczaj¹ cholewce: Skóra naturalna - Licowa. Posiadaj¹ wyœció³kê - to materia³, skóra ekologiczna. Wk³adka to materia³. Materia³ podeszwy to wysokogatunkowe tworzywo. Buty na co dzieñ - ponadczasowe i uniwersalne. ;http://www.eobuwie.com.pl/media/catalog/product/cache/image/650x650/0/0/0000207029095_01_ks_2.jpg
162;Buty NIKE;NIKE ;Nike Air Max 90 CW7481 002 Black/Particle Grey ;Sportowe mêskie;Przyci¹gaj¹ce uwagê buty marki NIKE. Cholewka wyprofilowana z najlepszych surowców: Skóra naturalna - Licowa, Skóra ekologiczna - Skóra ekologiczna, Materia³ - Materia³. We wnêtrzu butów materia³. Wk³adka to materia³. Wygodê zwiêksza odpowiednia podeszwa: wysokogatunkowe tworzywo. W butach zastosowano technologiê Air Max, Max Air, Nike Air. Te buty to miejski styl w dobrym wydaniu. ;http://www.eobuwie.com.pl/media/catalog/product/cache/image/650x650/0/0/0000208060134_01_rz.jpg
163;Sneakersy NEW BALANCE;New Balance ;ML574EGN Granatowy ;Sportowe mêskie;Przyci¹gaj¹ce uwagê buty marki New Balance. Cholewka wyprofilowana z najlepszych surowców: skóra naturalna - licowa, zamsz, materia³ - materia³. Wewnêtrzna wyœció³ka to materia³. Wk³adka to materia³. Materia³ podeszwy to wysokogatunkowe tworzywo. Buty wzbogacono o technologiê ENCAP, EVA. Stylowe i przyjemne w noszeniu buty codzienne.;http://www.eobuwie.com.pl/media/catalog/product/cache/image/650x650/0/0/0000200369334_01_rz.jpg
164;Trekkingi CMP;CMP ;Gemini Mid Trekking Shoe Wp 30Q9627 Jungle U940 ;Sportowe mêskie;Marka CMP prezentuje udany model outdoorowy. Cholewka butów to Skóra ekologiczna - Skóra ekologiczna, Materia³ - Materia³. Wk³adka to materia³. Podeszwa z traperem to wysokogatunkowe tworzywo. Buty wzbogacono o technologiê Clima Protect®, Vibram® XS TREK, Waterproof. Idealne buty na bardziej wymagaj¹cy teren. ;http://www.eobuwie.com.pl/media/catalog/product/cache/image/650x650/0/0/0000208004206_01_ks.jpg
165;Sneakersy PUMA;Puma ;Turino 371113 06 Rosewater/Pwht/Whis/Wht ;Sportowe mêskie;Uniwersalna propozycja marki Puma. Wygodnie wyprofilowana cholewka to Skóra naturalna - Zamsz, Skóra ekologiczna - Skóra ekologiczna. We wnêtrzu butów materia³. Komfort noszenia podnosi wk³adka: materia³. Podeszwa - wysokogatunkowe tworzywo. W butach zastosowano technologiê SoftFoam. Kobiece i przyjazne dla stopy, bêd¹ baz¹ dla ca³ego stroju. ;http://www.eobuwie.com.pl/media/catalog/product/cache/image/650x650/0/0/0000207020412_1_.jpg
166;Trekkingi MERRELL;Merrell ;Intercept J598633 Dark Earth ;Sportowe mêskie;Przywi¹zanie do marki Merrell budowane jest praktycznie po pierwszym zakupie butów tego producenta. Fani brandu czêsto powracaj¹ do tego samego modelu, do którego wczeœniej siê przekonali.Merrell jest amerykañsk¹ firm¹ specjalizuj¹c¹ siê w obuwiu trekkingowym – jej za³o¿ycielami s¹ byli pracownicy wysokiego szczebla firmy Rossignol, specjalizuj¹cej siê w sprzêcie górskim. Jednym z flagowych modelów marki jest uniwersalny model Intercept, nadaj¹cy siê na piesze wycieczki zarówno górskim szlakiem, jak i codziennego u¿ytkowania w mieœcie.Podeszwy buta wykonane s¹ z gumy w technologii Vibram, która gwarantuje wysok¹ wytrzyma³oœæ oraz przyczepnoœæ. Merrell Intercept posiada tak¿e poduszkê powietrzn¹, która zapewnia wygodê i amortyzacjê. Wewn¹trz buta znajduje siê m.in. wk³adka wykonana w technologii EVA, która ogranicza proces rozprzestrzeniania siê bakterii oraz OrthoLite, odpowiedzialna za ograniczanie wydzielania siê nieprzyjemnego zapachu. ;http://www.eobuwie.com.pl/media/catalog/product/cache/image/650x650/0/0/0000201210215_01_ki.jpg
167;Trekkingi MERRELL;Merrell ;Forestbound Wp J77291 Black ;Sportowe mêskie;W kolekcji marki Merrell na uwagê zas³uguje ten model. Wytrzyma³a cholewka to Skóra naturalna - Nubuk, Materia³ - Materia³. Wk³adka to materia³. Podeszwa odpowiednia do mokrych i œliskich powierzchni: wysokogatunkowe tworzywo. Model wyposa¿ono w technologiê Merrell Select Dry, Merrell Select Grip. Idealne buty na bardziej wymagaj¹cy teren. ;http://www.eobuwie.com.pl/media/catalog/product/cache/image/650x650/0/0/0000206332912_01_mt.jpg
168;Trekkingi SALOMON;Salomon ;X Raise Gtx GORE-TEX 409739 27 M0 Vintage Khaki/Navy Blazer/Poseidon ;Sportowe mêskie;W kolekcji marki Salomon na uwagê zas³uguje ten model. Wytrzyma³a cholewka to Skóra ekologiczna - Skóra ekologiczna, Materia³ - Materia³, Tworzywo - Wysokogatunkowe tworzywo. We wnêtrzu butów znajduje siê wk³adka: materia³. Podeszwa odpowiednia do mokrych i œliskich powierzchni: wysokogatunkowe tworzywo. Model wyposa¿ono w technologiê Contagrip, EnergyCell+, GORE-TEX® Extended Comfort Footwear, Ortholite, Quicklace. Dobre buty dla wymagaj¹cych u¿ytkowników. ;http://www.eobuwie.com.pl/media/catalog/product/cache/image/650x650/0/0/0000208142434_01_mk.jpg
169;Trekkingi HI-TEC;Hi-Tec ;Gosen AVS-SS20-HT-01-Q1 Black/Dark Grey/Corn ;Sportowe mêskie;W propozycjach Hi-Tec kolejny ponadczasowy model. Wierzchnia czêœæ butów to Skóra ekologiczna - Skóra ekologiczna, Materia³ - Materia³. Wnêtrze oddychaj¹ce, jego g³ównym sk³adnikiem jest materia³. We wnêtrzu butów znajduje siê wk³adka: materia³. Podeszwa z traperem to wysokogatunkowe tworzywo. Dobre buty dla wymagaj¹cych u¿ytkowników. ;http://www.eobuwie.com.pl/media/catalog/product/cache/image/650x650/0/0/0000207213623_1_.jpg
170;Sneakersy NEW BALANCE;New Balance ;ML515CAA Czarny ;Sportowe mêskie;Klasyczna propozycja marki New Balance. W cholewce dominuje Skóra naturalna - Zamsz, Skóra ekologiczna - Skóra ekologiczna, Materia³ - Materia³. Posiadaj¹ wyœció³kê - to materia³. Wk³adka to materia³. Wygodê zwiêksza odpowiednia podeszwa: wysokogatunkowe tworzywo. Buty na co dzieñ - ponadczasowe i uniwersalne. ;http://www.eobuwie.com.pl/media/catalog/product/cache/image/650x650/0/0/0000208050609_01_sw.jpg
171;Tenisówki VANS;Vans ; Old Skool VN0A4U3B2O31 (Pig Suede)Apricot/Snwwht ;Sportowe mêskie;Przyci¹gaj¹ce uwagê Vans. Lekki wygl¹d zawdziêczaj¹ cholewce: Skóra naturalna - Zamsz. Podeszwa to guma. Ponadczasowa klasyka gatunku. ;http://www.eobuwie.com.pl/media/catalog/product/cache/image/650x650/0/0/0000207852501_01_mg.jpg
172;Buty adidas;adidas, adidas Originals ;Supercourt EE6037 Ftwwht/Ftwwht/Cblack ;Sportowe mêskie;Klasyczna propozycja marki adidas. Cholewka wyprofilowana z najlepszych surowców: Skóra naturalna - Licowa. We wnêtrzu butów materia³. Wk³adka to materia³. Materia³ podeszwy to wysokogatunkowe tworzywo. Te buty to miejski styl w dobrym wydaniu. ;http://www.eobuwie.com.pl/media/catalog/product/cache/image/650x650/0/0/0000206759757_01_ts.jpg
173;Trampki CONVERSE;Converse ;C Taylor A/S Hi M3310C Black Monoch ;Sportowe mêskie;PropozycjaConverse w monochromatycznym wydaniu, znanym z pierwszych modeli tejmarki. Powracaj¹ce do mody, wykonane zosta³y w ca³oœci w kolorzeczarnym. Idealnie dopasuj¹ siê do stylizacji z niemal ka¿dymzestawem. Uniwersalne i ponadczasowe trampki dla kobiet ceni¹cychsobie dobry styl i wygodê zarazem. Cholewka p³ócienna, jest trwa³a i przewiewna, daj¹c stopie mo¿liwoœæ oddychania. Ochronny nosek z tworzywa orazlogo na wewnêtrznej stronie cholewki sygnowane nazwiskiem ChuckaTaylora. ;http://www.eobuwie.com.pl/media/catalog/product/cache/image/650x650/0/0/0000002848570_01_jc.jpg
174;Buty NIKE;NIKE ;Air Max Tailwind IV Se CJ0641 100 White/Black/Ghost Green ;Sportowe mêskie;Klasyczna propozycja marki NIKE. W cholewce dominuje Skóra ekologiczna - Skóra ekologiczna, Materia³ - Materia³. We wnêtrzu butów materia³. Komfort noszenia podnosi wk³adka: materia³. Wygodê zwiêksza odpowiednia podeszwa: wysokogatunkowe tworzywo. Buty wzbogacono o technologiê Air Max, BRS 1000, Max Air, Nike Air, TPU. Stylowe i przyjemne w noszeniu buty codzienne. ;http://www.eobuwie.com.pl/media/catalog/product/cache/image/650x650/0/0/0000207996984_01_rz.jpg
175;Sneakersy NEW BALANCE;New Balance ;ML393SH1 Szary ;Sportowe mêskie;Modna propozycja marki New Balance. Lekki wygl¹d zawdziêczaj¹ cholewce: Skóra naturalna - Zamsz, Materia³ - Materia³. Wewnêtrzna wyœció³ka to materia³. We wnêtrzu butów znajduje siê wk³adka: materia³. Materia³ podeszwy to wysokogatunkowe tworzywo. Buty na co dzieñ - ponadczasowe i uniwersalne. ;http://www.eobuwie.com.pl/media/catalog/product/cache/image/650x650/0/0/0000207743939_01_rz.jpg
176;Buty NIKE;NIKE ;Air Max 200 CT1262 001 Football Grey/Laser Blue ;Sportowe mêskie;Modna propozycja marki NIKE. Lekki wygl¹d zawdziêczaj¹ cholewce: Skóra ekologiczna - Skóra ekologiczna, Materia³ - Materia³. We wnêtrzu butów materia³. Wk³adka to materia³. Wygodê zwiêksza odpowiednia podeszwa: wysokogatunkowe tworzywo. W butach zastosowano technologiê Air Max, Cushlon, Max Air, TPU. Buty na co dzieñ - ponadczasowe i uniwersalne. ;http://www.eobuwie.com.pl/media/catalog/product/cache/image/650x650/0/0/0000207997011_01_mk.jpg
177;Buty SALOMON;Salomon ;Speedcross 5 406843 27 G0 High Risk Red/Barbados Cherry/Barbados Cherry ;Sportowe mêskie;Buty biegowe marki Salomon. Wygodnie wyprofilowana cholewka to Materia³ - Materia³, Tworzywo - Wysokogatunkowe tworzywo. We wnêtrzu wk³adka: materia³. Lepsz¹ amortyzacjê uzyskano dziêki podeszwie - to wysokogatunkowe tworzywo. Buty wzbogacono o technologiê Contagrip, EnergyCell+, Ortholite, Quicklace, Sensifit. To model doskona³y do treningu biegowego. ;http://www.eobuwie.com.pl/media/catalog/product/cache/image/650x650/0/0/0000206957412_01_pac.jpg
178;Buty MERRELL;Merrell ;Vapor Glove 4 J50395 Black ;Sportowe mêskie;Nowy model biegowy marki Merrell. Oddychaj¹ca cholewka to Materia³ - Materia³, Tworzywo - Wysokogatunkowe tworzywo. We wnêtrzu wk³adka: materia³. Amortyzuj¹ca podeszwa to wysokogatunkowe tworzywo. Buty wzbogacono o technologiê Barefoot, CORDURA®, Hyperlock, Merrell Select Fresh, TPU, Vegan Friendly, Vibram. Amortyzacja i wsparcie stopy - to odpowiedni fason treningowy. ;http://www.eobuwie.com.pl/media/catalog/product/cache/image/650x650/0/0/0000201210079_01_pa.jpg
179;Buty SALOMON;Salomon ;Supercross Blast 411068 26 W0 Black/White/Black ;Sportowe mêskie;Nowy model biegowy marki Salomon. Oddychaj¹ca cholewka to Materia³ - Materia³, Tworzywo - Wysokogatunkowe tworzywo. Komfort noszenia podnosi wk³adka: materia³. Podeszwa o w³aœciwoœciach amortyzuj¹cych to wysokogatunkowe tworzywo. Buty wzbogacono o technologiê 10 mm Drop, Contagrip, EnergyCell+, EVA, Ortholite, Quicklace, Rip-Stop, Sensifit. To model doskona³y do treningu biegowego. ;http://www.eobuwie.com.pl/media/catalog/product/cache/image/650x650/0/0/0000207783249_01_pa.jpg
180;Buty SALOMON;Salomon ;Outbound 407321 27 V0 Navy Blazzer/White/White ;Sportowe mêskie;Buty biegowe marki Salomon. Oddychaj¹ca cholewka to Materia³ - Materia³, Tworzywo - Wysokogatunkowe tworzywo. Komfort noszenia podnosi wk³adka: materia³. Amortyzuj¹ca podeszwa to wysokogatunkowe tworzywo. W butach zastosowano technologiê 9 mm Drop, Contagrip, EnergyCell+, EVA, Ortholite. To model doskona³y do treningu biegowego. ;http://www.eobuwie.com.pl/media/catalog/product/cache/image/650x650/0/0/0000206957443_01_sw.jpg
181;Buty adidas;adidas, adidas Performance ;Response Trail FW4939 Czarny ;Sportowe mêskie;Buty biegowe marki adidas. Oddychaj¹ca cholewka to Materia³ - Materia³, Tworzywo - Wysokogatunkowe tworzywo. We wnêtrzu wk³adka: materia³. Lepsz¹ amortyzacjê uzyskano dziêki podeszwie - to wysokogatunkowe tworzywo. Buty wzbogacono o technologiê Cloudfoam, Ortholite, Traxion. To model doskona³y do treningu biegowego. ;http://www.eobuwie.com.pl/media/catalog/product/cache/image/650x650/0/0/0000206757852_01_rz.jpg
182;Buty PUMA;Puma ;H.St.20 193069 03 Puma White/Dark Denim ;Sportowe mêskie;Buty biegowe marki Puma. Cholewka solidnie wykoñczona - Materia³ - Materia³. Komfort noszenia podnosi wk³adka: materia³. Podeszwa o w³aœciwoœciach amortyzuj¹cych to wysokogatunkowe tworzywo. Model wyposa¿ono w technologiê HYBRID, IGNITE Foam, LQDCELL, NRGY Foam. Amortyzacja i wsparcie stopy - to odpowiedni fason treningowy. ;http://www.eobuwie.com.pl/media/catalog/product/cache/image/650x650/0/0/0000208155397_01_rz.jpg
183;Buty NIKE;NIKE ;Revolution 4 Eu AJ3490 008 Gunsmoke/Vintage Wine ;Sportowe mêskie;Buty do biegania marki NIKE. Oddychaj¹ca cholewka to Materia³ - Materia³, Tworzywo - Wysokogatunkowe tworzywo. We wnêtrzu wk³adka: materia³. Amortyzuj¹ca podeszwa to wysokogatunkowe tworzywo. Model wyposa¿ono w technologiê 10 mm Offset. To model doskona³y do treningu biegowego. ;http://www.eobuwie.com.pl/media/catalog/product/cache/image/650x650/0/0/0000206454287_01_az.jpg
184;Sneakersy VANS;Vans ;Sk8-Hi Mte 2.0 Dx VN0A4P3I2TI1 (Mte) Black/Cam ;Sportowe mêskie;Przyci¹gaj¹ce uwagê buty marki Vans. W cholewce dominuje Skóra naturalna - Licowa, Skóra ekologiczna - Skóra ekologiczna. Wk³adka to materia³. Podeszwa to wysokogatunkowe tworzywo. Buty na co dzieñ - ponadczasowe i uniwersalne. ;http://www.eobuwie.com.pl/media/catalog/product/cache/image/650x650/0/0/0000207852839_01_rz.jpg
185;Buty NIKE;NIKE ;Air Max Tailwind 99 Sp CQ6569 001 Black/Black/Oil Grey ;Sportowe mêskie;Modna propozycja marki NIKE. Lekki wygl¹d zawdziêczaj¹ cholewce: Skóra ekologiczna - Skóra ekologiczna, Materia³ - Materia³. Wewnêtrzna wyœció³ka to materia³. We wnêtrzu butów znajduje siê wk³adka: materia³. Podeszwa to wysokogatunkowe tworzywo. W butach zastosowano technologiê Max Air. Buty na co dzieñ - ponadczasowe i uniwersalne. ;http://www.eobuwie.com.pl/media/catalog/product/cache/image/650x650/0/0/0000207985827_01_rz.jpg
186;Buty Reebok;Reebok ;Flexagon Energy Tr 2.0 H67380 Black/Black/Trgry8 ;Sportowe mêskie;Buty do æwiczeñ od Reebok. Wygodnie wyprofilowana cholewka to Skóra ekologiczna - Skóra ekologiczna, Materia³ - Materia³. We wnêtrzu wk³adka: materia³. Podeszwa - wysokogatunkowe tworzywo. Model wyposa¿ono w technologiê EVA, FuelFoam. Elastyczny model œwietnie sprawdzaj¹ siê przy intensywnych æwiczeniach. ;http://www.eobuwie.com.pl/media/catalog/product/cache/image/650x650/0/0/0000206767721_01_rz.jpg
187;Buty Reebok;Reebok ;Flexagon Force 2.0 FX0154 Vecnav/White/Horblu ;Sportowe mêskie;Buty do æwiczeñ od Reebok. Do charakteru butów pasuje cholewka: Skóra ekologiczna - Skóra ekologiczna, Materia³ - Materia³. Komfort noszenia podnosi wk³adka: tworzywo . Podeszwa przyjazna dla stopy: wysokogatunkowe tworzywo. W butach zastosowano technologiê EVA, MemoryTech. Idealne buty dla pocz¹tkuj¹cych i nieco bardziej zaawansowanych sportowców. ;http://www.eobuwie.com.pl/media/catalog/product/cache/image/650x650/0/0/0000206767448_01_ppi.jpg
188;Buty NIKE;NIKE ;Renew Fusion CD0200 Pure Platinum/Laser Orange ;Sportowe mêskie;Wygodny fason marki NIKE. Wygodnie wyprofilowana cholewka to Materia³ - Materia³, Tworzywo - Wysokogatunkowe tworzywo. We wnêtrzu wk³adka: materia³. Materia³ podeszwy to wysokogatunkowe tworzywo. Buty wzbogacono o technologiê Nike Renew. Idealne buty dla pocz¹tkuj¹cych i nieco bardziej zaawansowanych sportowców. ;http://www.eobuwie.com.pl/media/catalog/product/cache/image/650x650/0/0/0000208180832_01_rz.jpg
189;Buty VIBRAM FIVEFINGERS;Vibram Fivefingers ;V-Train 2.0 20M7704 Black/Orange ;Sportowe mêskie;Propozycja marki Vibram Fivefingers. Do charakteru butów pasuje cholewka: Materia³ - Materia³, Materia³ pokryty tworzywem, Tworzywo - Wysokogatunkowe tworzywo. We wnêtrzu wk³adka: materia³. Podeszwa - wysokogatunkowe tworzywo. Buty wzbogacono o technologiê EVA, Rope traction, TPU, Vibram, Vibram® XS TREK. Lekkie i elastyczne obuwie dobrze przystosowane do æwiczeñ ruchowych. ;http://www.eobuwie.com.pl/media/catalog/product/cache/image/650x650/0/0/0000207210691_01_ts.jpg
190;Sneakersy PUMA;Puma ;Lqd Cell Epsilon 371909 01 Puma White/High Risk Red ;Sportowe mêskie;Przyci¹gaj¹ce uwagê buty marki Puma. Lekki wygl¹d zawdziêczaj¹ cholewce: Skóra naturalna - Licowa, Skóra ekologiczna - Skóra ekologiczna, Materia³ - Materia³. Posiadaj¹ wyœció³kê - to materia³. We wnêtrzu butów znajduje siê wk³adka: materia³. Wygodê zwiêksza odpowiednia podeszwa: wysokogatunkowe tworzywo. Buty wzbogacono o technologiê CELL, EVA, LQDCELL. Te buty to miejski styl w dobrym wydaniu. ;http://www.eobuwie.com.pl/media/catalog/product/cache/image/650x650/0/0/0000208155601_01_rz.jpg
191;Buty adidas;adidas, adidas Originals ;Usa 84 FV2049 Ftwwht/Ftwwht/Grethr ;Sportowe mêskie;Modna propozycja marki adidas. Cholewka wyprofilowana z najlepszych surowców: Skóra ekologiczna - Skóra ekologiczna, Materia³ - Materia³. We wnêtrzu butów materia³. Wk³adka to materia³. Podeszwa to wysokogatunkowe tworzywo. Model wyposa¿ono w technologiê EVA. Buty na co dzieñ - ponadczasowe i uniwersalne. ;http://www.eobuwie.com.pl/media/catalog/product/cache/image/650x650/0/0/0000206759047_01_rz.jpg
192;Buty Reebok;Reebok, Reebok Classic ;Evzn FV7931 Trgry1/insred/Vecnav ;Sportowe mêskie;Lekkie sneakersy o sportowym fasonie Reebok. Wygodnie wyprofilowana cholewka to Skóra ekologiczna - Skóra ekologiczna, Materia³ - Materia³. W œrodku buty posiadaj¹ wyœció³kê - materia³. Wk³adka to materia³. Podeszwa - wysokogatunkowe tworzywo. Model wyposa¿ono w technologiê EVA. Kobiece i przyjazne dla stopy, bêd¹ baz¹ dla ca³ego stroju. ;http://www.eobuwie.com.pl/media/catalog/product/cache/image/650x650/0/0/0000206872791_01_rz.jpg
