ID;Nazwa;Marka;Model;Kategoria;Opis;Cena;URL_zdjecia
148;Trekkingi JACK WOLFSKIN;Jack Wolfskin ;Downhill Texapore Mid M 4043871 Dark Blue/Grey ;Męskie@Sportowe;Buty outdoorowe marki Jack Wolfskin. Cholewka o podwyższonej odporności Skóra ekologiczna - Skóra ekologiczna, Materiał - Materiał. Wkładka to materiał. Podeszwa o dobrej trakcji to wysokogatunkowe tworzywo. Model wyposażono w technologię Multifunctional Grip System, Texapore. Dobre buty dla wymagających użytkowników. ;439,00 ;https://www.eobuwie.com.pl/media/catalog/product/cache/image/650x650/0/0/0000207531529_01_pa.jpg
149;Trekkingi COLUMBIA;Columbia ;Canyon Point Mid Waterproof YM5415 Black/Gypsy 010 ;Męskie@Sportowe;Trekkingi Canyon Point Mid Waterproof doskonale sprawdzą się podczas górskich wędrówek. Dzięki zastosowaniu technologii Omni-Tech, zapewniającej wodoodporność i oddychalność, chronią stopy przed nagłymi zmianami pogody. Podeszwa zewnętrzna wykonana została w technologii Omni-Grip, zapewniającej wytrzymałość oraz przyczepność na mokrych i śliskich powierzchniach.  ;339,00 ;https://www.eobuwie.com.pl/media/catalog/product/cache/image/650x650/0/0/0000200337388_01_mn.jpg
150;Trekkingi THE NORTH FACE;The North Face ;Storm Strike II Wp NF0A3RRQGT5I Carafe Brown/Ebony Grey ;Męskie@Sportowe;W kolekcji marki The North Face wygodne buty w teren. Wierzchnia część butów to Skóra ekologiczna - Skóra ekologiczna, Materiał - Materiał. We wnętrzu butów zastosowano materiał. We wnętrzu butów znajduje się wkładka: materiał. Podeszwa to wysokogatunkowe tworzywo, zawdzięcza swoją przyczepność szerokiemu bieżnikowi. Buty wzbogacono o technologię Cradle, Cradle™ Guide, EVA, Heatseeker™, Hydroseal, Icepick, Waterproof, Winter Grip. Idealne na piesze wycieczki, trwałe i wygodne. ;349,00 ;https://www.eobuwie.com.pl/media/catalog/product/cache/image/650x650/0/0/0000201412084_01_pc.jpg
151;Trekkingi CMP;CMP ;Rigel Mid Trekking Shoes Wp 3Q12947 Asphalt/Syrah 62BN ;Męskie@Sportowe;W kolekcji marki CMP na uwagę zasługuje ten model. Wytrzymała cholewka to Skóra naturalna - Zamsz, Materiał - Materiał, Tworzywo - Wysokogatunkowe tworzywo. Wkładka to materiał. Podeszwa z traperem to wysokogatunkowe tworzywo. W butach zastosowano technologię Clima Protect®, CMP Full On Grip, EVA, Ortholite, TPU, Waterproof. Idealne buty na bardziej wymagający teren. ;349,00 ;https://www.eobuwie.com.pl/media/catalog/product/cache/image/650x650/0/0/0000200712666_01_kch.jpg
152;Trekkingi JACK WOLFSKIN;Jack Wolfskin ;Vojo 3 Wt Texapore Mid M 4042461 Black/Burly Yellow XT ;Męskie@Sportowe;Buty outdoorowe marki Jack Wolfskin. Cholewka butów to Skóra naturalna - Welur, Materiał - Materiał. We wnętrzu butów znajduje się wkładka: materiał. Podeszwa odpowiednia do mokrych i śliskich powierzchni: wysokogatunkowe tworzywo. Model wyposażono w technologię EVA, PU (Poliuretan), Texapore. Dobre buty dla wymagających użytkowników. ;419,00 ;https://www.eobuwie.com.pl/media/catalog/product/cache/image/650x650/0/0/0000207531352_01_rz.jpg
153;Trekkingi MERRELL;Merrell ;Ontario 85 Mid Wp J84961 Olive ;Męskie@Sportowe;W propozycjach Merrell kolejny ponadczasowy model. Cholewka o podwyższonej odporności to Skóra naturalna - Zamsz, Materiał - Materiał. Wnętrze oddychające, jego głównym składnikiem jest materiał. W butach zastosowano chłonną wkładkę, to materiał. Podeszwa z traperem to wysokogatunkowe tworzywo. Buty wzbogacono o technologię CORDURA®, Kinder-Fit, Megagrip, Merrell Select Fresh, Merrell Select Grip, Vibram. Idealne na piesze wycieczki, trwałe i wygodne. ;599,00 ;https://www.eobuwie.com.pl/media/catalog/product/cache/image/650x650/0/0/0000207867758_01_rz_3.jpg
154;Trekkingi MERRELL;Merrell ;Annex Trak Low J91803 Sodalite ;Męskie@Sportowe;Buty outdoorowe marki Merrell. Cholewka butów to Skóra naturalna - Nubuk, Materiał - Materiał. We wnętrzu butów znajduje się wkładka: materiał. Podeszwa o dobrej trakcji to wysokogatunkowe tworzywo. Buty wzbogacono o technologię EVA, Merrell Select FIT.ECO, Protective Rubber Toe Cap, Vibram. Idealne buty na bardziej wymagający teren. ;369,00 ;https://www.eobuwie.com.pl/media/catalog/product/cache/image/650x650/0/0/0000199855115_1__ek.jpg
155;Trekkingi SALOMON;Salomon ;Xa Collider Gtx GORE-TEX 411146 27 V0 Black/Ebony/Black ;Męskie@Sportowe;Marka Salomon prezentuje udany model outdoorowy. Wytrzymała cholewka to Materiał - Materiał, Tworzywo - Wysokogatunkowe tworzywo. Komfort noszenia podnosi wkładka: materiał. Podeszwa odpowiednia do mokrych i śliskich powierzchni: wysokogatunkowe tworzywo. W butach zastosowano technologię Contagrip, EnergyCell+, EVA, GORE-TEX® Extended Comfort Footwear, Ortholite. To bezpieczne obuwie terenowe. ;479,00 ;https://www.eobuwie.com.pl/media/catalog/product/cache/image/650x650/0/0/0000207228641_01_ki.jpg
156;Trekkingi JACK WOLFSKIN;Jack Wolfskin ;Vojo 3 Texapore Low M 4042441 Brown/Phantom ;Męskie@Sportowe;W kolekcji marki Jack Wolfskin na uwagę zasługuje ten model. Cholewka o podwyższonej odporności Skóra naturalna - Zamsz, Materiał - Materiał. We wnętrzu butów znajduje się wkładka: materiał. Podeszwa z traperem to wysokogatunkowe tworzywo. W butach zastosowano technologię EVA, Texapore. Idealne buty na bardziej wymagający teren. ;439,00 ;https://www.eobuwie.com.pl/media/catalog/product/cache/image/650x650/0/0/0000207530966_01_rz_1.jpg
157;Buty NIKE;NIKE ;Revolution 5 BQ3204 002 Black/White/Anthracite ;Męskie@Sportowe;Buty biegowe marki NIKE. Oddychająca cholewka to Materiał - Materiał, Tworzywo - Wysokogatunkowe tworzywo. Komfort noszenia podnosi wkładka: materiał. Podeszwa o właściwościach amortyzujących to wysokogatunkowe tworzywo. Buty wzbogacono o technologię 10 mm Offset. To model doskonały do treningu biegowego. ;179,00 ;https://www.eobuwie.com.pl/media/catalog/product/cache/image/650x650/0/0/0000207366572_01_pl.jpg
158;Buty adidas;adidas, adidas Performance ;Fluidstreet FW1702 Grey ;Męskie@Sportowe;Buty biegowe marki adidas. Oddychająca cholewka to Materiał - Materiał. Komfort noszenia podnosi wkładka: materiał. Amortyzująca podeszwa to wysokogatunkowe tworzywo. W butach zastosowano technologię Cloudfoam. Anatomicznie wyprofilowane, sprawdzają się na krótszych i dłuższych dystansach. ;199,00 ;https://www.eobuwie.com.pl/media/catalog/product/cache/image/650x650/0/0/0000206757470_01_rz.jpg
159;Buty ASICS;Asics ;Gel-Quantum 360 5 1021A113 Peacoat/Peacoat 400 ;Męskie@Sportowe;Nowy model biegowy marki Asics. Cholewka solidnie wykończona - Materiał - Materiał, Tworzywo - Wysokogatunkowe tworzywo. Komfort noszenia podnosi wkładka: materiał. Amortyzująca podeszwa to wysokogatunkowe tworzywo. Model wyposażono w technologię AHAR, ComforDry X-40 Sockliner, GEL, Ortholite, Solyte, Trusstic System. To model doskonały do treningu biegowego. ;699,00 ;https://www.eobuwie.com.pl/media/catalog/product/cache/image/650x650/0/0/0000207989030_01_mg.jpg
160;Buty adidas;adidas, adidas Performance ;Solar Glide 3 M FV7255 Signal Pink/Core Black/Copper Metallic ;Męskie@Sportowe;Nowy model biegowy marki adidas. Cholewka solidnie wykończona - Materiał - Materiał, Tworzywo - Wysokogatunkowe tworzywo. Komfort noszenia podnosi wkładka: materiał. Lepszą amortyzację uzyskano dzięki podeszwie - to wysokogatunkowe tworzywo. W butach zastosowano technologię Boost System, Fitcounter, Torsion. Amortyzacja i wsparcie stopy - to odpowiedni fason treningowy. ;479,00 ;https://www.eobuwie.com.pl/media/catalog/product/cache/image/650x650/0/0/0000207590892_01_rz_1.jpg
161;Tenisówki VANS;Vans ;Era VN0A4BV42241 (Japanise Type) Bkrgrdtrwt ;Męskie@Sportowe;Klasyczna propozycja marki Vans. Lekki wygląd zawdzięczają cholewce: Skóra naturalna - Zamsz, Materiał - Materiał. Wewnętrzna wyściółka to materiał. Komfort noszenia podnosi wkładka: materiał. Materiał podeszwy to guma. Stylowe i przyjemne w noszeniu buty codzienne. ;259,00 ;https://www.eobuwie.com.pl/media/catalog/product/cache/image/650x650/0/0/0000208108881_01_rz.jpg
162;Sneakersy NEW BALANCE;New Balance ;ML515RSA Szary ;Męskie@Sportowe;Przyciągające uwagę buty marki New Balance. Lekki wygląd zawdzięczają cholewce: Skóra naturalna - Zamsz, Materiał - Materiał. Wewnętrzna wyściółka to materiał. We wnętrzu butów znajduje się wkładka: materiał. Wygodę zwiększa odpowiednia podeszwa: wysokogatunkowe tworzywo. Te buty to miejski styl w dobrym wydaniu. ;209,00 ;https://www.eobuwie.com.pl/media/catalog/product/cache/image/650x650/0/0/0000207744806_01_rz.jpg
163;Trekkingi SALEWA;Salewa ;Mtn Trainer Mid Gtx GORE-TEX 63458-0985 Asphalt/Fluo Orange ;Męskie@Sportowe;W kolekcji marki Salewa na uwagę zasługuje ten model. Cholewka o podwyższonej odporności Skóra naturalna - Zamsz, Materiał - Materiał, Tworzywo - Wysokogatunkowe tworzywo. We wnętrzu butów znajduje się wkładka: materiał. Podeszwa odpowiednia do mokrych i śliskich powierzchni: wysokogatunkowe tworzywo. W butach zastosowano technologię 3F, Cleansport NXT, Climbing Lacing, GORE-TEX® Extended Comfort Footwear, Ortholite, Vibram. To bezpieczne obuwie terenowe. ;759,00 ;https://www.eobuwie.com.pl/media/catalog/product/cache/image/650x650/0/0/0000201292686_01_dp.jpg
164;Trekkingi CMP;CMP ;Gemini Mid Trekking Shoe Wp 30Q9627 Jungle U940 ;Męskie@Sportowe;Marka CMP prezentuje udany model outdoorowy. Cholewka butów to Skóra ekologiczna - Skóra ekologiczna, Materiał - Materiał. Wkładka to materiał. Podeszwa z traperem to wysokogatunkowe tworzywo. Buty wzbogacono o technologię Clima Protect®, Vibram® XS TREK, Waterproof. Idealne buty na bardziej wymagający teren. ;429,00 ;https://www.eobuwie.com.pl/media/catalog/product/cache/image/650x650/0/0/0000208004206_01_ks.jpg
165;Tenisówki VANS;Vans ;Old Skool VN0A4U3B2O31 (Pig Suede)Apricot/Snwwht ;Męskie@Sportowe;Przyciągające uwagę Vans. Lekki wygląd zawdzięczają cholewce: Skóra naturalna - Zamsz. Podeszwa to guma. Ponadczasowa klasyka gatunku. ;319,00 ;https://www.eobuwie.com.pl/media/catalog/product/cache/image/650x650/0/0/0000207852501_01_mg.jpg
166;Buty adidas;adidas, adidas Performance ;Terrex Snowpitch C.Rdy FV7960 Camel ;Męskie@Sportowe;Modna propozycja marki adidas. Cholewka wyprofilowana z najlepszych surowców: Skóra naturalna - Zamsz, Materiał - Materiał. Posiadają wyściółkę - to materiał. Komfort noszenia podnosi wkładka: materiał. Materiał podeszwy to wysokogatunkowe tworzywo. W butach zastosowano technologię Prima Loft, Traxion. Buty na co dzień - ponadczasowe i uniwersalne. ;469,00 ;https://www.eobuwie.com.pl/media/catalog/product/cache/image/650x650/0/0/0000206887221_01_rz.jpg
167;Trekkingi COLUMBIA;Columbia ;Peakfreak Venture Waterproof BM3992 Black/Gypsy 010 ;Męskie@Sportowe;Peakfreak Venture Waterproof to wodoodporne buty hikingowe, które idealnie sprawdzą się na górskim szlaku. Dzięki zastosowanej w nich technologii Omni-Tech, ichronią przed nagłymi zmianami pogody. Trekkingi wyposażone zostały w ultralekką podeszwę środkową Techlite, zapewniającą długotrwały komfort oraz amortyzację. Podeszwa zewnętrzna wykonana została w technologii Omni-Grip, zapewniającej wytrzymałość oraz przyczepność na mokrych i śliskich powierzchniach. Dzięki technologii Non-Marking obuwie nie pozostawia śladów a także jest bardziej odporne na ścieranie. ;349,00 ;https://www.eobuwie.com.pl/media/catalog/product/cache/image/650x650/0/0/0000197674114_columbia-bm3992_peakfreak_venture_010_czarny_anp_01.jpg
168;Trekkingi JACK WOLFSKIN;Jack Wolfskin ;Jack Wt Mid M 4043491 Cognac/Mocca ;Męskie@Sportowe;Buty outdoorowe marki Jack Wolfskin. Cholewka butów to Skóra naturalna - Nubuk. We wnętrzu butów znajduje się wkładka: materiał. Podeszwa z traperem to wysokogatunkowe tworzywo. Model wyposażono w technologię Comfort Fit Prime, Grip System Prime, Nanuk. Buty posiadają ozdobę, to złoty metal. Dobre buty dla wymagających użytkowników. ;749,00 ;https://www.eobuwie.com.pl/media/catalog/product/cache/image/650x650/0/0/0000207531468_01_pa.jpg
169;Trekkingi COLUMBIA;Columbia ;Vitesse Outdry BM0077 Graphite/Cobalt Blue ;Męskie@Sportowe;W kolekcji marki Columbia na uwagę zasługuje ten model. Wytrzymała cholewka to Materiał - Materiał, Tworzywo - Wysokogatunkowe tworzywo. Wkładka to materiał. Podeszwa o dobrej trakcji to wysokogatunkowe tworzywo. Model wyposażono w technologię OutDry, Waterproof. To bezpieczne obuwie terenowe. ;399,00 ;https://www.eobuwie.com.pl/media/catalog/product/cache/image/650x650/0/0/0000207587137_01_rz.jpg
170;Buty NIKE;NIKE ;Air Max Tailwind IV Se CJ0641 100 White/Black/Ghost Green ;Męskie@Sportowe;Klasyczna propozycja marki NIKE. W cholewce dominuje Skóra ekologiczna - Skóra ekologiczna, Materiał - Materiał. We wnętrzu butów materiał. Komfort noszenia podnosi wkładka: materiał. Wygodę zwiększa odpowiednia podeszwa: wysokogatunkowe tworzywo. Buty wzbogacono o technologię Air Max, BRS 1000, Max Air, Nike Air, TPU. Stylowe i przyjemne w noszeniu buty codzienne. ;729,00 ;https://www.eobuwie.com.pl/media/catalog/product/cache/image/650x650/0/0/0000207996984_01_rz.jpg
171;Sneakersy PUMA;Puma ;Tarrenz Sb 370551 04 Puma Black/Castlerock/White ;Męskie@Sportowe;Modna propozycja marki Puma. W cholewce dominuje Skóra naturalna - Zamsz, Skóra ekologiczna - Skóra ekologiczna, Materiał - Materiał. Wewnętrzna wyściółka to materiał. Komfort noszenia podnosi wkładka: materiał. Materiał podeszwy to wysokogatunkowe tworzywo. W butach zastosowano technologię Non-Marking, SoftFoam. Stylowe i przyjemne w noszeniu buty codzienne. ;299,00 ;https://www.eobuwie.com.pl/media/catalog/product/cache/image/650x650/0/0/0000207348622_01_rz.jpg
172;Buty ASICS;Asics ;Jolt 2 1011A167 Black/White 007 ;Męskie@Sportowe;Buty biegowe marki Asics. Cholewka solidnie wykończona - Skóra ekologiczna - Skóra ekologiczna, Materiał - Materiał. Komfort noszenia podnosi wkładka: materiał. Podeszwa o właściwościach amortyzujących to wysokogatunkowe tworzywo. Model wyposażono w technologię EVA. Anatomicznie wyprofilowane, sprawdzają się na krótszych i dłuższych dystansach. ;159,00 ;https://www.eobuwie.com.pl/media/catalog/product/cache/image/650x650/0/0/0000207043312_01_ksz_1.jpg
173;Buty NIKE;NIKE ;Renew Ride CD0311 009 Photon Dust/Black/Racer Blue ;Męskie@Sportowe;Buty biegowe marki NIKE. Oddychająca cholewka to Materiał - Materiał, Tworzywo - Wysokogatunkowe tworzywo. Komfort noszenia podnosi wkładka: materiał. Lepszą amortyzację uzyskano dzięki podeszwie - to wysokogatunkowe tworzywo. W butach zastosowano technologię Nike Renew. Anatomicznie wyprofilowane, sprawdzają się na krótszych i dłuższych dystansach. ;299,00 ;https://www.eobuwie.com.pl/media/catalog/product/cache/image/650x650/0/0/0000207966185_01_rz.jpg
174;Sneakersy NEW BALANCE;New Balance ;ML393LK1 Czarny ;Męskie@Sportowe;Klasyczna propozycja marki New Balance. W cholewce dominuje Skóra naturalna - Zamsz. Posiadają wyściółkę - to materiał. Komfort noszenia podnosi wkładka: materiał. Wygodę zwiększa odpowiednia podeszwa: wysokogatunkowe tworzywo. Stylowe i przyjemne w noszeniu buty codzienne. ;199,00 ;https://www.eobuwie.com.pl/media/catalog/product/cache/image/650x650/0/0/0000207743922_01_rz_1.jpg
175;Sneakersy NEW BALANCE;New Balance ;ML393SM1 Szary ;Męskie@Sportowe;Modna propozycja marki New Balance. Cholewka wyprofilowana z najlepszych surowców: Skóra naturalna - Zamsz, Materiał - Materiał. Posiadają wyściółkę - to materiał. We wnętrzu butów znajduje się wkładka: materiał. Podeszwa to wysokogatunkowe tworzywo. Buty wzbogacono o technologię EVA. Te buty to miejski styl w dobrym wydaniu. ;199,00 ;https://www.eobuwie.com.pl/media/catalog/product/cache/image/650x650/0/0/0000207743946_01_ki.jpg
176;Buty NIKE;NIKE ;Air Max 200 CT1262 001 Football Grey/Laser Blue ;Męskie@Sportowe;Modna propozycja marki NIKE. Lekki wygląd zawdzięczają cholewce: Skóra ekologiczna - Skóra ekologiczna, Materiał - Materiał. We wnętrzu butów materiał. Wkładka to materiał. Wygodę zwiększa odpowiednia podeszwa: wysokogatunkowe tworzywo. W butach zastosowano technologię Air Max, Cushlon, Max Air, TPU. Buty na co dzień - ponadczasowe i uniwersalne. ;419,00 ;https://www.eobuwie.com.pl/media/catalog/product/cache/image/650x650/0/0/0000207997011_01_mk.jpg
177;Sneakersy VANS;Vans ;Sk8-Hi Mte 2.0 Dx VN0A4P3I2TI1 (Mte) Black/Cam ;Męskie@Sportowe;Przyciągające uwagę buty marki Vans. W cholewce dominuje Skóra naturalna - Licowa, Skóra ekologiczna - Skóra ekologiczna. Wkładka to materiał. Podeszwa to wysokogatunkowe tworzywo. Buty na co dzień - ponadczasowe i uniwersalne. ;469,00 ;https://www.eobuwie.com.pl/media/catalog/product/cache/image/650x650/0/0/0000207852839_01_rz.jpg
178;Buty adidas;adidas, adidas Originals ;Usa 84 FV2049 Ftwwht/Ftwwht/Grethr ;Męskie@Sportowe;Modna propozycja marki adidas. Cholewka wyprofilowana z najlepszych surowców: Skóra ekologiczna - Skóra ekologiczna, Materiał - Materiał. We wnętrzu butów materiał. Wkładka to materiał. Podeszwa to wysokogatunkowe tworzywo. Model wyposażono w technologię EVA. Buty na co dzień - ponadczasowe i uniwersalne. ;259,00 ;https://www.eobuwie.com.pl/media/catalog/product/cache/image/650x650/0/0/0000206759047_01_rz.jpg
179;Buty Reebok;Reebok, Reebok Classic ;Evzn FV7931 Trgry1/insred/Vecnav ;Męskie@Sportowe;Lekkie sneakersy o sportowym fasonie Reebok. Wygodnie wyprofilowana cholewka to Skóra ekologiczna - Skóra ekologiczna, Materiał - Materiał. W środku buty posiadają wyściółkę - materiał. Wkładka to materiał. Podeszwa - wysokogatunkowe tworzywo. Model wyposażono w technologię EVA. Kobiece i przyjazne dla stopy, będą bazą dla całego stroju. ;239,00 ;https://www.eobuwie.com.pl/media/catalog/product/cache/image/650x650/0/0/0000206872791_01_rz.jpg
180;Buty SALOMON;Salomon ;Speedcross 5 409681 Grape Leaf/Black/Phantom ;Męskie@Sportowe;Nowy model biegowy marki Salomon. Cholewka solidnie wykończona - Materiał - Materiał, Tworzywo - Wysokogatunkowe tworzywo. Wkładka to materiał. Lepszą amortyzację uzyskano dzięki podeszwie - to wysokogatunkowe tworzywo. W butach zastosowano technologię Contagrip, EnergyCell+, Ortholite, Quicklace, Sensifit. Anatomicznie wyprofilowane, sprawdzają się na krótszych i dłuższych dystansach. ;449,00 ;https://www.eobuwie.com.pl/media/catalog/product/cache/image/650x650/0/0/0000206957979_01_pc.jpg
181;Buty MERRELL;Merrell ;Vapor Glove 4 J50403 Monument ;Męskie@Sportowe;Buty do biegania marki Merrell. Cholewka solidnie wykończona - Materiał - Materiał, Tworzywo - Wysokogatunkowe tworzywo. Komfort noszenia podnosi wkładka: materiał. Amortyzująca podeszwa to wysokogatunkowe tworzywo. W butach zastosowano technologię Barefoot, CORDURA®, Hyperlock, Merrell Select Fresh, TPU, Vegan Friendly, Vibram. Amortyzacja i wsparcie stopy - to odpowiedni fason treningowy. ;259,00 ;https://www.eobuwie.com.pl/media/catalog/product/cache/image/650x650/0/0/0000201212028_01_ws.jpg
182;Buty NIKE;NIKE ;Wildhorse 6 Claystone Red/Life Lime/Black ;Męskie@Sportowe;Nowy model biegowy marki NIKE. Cholewka solidnie wykończona - Materiał - Materiał, Materiał pokryty tworzywem. Komfort noszenia podnosi wkładka: tworzywo . Podeszwa o właściwościach amortyzujących to wysokogatunkowe tworzywo. Buty wzbogacono o technologię 8 mm Offset, Nike React. Anatomicznie wyprofilowane, sprawdzają się na krótszych i dłuższych dystansach. ;499,00 ;https://www.eobuwie.com.pl/media/catalog/product/cache/image/650x650/0/0/0000208064774_01_rz.jpg
183;Buty MERRELL;Merrell ;Mtl Long Sky J066299 Black/Lime ;Męskie@Sportowe; Buty do biegania marki Merrell. Wygodnie wyprofilowana cholewka to Materiał - Materiał, Tworzywo - Wysokogatunkowe tworzywo. Komfort noszenia podnosi wkładka: materiał. Amortyzująca podeszwa to wysokogatunkowe tworzywo. Model wyposażono w technologię EVA, Megagrip, Vibram® Megagrip. Amortyzacja i wsparcie stopy - to odpowiedni fason treningowy. ;439,00 ;https://www.eobuwie.com.pl/media/catalog/product/cache/image/650x650/0/0/0000207610330_01_rz_1.jpg
184;Buty adidas;adidas, adidas Originals ;Swift Run Rf FV5359 Conavy/Ftwwht/Cblack ;Męskie@Sportowe;Klasyczna propozycja marki adidas. W cholewce dominuje Materiał - Materiał. We wnętrzu butów materiał. We wnętrzu butów znajduje się wkładka: materiał. Podeszwa to wysokogatunkowe tworzywo. Buty wzbogacono o technologię EVA. Stylowe i przyjemne w noszeniu buty codzienne. ;249,00 ;https://www.eobuwie.com.pl/media/catalog/product/cache/image/650x650/0/0/0000206759078_wj_1_.jpg
185;Buty adidas;adidas, adidas Originals ;Zx 1K Boost FY5648 White ;Męskie@Sportowe;Klasyczna propozycja marki adidas. W cholewce dominuje Materiał - Materiał, Tworzywo - Wysokogatunkowe tworzywo. Wewnętrzna wyściółka to materiał. We wnętrzu butów znajduje się wkładka: materiał. Materiał podeszwy to wysokogatunkowe tworzywo. Buty na co dzień - ponadczasowe i uniwersalne. ;449,00 ;https://www.eobuwie.com.pl/media/catalog/product/cache/image/650x650/0/0/0000207668416_01_rz.jpg
186;Buty NIKE;NIKE ;Reax 8 Tr Mesh 621716 008 Black/Black/Anthracite ;Męskie@Sportowe;Buty do ćwiczeń od NIKE. Cholewka solidnie wykończona - Materiał - Materiał, Tworzywo - Wysokogatunkowe tworzywo. Wkładka to materiał. Podeszwa przyjazna dla stopy: wysokogatunkowe tworzywo. Idealne buty dla początkujących i nieco bardziej zaawansowanych sportowców. ;339,00 ;https://www.eobuwie.com.pl/media/catalog/product/cache/image/650x650/0/0/0000207798304_01_rz.jpg
187;Buty adidas;adidas, adidas Performance ;Asweetrain FW1667 Granatowy ;Męskie@Sportowe;Propozycja marki adidas. Wygodnie wyprofilowana cholewka to Materiał - Materiał, Tworzywo - Wysokogatunkowe tworzywo. Komfort noszenia podnosi wkładka: materiał. Podeszwa przyjazna dla stopy: wysokogatunkowe tworzywo. Model wyposażono w technologię Cloudfoam, Ortholite. Lekkie i elastyczne obuwie dobrze przystosowane do ćwiczeń ruchowych. ;229,00 ;https://www.eobuwie.com.pl/media/catalog/product/cache/image/650x650/0/0/0000206757432_01_rz.jpg
188;Buty NIKE;NIKE ;Renew Fusion CD0200 Pure Platinum/Laser Orange ;Męskie@Sportowe;Wygodny fason marki NIKE. Wygodnie wyprofilowana cholewka to Materiał - Materiał, Tworzywo - Wysokogatunkowe tworzywo. We wnętrzu wkładka: materiał. Materiał podeszwy to wysokogatunkowe tworzywo. Buty wzbogacono o technologię Nike Renew. Idealne buty dla początkujących i nieco bardziej zaawansowanych sportowców. ;299,00 ;https://www.eobuwie.com.pl/media/catalog/product/cache/image/650x650/0/0/0000208180832_01_rz.jpg
189;Buty NIKE;NIKE ;Nike Air Max 2090 DC4461 001 Black/Metallic Gold/White ;Męskie@Sportowe;Przyciągające uwagę buty marki NIKE. Cholewka wyprofilowana z najlepszych surowców: Skóra naturalna - Zamsz, Materiał - Materiał. We wnętrzu butów znajduje się wkładka: materiał. Wygodę zwiększa odpowiednia podeszwa: wysokogatunkowe tworzywo. Buty wzbogacono o technologię Air Max, Max Air, Nike Air, TPU. Fason podkreślają detale: ozdoba jest odpinana, złoty metal. Miejski styl i swobodna elegancja. ;649,00 ;https://www.eobuwie.com.pl/media/catalog/product/cache/image/650x650/0/0/0000208064866_01_rz.jpg
190;Buty NIKE;NIKE ;Fury A02416 601 University Red/Black/White ;Męskie@Sportowe;Propozycja marki NIKE. Do charakteru butów pasuje cholewka: Skóra ekologiczna - Skóra ekologiczna, Materiał - Materiał. We wnętrzu wkładka: materiał. Podeszwa - wysokogatunkowe tworzywo. Idealne buty dla początkujących i nieco bardziej zaawansowanych sportowców. ;329,00 ;https://www.eobuwie.com.pl/media/catalog/product/cache/image/650x650/0/0/0000207843844_01_rz.jpg
191;Buty NIKE;NIKE ;Air Max Tailwind IV CT1284 100 White/Laser Blue/Black ;Męskie@Sportowe;Modna propozycja marki NIKE. W cholewce dominuje Materiał - Materiał. We wnętrzu butów materiał. Komfort noszenia podnosi wkładka: materiał. Materiał podeszwy to wysokogatunkowe tworzywo. Model wyposażono w technologię Max Air. Te buty to miejski styl w dobrym wydaniu. ;729,00 ;https://www.eobuwie.com.pl/media/catalog/product/cache/image/650x650/0/0/0000207997042_01_mg.jpg
192;Buty adidas;adidas, adidas Originals ;Zx 700 Hd G55781 Ftwwht/Ftwwht/Cblack ;Męskie@Sportowe;Modna propozycja marki adidas. Lekki wygląd zawdzięczają cholewce: Skóra naturalna - Zamsz, Skóra ekologiczna - Skóra ekologiczna, Materiał - Materiał, Tworzywo - Wysokogatunkowe tworzywo. Posiadają wyściółkę - to skóra ekologiczna. Wkładka to materiał. Materiał podeszwy to wysokogatunkowe tworzywo. Stylowe i przyjemne w noszeniu buty codzienne. ;319,00 ;https://www.eobuwie.com.pl/media/catalog/product/cache/image/650x650/0/0/0000207668539_01_pl.jpg
193;Sneakersy NEW BALANCE;New Balance ;ML574EGN Granatowy ;Męskie@Sportowe;Przyciągające uwagę buty marki New Balance. Cholewka wyprofilowana z najlepszych surowców: skóra naturalna - licowa, zamsz, materiał - materiał. Wewnętrzna wyściółka to materiał. Wkładka to materiał. Materiał podeszwy to wysokogatunkowe tworzywo. Buty wzbogacono o technologię ENCAP, EVA. Stylowe i przyjemne w noszeniu buty codzienne.;279,00 ;https://www.eobuwie.com.pl/media/catalog/product/cache/image/650x650/0/0/0000200369334_01_rz.jpg
194;Sneakersy NEW BALANCE;New Balance ;ML515CAA Czarny ;Męskie@Sportowe;Klasyczna propozycja marki New Balance. W cholewce dominuje Skóra naturalna - Zamsz, Skóra ekologiczna - Skóra ekologiczna, Materiał - Materiał. Posiadają wyściółkę - to materiał. Wkładka to materiał. Wygodę zwiększa odpowiednia podeszwa: wysokogatunkowe tworzywo. Buty na co dzień - ponadczasowe i uniwersalne.  ;299,00 ;https://www.eobuwie.com.pl/media/catalog/product/cache/image/650x650/0/0/0000208050609_01_sw.jpg
