ID;Nazwa;Marka;Model;Kategoria;Opis;Cena;URL_zdjecia
298;Klapki Reebok;Reebok ;Fulgere Slide CN6467 Black ;Męskie@Klapki;Kolejna, udana propozycja marki Reebok. Wygodnie wyprofilowana cholewka to Tworzywo - Wysokogatunkowe tworzywo. We wnętrzu materiał. Komfort noszenia podnosi wkładka: tworzywo . Podeszwa: wysokogatunkowe tworzywo, izoluje od podłoża. Buty wzbogacono o technologię EVA. Ten model będzie doskonałym uzupełnieniem codziennego stroju. ;69,95 ;https://www.eobuwie.com.pl/media/catalog/product/cache/image/650x650/0/0/0000200879499_pl_1_.jpg
299;Klapki adidas;adidas, adidas Performance ;adilette Aqua F35543 Cblack/Ftwwhat/Cblack ;Męskie@Klapki;Dla aktywnych odpowiednią propozycją będą klapki od adidas. O komforcie modelu decyduje wykonanie - cholewka to: Tworzywo - Wysokogatunkowe tworzywo. Wygodę noszenia podnosi wyściółka: tworzywo. Komfort noszenia podnosi wkładka: tworzywo . Podeszwa butów to wysokogatunkowe tworzywo. Swobodna, ciekawa propozycja stworzona z myślą o wygodzie noszenia. ;79,95 ;https://www.eobuwie.com.pl/media/catalog/product/cache/image/650x650/0/0/0000200858586_01_ks.jpg
300;Klapki adidas;adidas, adidas Performance ;adissage F35579 Dkblue/Ftwwht/Dkblue ;Męskie@Klapki;Model dla wymagających od adidas. Wierzchnia część cholewki to: Tworzywo - Wysokogatunkowe tworzywo. We wnętrzu butów wyściółka: materiał. Komfort noszenia podnosi wkładka: tworzywo . Podeszwa to wysokogatunkowe tworzywo. Sprawdzą się w różnych sytuacjach. ;79,00 ;https://www.eobuwie.com.pl/media/catalog/product/cache/image/650x650/0/0/0000200858654_01_gh.jpg
301;Sneakersy CALVIN KLEIN JEANS;Calvin Klein Jeans ;Tanya R0651 Black/Gold ;Damskie@Półbuty;Wygodny fason marki Calvin Klein Jeans. Cholewka solidnie wykończona - Skóra naturalna - Zamsz, Skóra ekologiczna - Skóra ekologiczna, Materiał - Materiał. Komfort noszenia podnosi wkładka: materiał. Materiał podeszwy to wysokogatunkowe tworzywo. Ten model będzie doskonałym uzupełnieniem codziennego stroju. ;289,00 ;https://www.eobuwie.com.pl/media/catalog/product/cache/image/650x650/0/0/0000199734526_1__ki.jpg
302;Buty adidas;adidas, adidas Originals ;Falcon W B28128 Ftwwht/Ftwwht/Crywht ;Damskie@Półbuty;Przyciągające uwagę buty marki adidas. W cholewce dominuje Skóra naturalna - Licowa, Nubuk, Skóra ekologiczna - Skóra ekologiczna, Materiał - Materiał. Wkładka to materiał. Wygodę zwiększa odpowiednia podeszwa: wysokogatunkowe tworzywo. W butach zastosowano technologię EVA, Ortholite, Torsion. Stylowe i przyjemne w noszeniu. ;289,00 ;https://www.eobuwie.com.pl/media/catalog/product/cache/image/650x650/0/0/0000200854335_01_dd_3.jpg
303;Buty NIKE;NIKE ;Mx-720-818 CI3869 001 Black/Metallic Silver/Black ;Damskie@Półbuty;Klasyczna propozycja marki NIKE. W cholewce dominuje Skóra ekologiczna - Skóra ekologiczna, Materiał - Materiał. Wkładka to materiał. Wygodę zwiększa odpowiednia podeszwa: wysokogatunkowe tworzywo. Model wyposażono w technologię Air Max, Dual Density. Stylowe i przyjemne w noszeniu. ;659,00 z;https://www.eobuwie.com.pl/media/catalog/product/cache/image/650x650/0/0/0000207985803_01_rz.jpg
304;Sneakersy JENNY FAIRY;Jenny Fairy ;WS061-01A White ;Damskie@Półbuty;Wygodny fason marki Jenny Fairy. Do charakteru butów pasuje cholewka: Skóra ekologiczna - Skóra ekologiczna, Materiał - Materiał. Komfort noszenia podnosi wkładka: skóra ekologiczna. Podeszwa przyjazna dla stopy: wysokogatunkowe tworzywo. Jeśli ciągle pozostajesz w ruchu wybierz buty na płaskiej podeszwie. ;129,99 ;https://www.eobuwie.com.pl/media/catalog/product/cache/image/650x650/5/9/5903698086842_01_rz.jpg
305;Sneakersy EVA LONGORIA;Eva Longoria ;EL-18-02-0000268 636 ;Damskie@Półbuty;Nowy model marki Eva Longoria. Cholewka solidnie wykończona - Skóra naturalna - Licowa, Zamsz. Komfort noszenia podnosi wkładka: skóra. Podeszwa - wysokogatunkowe tworzywo. Siła tkwi w detalu - tutaj jest to złoty metal. Codzienna, wygodna propozycja w dobrym stylu. ;319,00 ;https://www.eobuwie.com.pl/media/catalog/product/cache/image/650x650/0/0/0000207721951_01_rz.jpg
306;Sneakersy TOMMY HILFIGER;Tommy Hilfiger ;Stud City Snea FW0FW03229 Rwb 020 ;Damskie@Półbuty;Tommy Hilfiger znany jest przede wszystkim z doskonałej jakości polówek, ale marka ma do zaoferowania dużo więcej. W tym uniwersalne i eleganckie obuwie, łączące klasykę ze sportowym stylem ale wyraźnie odcinające się od obuwia wyczynowego.Tommy Hilfiger Stud City to uniwersalne sneakersy damskie, dla kobiet wymagających i ceniących dobry styl. Granatowe Tommy Hilfiger Stud City to kwintesencja eleganckiego, ale zarazem sportowego wyglądu. Na nodze prezentują się zgrabnie i podkreślają sylwetkę.Tommy Hilfiger Stud City wyróżnia z tłumu granatowy zamsz, błyszcząca skóra, czerwona lamówka łącząca podeszwę z cholewką i logotyp marki wykonany z cyrkonii na boku obuwia. Model jest przeznaczony do użytku codziennego.; 279,00 ;https://www.eobuwie.com.pl/media/catalog/product/cache/image/650x650/0/0/0000200528311_01_dd.jpg
307;Sneakersy LACOSTE;Lacoste ;Carnaby Evo Bl 2 Suj 7-37SUJ0012B53 Wht/Pnk ;Damskie@Półbuty;W propozycjach marki Lacoste dziecięce, sznurowane buty. Skóra ekologiczna - Skóra ekologiczna to wierzchnią część cholewki. We wnętrzu materiał, co sprawia, że buty zachowują dobre właściwości higieniczne. Nie zabrakło chłonnej wkładki, to materiał. W podeszwie zastosowano wysokogatunkowe tworzywo. Buty wzbogacono o technologię Ortholite. Buty gwarantują wygodę na co dzień i nie ograniczają ruchu stopy. ;209,00 ;https://www.eobuwie.com.pl/media/catalog/product/cache/image/650x650/0/0/0000201012192_01_pz.jpg
308;Sneakersy KARL LAGERFELD;KARL LAGERFELD ;KL61616 White Lthr/Text w/Blk ;Damskie@Półbuty;Wygodny fason marki KARL LAGERFELD. Wygodnie wyprofilowana cholewka to Skóra naturalna - Licowa, Materiał - Materiał. We wnętrzu wkładka: skóra. Podeszwa przyjazna dla stopy: wysokogatunkowe tworzywo. Siła tkwi w detalu - tutaj jest to metal, ozdoba jest odpinana. Codzienna, wygodna propozycja w dobrym stylu. ;699,00 ;https://www.eobuwie.com.pl/media/catalog/product/cache/image/650x650/0/0/0000207560581_02_rz.jpg
309;Buty VIBRAM FIVEFINGERS;Vibram Fivefingers ;V-Trek 18W7401 Black/Gum ;Damskie@Półbuty;Modna propozycja marki Vibram Fivefingers. Lekki wygląd zawdzięczają cholewce: Materiał - Materiał. We wnętrzu butów znajduje się wkładka: materiał. Podeszwa to wysokogatunkowe tworzywo. Buty wzbogacono o technologię 4 mm Drop, Megagrip, Vibram. Buty na co dzień - ponadczasowe i uniwersalne. ;389,00 ;https://www.eobuwie.com.pl/media/catalog/product/cache/image/650x650/0/0/0000207492660_01_sw_1.jpg
310;Trapery JENNY FAIRY;Jenny Fairy ;WS99862-02 White ;Damskie@Półbuty;Przeznaczone na trudniejszy teren obuwie marki Jenny Fairy. Użyta w butach cholewka to Skóra ekologiczna - Skóra ekologiczna. We wnętrzu butów znajduje się wkładka: skóra ekologiczna. Podeszwa odpowiednia do mokrych i śliskich powierzchni: wysokogatunkowe tworzywo. Dobre buty dla wymagających użytkowników. ;79,99 ;https://www.eobuwie.com.pl/media/catalog/product/cache/image/650x650/5/9/5903419645143_01_rz.jpg
311;Buty adidas;adidas, adidas Originals ;Superstar J FU7712 Ftwwht/Cblack/Ftwwht ;Damskie@Półbuty;W propozycjach marki adidas dziecięce, sznurowane trzewiki. Wierzchnia część butów tworzy Skóra naturalna - Licowa, Tworzywo - Wysokogatunkowe tworzywo. We wnętrzu materiał, co sprawia, że buty zachowują dobre właściwości higieniczne Nie zabrakło chłonnej wkładki, to materiał. Podeszwa to wysokogatunkowe tworzywo. Model wyposażono w technologię Ortholite. Buty gwarantują wygodę na co dzień i nie ograniczają ruchu stopy. ;219,00 ;https://www.eobuwie.com.pl/media/catalog/product/cache/image/650x650/0/0/0000206693174_01_kk.jpg
312;Buty adidas;adidas, adidas Originals ;X_Plr J BY9879 Cblack/Cblack/Cblack ;Damskie@Półbuty;W tym sezonie postaw na oryginalne dodatki i wybierz buty z nowej kolekcji adidas Originals! Przewiewna cholewka z siateczki mesh współgra z naturalnym ruchem nogi. Wzmocnienia z ekologicznej skóry po bokach stabilizują sylwetkę. Elastyczny system sznurowania z gumowym stoperem zapewnia optymalne dopasowanie i pozwala na szybkie zakładanie. Wyjmowana (technologia adiFIT) wkładka z antybakteryjną technologią Ortholite dostosowuje się do kształtu stopy. Dzięki środkowej podeszwie z pianką EVA, która absorbuje wstrząsy, każdy krok jest lekki. Antypoślizgowy bieżnik z odpornej na ścieranie gumy odznacza się bardzo dobrą przyczepnością. ;169,00 ;https://www.eobuwie.com.pl/media/catalog/product/cache/image/650x650/0/0/0000199808715_1__jf.jpg
313;Buty NIKE;NIKE ;Air Max 200 AT6175 002 Pure Platinum/White/Cool Grey ;Damskie@Półbuty;Nowy model marki NIKE. Cholewka solidnie wykończona - Skóra ekologiczna - Skóra ekologiczna, Materiał - Materiał. We wnętrzu wkładka: materiał. Podeszwa - wysokogatunkowe tworzywo. Model wyposażono w technologię Air Max, Cushlon, Max Air, Nike Air, TPU. Ten model będzie doskonałym uzupełnieniem codziennego stroju. ;419,00 ;https://www.eobuwie.com.pl/media/catalog/product/cache/image/650x650/0/0/0000207996922_01_rz.jpg
314;Sneakersy BIG STAR;Big Star ;GG274083 Lt.Pink ;Damskie@Półbuty;Nowy model marki BIG STAR. Cholewka solidnie wykończona - Skóra ekologiczna - Skóra ekologiczna. We wnętrzu wkładka: materiał. Podeszwa - wysokogatunkowe tworzywo. Jeśli ciągle pozostajesz w ruchu wybierz buty na płaskiej podeszwie. ;99,00 ;https://www.eobuwie.com.pl/media/catalog/product/cache/image/650x650/0/0/0000207434172_01_mg.jpg
315;Sneakersy TOGOSHI;Togoshi ;TG-22-05-000261 644 ;Damskie@Półbuty;Nowy model marki Togoshi. Wygodnie wyprofilowana cholewka to Skóra naturalna - Licowa, Zamsz. Wkładka to skóra ekologiczna. Podeszwa - wysokogatunkowe tworzywo. Jeśli ciągle pozostajesz w ruchu wybierz buty na płaskiej podeszwie. ;479,00 ;https://www.eobuwie.com.pl/media/catalog/product/cache/image/650x650/0/0/0000207460737_01_rz.jpg
316;Sneakersy TOMMY JEANS;Tommy Jeans ;High Cleated Tommy Jeans Sneaker EN0EN00948 Black BDS ;Damskie@Półbuty;Ciekawa propozycja marki Tommy Jeans. Cholewka dopasowuje się do stopy - Skóra naturalna - Licowa, Skóra ekologiczna - Skóra ekologiczna. Wnętrze oddychające: materiał. Wkładka to materiał. Podeszwa to wysokogatunkowe tworzywo. Dobra alternatywa dla obcasów - wygodne koturny ;309,00 ;https://www.eobuwie.com.pl/media/catalog/product/cache/image/650x650/0/0/0000207168046_01_rz.jpg
317;Sneakersy PUMA;Puma ;Cali Superbold Jr 374270 01 Puma White/Burgundy ;Damskie@Półbuty;Wygodne, sznurowane buty dziecięce marki Puma. Wytrzymała cholewka to Skóra naturalna - Licowa, Skóra ekologiczna - Skóra ekologiczna. Wnętrze oddychające, jego głównym składnikiem jest materiał. Wkładka w tych butach to skóra ekologiczna, zwiększa komfort noszenia. Podeszwa to wysokogatunkowe tworzywo. Buty gwarantują wygodę na co dzień i nie ograniczają ruchu stopy. ;239,00 ;https://www.eobuwie.com.pl/media/catalog/product/cache/image/650x650/0/0/0000207345164_01_mt.jpg
318;Sneakersy TRUSSARDI JEANS;Trussardi Jeans ;79A00549 P724 ;Damskie@Półbuty;Wygodny fason marki Trussardi Jeans. Do charakteru butów pasuje cholewka: Skóra naturalna - Zamsz, Materiał - Materiał. We wnętrzu wkładka: materiał. Materiał podeszwy to wysokogatunkowe tworzywo. Ten model będzie doskonałym uzupełnieniem codziennego stroju. ;469,00 ;https://www.eobuwie.com.pl/media/catalog/product/cache/image/650x650/0/0/0000207539129_01_rz.jpg
319;Sneakersy CALVIN KLEIN JEANS;Calvin Klein Jeans ;Reika R0666 Black/Silver ;Damskie@Półbuty;Nowy model marki Calvin Klein Jeans. Wygodnie wyprofilowana cholewka to Materiał - Materiał, Tworzywo - Wysokogatunkowe tworzywo. Wkładka to materiał. Podeszwa - wysokogatunkowe tworzywo. Ten model będzie doskonałym uzupełnieniem codziennego stroju. ;289,00 ;https://www.eobuwie.com.pl/media/catalog/product/cache/image/650x650/0/0/0000199792618_1__ki.jpg
320;Buty Reebok;Reebok, Reebok Classic ;Cl Lthr 2232 White ;Damskie@Półbuty;Nowy model marki Reebok. Wygodnie wyprofilowana cholewka to Skóra naturalna - Licowa. We wnętrzu wkładka: materiał. Podeszwa - wysokogatunkowe tworzywo. W butach zastosowano technologię EVA. Codzienna, wygodna propozycja w dobrym stylu. ;249,00 ;https://www.eobuwie.com.pl/media/catalog/product/cache/image/650x650/0/0/0000191811454_01_sw.jpg
321;Sneakersy NEW BALANCE;New Balance ;WL393SP1 Różowy ;Damskie@Półbuty;Nowy model marki New Balance. Do charakteru butów pasuje cholewka: Skóra naturalna - Zamsz, Skóra ekologiczna - Skóra ekologiczna, Materiał - Materiał. Komfort noszenia podnosi wkładka: materiał. Materiał podeszwy to wysokogatunkowe tworzywo. W butach zastosowano technologię EVA. Codzienna, wygodna propozycja w dobrym stylu. ;239,00 ;https://www.eobuwie.com.pl/media/catalog/product/cache/image/650x650/0/0/0000208050678_01_mg.jpg
322;Sneakersy NEW BALANCE;New Balance ;U410CB Granatowy ;Damskie@Półbuty;Klasyczne sneakersy z nowej kolekcji New Balance przypadną do gustu kobietom ceniącym modne i wygodne dodatki! Granatowa cholewka z przewiewnego materiału została wzmocniona wstawkami z licowej skóry. Miękki język niweluje nacisk klasycznego sznurowania. Tekstylna wyściółka oraz wkładka pozwalają stopie oddychać. Elastyczna podeszwa środkowa lekko amortyzuje, natomiast antypoślizgowy bieżnik odznacza się bardzo dobrą przyczepnością. Lekkie zakrzywienie obuwia pozwala na płynniejszy ruch. Szare logo New Balance podkreśla markę produktu. ;219,00 ;https://www.eobuwie.com.pl/media/catalog/product/cache/image/650x650/8/0/803577_new_balance_u410cb_classics_niebieski_ac_01.jpg
323;Sneakersy NEW BALANCE;New Balance ;WL574CLD Biały ;Damskie@Półbuty;Przyciągające uwagę buty marki New Balance. Cholewka wyprofilowana z najlepszych surowców: Skóra ekologiczna - Skóra ekologiczna. Wkładka to materiał. Podeszwa to wysokogatunkowe tworzywo. Buty wzbogacono o technologię ENCAP. Miejski styl i swobodna elegancja. ;269,00 ;https://www.eobuwie.com.pl/media/catalog/product/cache/image/650x650/0/0/0000207744448_01_rz.jpg
324;Sneakersy EVA MINGE;Eva Minge ;EM-60-08-001123 110 ;Damskie@Półbuty;Nowy model marki Eva Minge. Wygodnie wyprofilowana cholewka to Skóra naturalna - Licowa. Komfort noszenia podnosi wkładka: skóra ekologiczna. Podeszwa - wysokogatunkowe tworzywo. Ten model będzie doskonałym uzupełnieniem codziennego stroju. ;439,00 ;https://www.eobuwie.com.pl/media/catalog/product/cache/image/650x650/0/0/0000207953758_01_bs_kopia.jpg
325;Trampki CONVERSE;Converse ;Ctas Ox 566728C White/Gold/Rose Maroon ;Damskie@Półbuty;Modna propozycja marki Converse. Lekki wygląd zawdzięczają cholewce: Skóra ekologiczna - Skóra ekologiczna. Materiał podeszwy to guma. Ponadczasowa klasyka gatunku. ;269,00 ;https://www.eobuwie.com.pl/media/catalog/product/cache/image/650x650/0/0/0000207021488_1_.jpg
326;Tenisówki VANS;Vans ;Old Skool VN000D3HY28 Black/White ;Damskie@Półbuty;Przyciągające uwagę Vans. Cholewka butów to Skóra naturalna - Licowa, Materiał - Materiał. Materiał podeszwy to guma. Ponadczasowa klasyka gatunku. ;259,00 ;https://www.eobuwie.com.pl/media/catalog/product/cache/image/650x650/0/0/0000197850310-vans-old_skool_d3hy28_black_white-ap-001.jpg
327;Tenisówki VANS;Vans ;Authentic Hc VN0A4UUC1AA1 (Diy) Checkerboard/Tr Wht ;Damskie@Półbuty;Wygodne trampki marki Vans. W cholewce dominuje Materiał - Materiał. Podeszwa butów to guma. Oldschoolowy fason nigdy nie wychodzi z mody. ;239,00 ;https://www.eobuwie.com.pl/media/catalog/product/cache/image/650x650/0/0/0000208108799_01_rz.jpg
328;Trampki BIG STAR;Big Star ;GG274014 Red ;Damskie@Półbuty;Propozycja marki BIG STAR. Cholewka solidnie wykończona - Skóra ekologiczna - Skóra ekologiczna. We wnętrzu wkładka: materiał. Materiał podeszwy to guma. Jeśli ciągle pozostajesz w ruchu wybierz buty na płaskiej podeszwie. ;99,00 ;https://www.eobuwie.com.pl/media/catalog/product/cache/image/650x650/0/0/0000207433854_01_ts.jpg
329;Sneakersy CALVIN KLEIN JEANS;Calvin Klein Jeans ;Beth R0648 Black/Gold ;Damskie@Półbuty;Ciekawa propozycja marki Calvin Klein Jeans. O wygodzie butów decyduje cholewka: Skóra naturalna - Licowa, Zamsz, Materiał - Materiał. Wygodną alternatywą dla obcasa jest koturn - w tym modelu ma wysokość 8 cm. We wnętrzu butów materiał. Komfort noszenia podnosi wkładka: materiał. Materiał podeszwy to wysokogatunkowe tworzywo. Dobra alternatywa dla obcasów - wygodne koturny ;399,00 ;https://www.eobuwie.com.pl/media/catalog/product/cache/image/650x650/0/0/0000199734441_1__ts.jpg
330;Sneakersy VANS;Vans ;Sk8-Hi Mte 2.0 Dx VN0A4P3I2UQ1 (Mte) Blue Block/Marshmlw ;Damskie@Półbuty;Klasyczna propozycja marki Vans. Cholewka wyprofilowana z najlepszych surowców: Skóra naturalna - Zamsz. We wnętrzu butów znajduje się wkładka: materiał. Podeszwa to guma. Model wyposażono w technologię MTE 360™, Ultra Cush. Buty na co dzień - ponadczasowe i uniwersalne. ;379,00 ;https://www.eobuwie.com.pl/media/catalog/product/cache/image/650x650/0/0/0000207852976_rz__01.jpg
331;Sneakersy GEOX;Geox ;D Leelu' G D94FFG 08522 C1000 White ;Damskie@Półbuty;Wygodny fason marki Geox. Cholewka solidnie wykończona - Skóra naturalna - Licowa, Zamsz. Wkładka to skóra. Podeszwa - wysokogatunkowe tworzywo. Buty wzbogacono o technologię Geox Respira. Jeśli ciągle pozostajesz w ruchu wybierz buty na płaskiej podeszwie. ;429,00 ;https://www.eobuwie.com.pl/media/catalog/product/cache/image/650x650/0/0/0000208025409_01_rz.jpg
332;Sneakersy SPRANDI;Sprandi ;WP40-9284Y Pink ;Damskie@Półbuty;Nowy model marki Sprandi. Wygodnie wyprofilowana cholewka to Materiał - Materiał. We wnętrzu wkładka: materiał. Podeszwa przyjazna dla stopy: wysokogatunkowe tworzywo. Ten model będzie doskonałym uzupełnieniem codziennego stroju. ;129,99 ;https://www.eobuwie.com.pl/media/catalog/product/cache/image/650x650/5/9/5903419665790_01_pl.jpg
333;Szpilki GINO ROSSI;Gino Rossi ;DCI567-MIYACROCO Black ;Damskie@Półbuty;Elegancka propozycja marki Gino Rossi. Cholewka butów wykonana starannie - Skóra naturalna - Licowa. Lekkości kroku dodają obcasy o wysokości 10,5 cm. We wnętrzu butów wyściółka: skóra. We wnętrzu wkładka - skóra. Materiał podeszwy to wysokogatunkowe tworzywo. Kobiece, zgrabne podkreślają linię łydek i czynią sylwetkę smuklejszą. ;199,99 ;https://www.eobuwie.com.pl/media/catalog/product/cache/image/650x650/2/2/2230004855599_01_pl.jpg
334;Szpilki TOMMY HILFIGER;Tommy Hilfiger ;Essential High Heel Pump FW0FW05136 Desert Sky DW5 ;Damskie@Półbuty;Zgrabny fason na obcasie od TOMMY HILFIGER. Cholewka przyjemnie wyprofilowana - Materiał - Materiał. Sylwetkę podkreśla obcas o wysokości 9 cm. Wnętrze materiał. Wkładka to skóra. Podeszwa to wysokogatunkowe tworzywo. Dzięki kobiecemu fasonowi na obcasie sylwetka jest zgrabna i wysmuklona. ;299,00 ;https://www.eobuwie.com.pl/media/catalog/product/cache/image/650x650/0/0/0000207373464_01_mg.jpg
335;Szpilki R.POLAŃSKI;R.Polański ;1042 Różowy Lico ;Damskie@Półbuty;Elegancka propozycja marki R.Polański. Cholewka butów wykonana starannie - Skóra naturalna - Licowa. Fason wyposażono w obcas o wysokości 9 cm. Wygodę noszenia podnosi wyściółka: skóra. Wkładka to skóra. Podeszwa - wysokogatunkowe tworzywo. Kobiece, zgrabne podkreślają linię łydek i czynią sylwetkę smuklejszą. ;229,00 ;https://www.eobuwie.com.pl/media/catalog/product/cache/image/650x650/0/0/0000208029926_01_bs_kopia.jpg
336;Szpilki JENNY FAIRY;Jenny Fairy ;TS4714-02A Maroon ;Damskie@Półbuty;Elegancka propozycja marki Jenny Fairy. Cholewka przyjemnie wyprofilowana - Skóra ekologiczna - Skóra ekologiczna. Sylwetkę podkreśla obcas o wysokości 10 cm. Wnętrze skóra ekologiczna. Wkładka to skóra ekologiczna. Podeszwa - wysokogatunkowe tworzywo. Dzięki kobiecemu fasonowi na obcasie sylwetka jest zgrabna i wysmuklona. ;69,99 ;https://www.eobuwie.com.pl/media/catalog/product/cache/image/650x650/5/9/5903419706271_01_ts.jpg
337;Sneakersy TOMMY HILFIGER;Tommy Hilfiger ;Tommy Retro Branded Sneaker FW0FW04305 Black 990 ;Damskie@Półbuty;Nowy model marki TOMMY HILFIGER. Wygodnie wyprofilowana cholewka to Skóra naturalna - Licowa, Skóra ekologiczna - Skóra ekologiczna, Materiał - Materiał. Komfort noszenia podnosi wkładka: materiał. Podeszwa - wysokogatunkowe tworzywo. Jeśli ciągle pozostajesz w ruchu wybierz buty na płaskiej podeszwie. ;309,00 ;https://www.eobuwie.com.pl/media/catalog/product/cache/image/650x650/0/0/0000206273734_01_pz.jpg
338;Buty adidas;adidas, adidas Originals ;Rivalry Low J EG3636 Ftwwht/Ftwwht/Cblack ;Damskie@Półbuty;Przyciągające uwagę buty marki adidas. Cholewka wyprofilowana z najlepszych surowców: Skóra naturalna - Pokryta tworzywem, Skóra ekologiczna - Skóra ekologiczna. Wkładka to materiał. Wygodę zwiększa odpowiednia podeszwa: wysokogatunkowe tworzywo. Model wyposażono w technologię Ortholite. Miejski styl i swobodna elegancja. ;199,00 ;https://www.eobuwie.com.pl/media/catalog/product/cache/image/650x650/0/0/0000206694959_01_wj.jpg
339;Sneakersy VANS;Vans ;Sk8-Hi Mte 2.0 Dx VN0A4P3I2NF1 (Mte) Apricot/Black ;Damskie@Półbuty;Przyciągające uwagę buty marki Vans. W cholewce dominuje Skóra naturalna - Licowa, Materiał - Materiał. Wkładka to materiał. Podeszwa to wysokogatunkowe tworzywo. W butach zastosowano technologię MTE 360™, Prima Loft, Ultra Cush. Stylowe i przyjemne w noszeniu. ;459,00 ;https://www.eobuwie.com.pl/media/catalog/product/cache/image/650x650/0/0/0000207853010_01_rz.jpg
340;Sneakersy SPRANDI;Sprandi ;WP07-91305-01 Grey ;Damskie@Półbuty;Wygodny fason marki Sprandi. Cholewka solidnie wykończona - Skóra naturalna - Zamsz, Skóra ekologiczna - Skóra ekologiczna, Materiał - Materiał. Komfort noszenia podnosi wkładka: materiał. Podeszwa przyjazna dla stopy: wysokogatunkowe tworzywo. Jeśli ciągle pozostajesz w ruchu wybierz buty na płaskiej podeszwie. ;159,99 ;https://www.eobuwie.com.pl/media/catalog/product/cache/image/650x650/5/9/5903419616884_01_rz.jpg
341;Sneakersy KARL LAGERFELD;KARL LAGERFELD ;KL61781 Black Glitter W/Silver ;Damskie@Półbuty;Nowy model marki KARL LAGERFELD. Cholewka solidnie wykończona - Skóra naturalna - Licowa, Zamsz, Materiał - Materiał. Komfort noszenia podnosi wkładka: skóra. Podeszwa - wysokogatunkowe tworzywo. Jeśli ciągle pozostajesz w ruchu wybierz buty na płaskiej podeszwie. ;759,00 ;https://www.eobuwie.com.pl/media/catalog/product/cache/image/650x650/0/0/0000207560673_01_kt.jpg
342;Sneakersy LASOCKI;Lasocki ;WI12-DELEKTA-01 Silver ;Damskie@Półbuty;Wygodny fason marki Lasocki. Do charakteru butów pasuje cholewka: Skóra naturalna - Nabłyszczana, Licowa, Zamsz. Komfort noszenia podnosi wkładka: skóra. Podeszwa przyjazna dla stopy: wysokogatunkowe tworzywo. Codzienna, wygodna propozycja w dobrym stylu. ;73,99 ;https://www.eobuwie.com.pl/media/catalog/product/cache/image/650x650/5/9/5903419025679_01_kt.jpg
343;Buty NIKE;NIKE ;Air Max Excee CD5432 104 White/Aura/Pale Ivory ;Damskie@Półbuty;Wygodny fason marki NIKE. Cholewka solidnie wykończona - Skóra naturalna - Licowa, Zamsz, Materiał - Materiał. Wkładka to materiał. Podeszwa przyjazna dla stopy: wysokogatunkowe tworzywo. Buty wzbogacono o technologię Max Air. Codzienna, wygodna propozycja w dobrym stylu. ;379,00 ;https://www.eobuwie.com.pl/media/catalog/product/cache/image/650x650/0/0/0000207985773_01_rz.jpg
344;Sneakersy NEW BALANCE;New Balance ;CW997HBD Biały Kolorowy ;Damskie@Półbuty;Modna propozycja marki New Balance. Cholewka wyprofilowana z najlepszych surowców: Skóra naturalna - Licowa, Zamsz, Materiał - Materiał. Wkładka to materiał. Materiał podeszwy to wysokogatunkowe tworzywo. Stylowe i przyjemne w noszeniu. ;209,00 ;https://www.eobuwie.com.pl/media/catalog/product/cache/image/650x650/0/0/0000207028227_01_mf.jpg
345;Półbuty BALDOWSKI;Baldowski ;D03270-4330-001 Nappa Czarna ;Damskie@Półbuty;Zgrabny fason na obcasie od Baldowski. Dobrze układająca się na stopie cholewka to Skóra naturalna - Licowa. Lekkości kroku dodają obcasy o wysokości 6 cm. Wnętrze skóra. Wkładka to skóra. Podeszwa - wysokogatunkowe tworzywo. Stylowa ozdoba dodaje butom wdzięku: ozdoba nie jest odpinana , złoty metal. Model na obcasie unosi sylwetkę i dodaje jej lekkości. ;419,00 ;https://www.eobuwie.com.pl/media/catalog/product/cache/image/650x650/0/0/0000207640290_01_rz.jpg
346;Półbuty DEEZEE;DeeZee ;Mimosa Beige ;Damskie@Półbuty;Zgrabny fason na obcasie od DeeZee. Dobrze układająca się na stopie cholewka to Skóra ekologiczna - Skóra ekologiczna. Lekkości kroku dodają obcasy o wysokości 9,5 cm. Wygodę noszenia podnosi wyściółka: materiał, skóra ekologiczna. We wnętrzu wkładka - skóra ekologiczna. Podeszwa - wysokogatunkowe tworzywo. Dzięki kobiecemu fasonowi na obcasie sylwetka jest zgrabna i wysmuklona. ;69,99 ;https://www.eobuwie.com.pl/media/catalog/product/cache/image/650x650/5/9/5903419842498_01_ksz.jpg
347;Półbuty LASOCKI;Lasocki ;896-01C Brown ;Damskie@Półbuty;Model na obcasie Lasocki. Dobrze układająca się na stopie cholewka to Skóra naturalna - Licowa. Lekkości kroku dodają obcasy o wysokości 8 cm. Wygodę noszenia podnosi wyściółka: skóra. Komfort noszenia podnosi wkładka: skóra. Podeszwa - wysokogatunkowe tworzywo. Kobiece, zgrabne podkreślają linię łydek i czynią sylwetkę smuklejszą. ;219,99 ;https://www.eobuwie.com.pl/media/catalog/product/cache/image/650x650/5/9/5903698328256_01_rz.jpg
