ID;Nazwa;Marka;Model;Kategoria;Opis;Cena;URL_zdjecia
446; Sneakersy NEW BALANCE;New Balance ;WL426LD1 Biały Różowy ;Damskie@Sportowe;Wygodny fason marki New Balance. Wygodnie wyprofilowana cholewka to Skóra ekologiczna - Skóra ekologiczna, Materiał - Materiał. We wnętrzu wkładka: materiał. Podeszwa przyjazna dla stopy: wysokogatunkowe tworzywo. Ten model będzie doskonałym uzupełnieniem codziennego stroju. ;259,00 ;https://www.eobuwie.com.pl/media/catalog/product/cache/image/650x650/0/0/0000207744387_01_rz.jpg
447;Trampki VANS;Vans ;Era Tc Lug VN0A4UUE1UM1 (66 Supply)Lmnchrom/Trwht ;Damskie@Sportowe;Przyciągające uwagę Vans. Cholewka butów to Skóra naturalna - Zamsz, Materiał - Materiał. Podeszwa butów to guma. Ponadczasowa klasyka gatunku. ;319,00 ;https://www.eobuwie.com.pl/media/catalog/product/cache/image/650x650/0/0/0000207565173_01_rz.jpg
448;Buty adidas;adidas, adidas Originals ;Multix J FX6230 Crywht/Ftwwht/Cblack ;Damskie@Sportowe;Wygodne, sznurowane trzewiki dziecięce marki adidas. Wytrzymała cholewka to Materiał - Materiał, Tworzywo - Wysokogatunkowe tworzywo. We wnętrzu materiał, co sprawia, że buty zachowują dobre właściwości higieniczne We wnętrzu butów znajduje się wkładka: materiał. W podeszwie zastosowano wysokogatunkowe tworzywo. Buty odpowiadają potrzebom rozwijającej się stopy, zapewniając jej swobodę ruchu, ale także lekką stabilizację. ;269,00 ;https://www.eobuwie.com.pl/media/catalog/product/cache/image/650x650/0/0/0000207669697_01_rz.jpg
449;Buty adidas;adidas, adidas Originals ;Multix J FX6394 Greone/Glopnk/Cblack ;Damskie@Sportowe;Lekkie, sznurowane buty marki adidas. Wierzchnia część butów tworzy Materiał - Materiał, Tworzywo - Wysokogatunkowe tworzywo. We wnętrzu materiał, co sprawia, że buty zachowują dobre właściwości higieniczne Wkładka w tych butach to materiał, zwiększa komfort noszenia. W podeszwie zastosowano wysokogatunkowe tworzywo. Buty zapewniają zdrowy rozwój stopy i komfort noszenia. ;269,00 ;https://www.eobuwie.com.pl/media/catalog/product/cache/image/650x650/0/0/0000207669758_01_rz.jpg
450;Buty NIKE;NIKE ;W Air Max 200 AT6175 105 Summit White/Black ;Damskie@Sportowe;Wygodny fason marki NIKE. Wygodnie wyprofilowana cholewka to Skóra ekologiczna - Skóra ekologiczna, Materiał - Materiał. Komfort noszenia podnosi wkładka: materiał. Podeszwa - wysokogatunkowe tworzywo. W butach zastosowano technologię Air Max, Max Air, Nike Air, TPU. Jeśli ciągle pozostajesz w ruchu wybierz buty na płaskiej podeszwie. ;419,00 ;https://www.eobuwie.com.pl/media/catalog/product/cache/image/650x650/0/0/0000207985735_01_rz.jpg
451;Buty adidas;adidas, adidas Originals ;Superstar J FU7713 Cblack/Cblack/Cblack ;Damskie@Sportowe;W propozycjach marki adidas dziecięce, sznurowane trzewiki. Wierzchnia część butów tworzy Skóra naturalna - Licowa. We wnętrzu materiał, co sprawia, że buty zachowują dobre właściwości higieniczne Wkładka w tych butach to materiał, zwiększa komfort noszenia. Podeszwa - wysokogatunkowe tworzywo - izoluje od podłoża. Buty zapewniają zdrowy rozwój stopy i komfort noszenia. ;199,00 ;https://www.eobuwie.com.pl/media/catalog/product/cache/image/650x650/0/0/0000206764409_01_ksz.jpg
452;Buty NIKE;NIKE ;Air Max Excee CD5432 600 Washed Coral/Black/White ;Damskie@Sportowe;Propozycja marki NIKE. Wygodnie wyprofilowana cholewka to Skóra naturalna - Licowa, Zamsz, Materiał - Materiał. Wkładka to materiał. Podeszwa przyjazna dla stopy: wysokogatunkowe tworzywo. Buty wzbogacono o technologię Max Air. Codzienna, wygodna propozycja w dobrym stylu. ;379,00 ;https://www.eobuwie.com.pl/media/catalog/product/cache/image/650x650/0/0/0000207985797_01_rz.jpg
453;Buty NIKE;NIKE ;Nike Air Max Plus CZ0373 100 Sail/Opti Yellow/Digital Pink ;Damskie@Sportowe;Nowy model marki NIKE. Cholewka solidnie wykończona - Skóra ekologiczna - Skóra ekologiczna, Materiał - Materiał. Komfort noszenia podnosi wkładka: materiał. Materiał podeszwy to wysokogatunkowe tworzywo. Buty wzbogacono o technologię Air Max, Nike Air. Ten model będzie doskonałym uzupełnieniem codziennego stroju. ;579,00 ;https://www.eobuwie.com.pl/media/catalog/product/cache/image/650x650/0/0/0000207985858_01_rz.jpg
454;Buty ASICS;Asics ;Contend 5 Gs 1014A049 Black/Black 020 ;Damskie@Sportowe;Doskonały punkt wyjścia dla osób, które chcą dopiero rozpocząć swoją przygodę z bieganiem, posiadających neutralną stopę oraz ceniących komfort i wszechstronność buta. Podeszwa środkowa AmpliFoam oraz wstawka GEL pod piętą gwarantują dobrą amortyzację oraz komfort. But posiada dodatkowe wsparcie w okolicach śródstopia, a także cholewkę MESH, odpowiadającą za skuteczną wentylację oraz termoregulację. ;159,00 ;https://www.eobuwie.com.pl/media/catalog/product/cache/image/650x650/0/0/0000200791357_01_pl.jpg
455;Buty ASICS;Asics ;Jolt 2 Gs 1014A035 Indigo Blue/Astral 402 ;Damskie@Sportowe;Dziecięce buty do biegania JOLT 2 GS zostały zaprojektowane tak, aby zapewnić młodym stopom wygodę i stabilność, tak by dzieci mogły pokonywać naprawdę duże dystanse. Buty zostały wyposażone w podeszwę środkową EVA i wyprofilowaną wkładkę EVA, aby zapewnić stopom podparcie w odpowiednich miejscach. Jednocześnie wkładka i cholewka są wykonane z siateczki, aby powietrze miało swobodny dostęp do stóp. Wytrzymała gumowa podeszwa sprawia, że buty są trwalsze. Biorąc pod uwagę odblaskowe elementy zwiększające widoczność oraz charakterystyczne logo ASICS, jest to idealne rozwiązanie dla dzieci, które chcą biegać jeszcze dalej. ;119,00 ;https://www.eobuwie.com.pl/media/catalog/product/cache/image/650x650/0/0/0000200791326_01_kt.jpg
456;Buty ASICS;Asics ;Jolt 2 1012A151 Glacier Grey/Sunrise Red ;Damskie@Sportowe;Buty do biegania marki Asics. Wygodnie wyprofilowana cholewka to Skóra ekologiczna - Skóra ekologiczna, Materiał - Materiał. Wkładka to materiał. Amortyzująca podeszwa to wysokogatunkowe tworzywo. Model wyposażono w technologię EVA. To model doskonały do treningu biegowego. ;169,00 ;https://www.eobuwie.com.pl/media/catalog/product/cache/image/650x650/0/0/0000207911215_01_pa.jpg
457;Buty ASICS;Asics ;Contend 6 Gs 1014A086 White/White 102 ;Damskie@Sportowe;Wygodne, sznurowane buty dziecięce marki Asics. Wytrzymała cholewka to Skóra ekologiczna - Skóra ekologiczna, Materiał - Materiał. Wnętrze oddychające, jego głównym składnikiem jest materiał. We wnętrzu butów znajduje się wkładka: materiał. W podeszwie zastosowano wysokogatunkowe tworzywo. W butach zastosowano technologię AmpliFoam, EVA. Buty zapewniają zdrowy rozwój stopy i komfort noszenia. ;189,00 ;https://www.eobuwie.com.pl/media/catalog/product/cache/image/650x650/0/0/0000207791237_01_rz.jpg
458;Buty adidas;adidas, adidas Performance ;Rockadia Trail 3.0 FW5287 Black ;Damskie@Sportowe;Buty biegowe marki adidas. Odporna cholewka to Materiał - Materiał, Tworzywo - Wysokogatunkowe tworzywo. Wkładka to materiał. Podeszwa przyjazna dla stopy: wysokogatunkowe tworzywo. Model wyposażono w technologię adiWEAR, Cloudfoam, Ortholite. Jeśli jesteś ciągle w ruchu wybierz buty na płaskiej podeszwie. ;169,00 ;https://www.eobuwie.com.pl/media/catalog/product/cache/image/650x650/0/0/0000206766908_02_mg.jpg
459;Buty SALOMON;Salomon ;Trailster 2 Gtx W GORE-TEX 409638 25 W0 Navy Blazer/Sargasso Sea/Flint Stone ;Damskie@Sportowe;Biegowy model marki Salomon. Odporna cholewka to Skóra ekologiczna - Skóra ekologiczna, Materiał - Materiał, Tworzywo - Wysokogatunkowe tworzywo. Komfort noszenia podnosi wkładka: materiał. Podeszwa przyjazna dla stopy: wysokogatunkowe tworzywo. W butach zastosowano technologię Contagrip, EnergyCell+, GORE-TEX® Extended Comfort Footwear, Ortholite, Sensifit. Codzienna, wygodna propozycja w dobrym stylu. ;309,00 ;https://www.eobuwie.com.pl/media/catalog/product/cache/image/650x650/0/0/0000206957856_01_tm.jpg
460;Buty ASICS;Asics ;Gel-Venture 8 1012A708 Carrier Grey/Ginger Peach 021 ;Damskie@Sportowe;Buty biegowe marki Asics. Odporna cholewka to Materiał - Materiał. We wnętrzu wkładka: materiał. Materiał podeszwy to wysokogatunkowe tworzywo. W butach zastosowano technologię 10 mm Drop, GEL, Open Mesh Upper, Ortholite, Rearfoot and Forefoot GEL Cushioning System, SpEVA, Trail Specific Outsole. Ten model będzie doskonałym uzupełnieniem codziennego stroju. ;299,00 ;https://www.eobuwie.com.pl/media/catalog/product/cache/image/650x650/0/0/0000207045958_01_rz.jpg
461;Buty COLUMBIA;Columbia ;Montrail F.K.T. BL0109 Cyber Purple/Voltage 590 ;Damskie@Sportowe;Buty biegowe marki Columbia. Wygodnie wyprofilowana cholewka to Materiał - Materiał, Tworzywo - Wysokogatunkowe tworzywo. We wnętrzu wkładka: materiał. Podeszwa - wysokogatunkowe tworzywo. Model wyposażono w technologię 8 mm Drop, EVA, Trail Shield. Jeśli jesteś ciągle w ruchu wybierz buty na płaskiej podeszwie. ;399,00 ;https://www.eobuwie.com.pl/media/catalog/product/cache/image/650x650/0/0/0000207587120_01_wj.jpg
462;Trekkingi SALEWA;Salewa ;Alp Trainer Mid Gtx GORE-TEX 64006-0365 Dark Denim/Charcoal ;Damskie@Sportowe;Buty outdoorowe Jr Alp Trainer Mid Gtx stworzono dla najmłodszych miłośników górskich przygód. Trekkingi posiadają membranę GORE-TEX® Performance Comfort Footwear, która zabezpiecza stopę przed wodą, a także skutecznie odprowadza pot na zewnątrz cholewki. Elastyczna wkładka Ortholite ma właściwości antybakteryjne i antygrzybicze, daje poczucie świeżości przez długi czas. Podeszwa zewnętrzna Michelin Tech Sole zapewnia pewny krok nawet w trudnych warunkach pogodowych, zaś antypoślizgowa podeszwa z technologią OCsystem gwarantuje stabilność na oblodzonych powierzchniach. ;499,90 ;https://www.eobuwie.com.pl/media/catalog/product/cache/image/650x650/0/0/0000200370422_01_sw.jpg
463;Trekkingi HI-TEC;Hi-Tec ;Beston Wo's AVS-SS19-HT-01-Q1 Mid Grey/Turquoise ;Damskie@Sportowe;Nowa propozycja marki Hi-Tec. Cholewka o podwyższonej odporności Materiał - Materiał, Tworzywo - Wysokogatunkowe tworzywo. Komfort noszenia podnosi wkładka: materiał. Podeszwa odpowiednia do mokrych i śliskich powierzchni: wysokogatunkowe tworzywo. Dobre buty dla wymagających użytkowników. ;259,00 ;https://www.eobuwie.com.pl/media/catalog/product/cache/image/650x650/0/0/0000201257005_01_pp.jpg
464;Buty ECCO;ECCO ;Biom Fjuel 83751301001 Black ;Damskie@Sportowe;Czy wiesz, że technologia BIOM doskonale amortyzuje i pozwala poruszać się w naturalny sposób, umacniając jednocześnie mięśnie i stawy? Dlatego półbuty z nowej kolekcji Ecco spełnią oczekiwania wymagających klientek! Niezwykle wytrzymała, czarna skóra jaka przyjemnie układa się na nodze i odpowiednio ją wspiera. Technologia Strobel dodatkowo amortyzuje, zapewnia giętkość i lekkość. Miękka wkładka dopasowuje się do naturalnego kształtu stopy, a skórzana wyściółka znacznie podnosi komfort użytkowania. Elastyczna podeszwa z poliuretanu (PU) została przymocowana za pomocą metody bezpośredniego wtrysku (technologia DIP). Wstawki z gumy i termoplastycznego poliuretanu (TPU) odznaczają się bardzo dobrą przyczepnością i odpornością na czynniki zewnętrzne. Zachwyć wszystkich atrakcyjnymi i niesamowicie wygodnymi półbutami Ecco! ;469,00 ;https://www.eobuwie.com.pl/media/catalog/product/cache/image/650x650/p/o/poprawka_0000197773121_ecco_-_biom_fjuel_83751301001_black__kc_01.jpg
465;Buty Reebok;Reebok ;Flexagon Force 2.0 FX0166 Smoind/Chalk/Chalk ;Damskie@Sportowe;Nowy model marki Reebok. Do charakteru butów pasuje cholewka: Skóra ekologiczna - Skóra ekologiczna, Materiał - Materiał. We wnętrzu wkładka: materiał. Materiał podeszwy to wysokogatunkowe tworzywo. W butach zastosowano technologię FuelFoam, MemoryTech. Jeśli jesteś ciągle w ruchu wybierz buty na płaskiej podeszwie. ;149,00 ;https://www.eobuwie.com.pl/media/catalog/product/cache/image/650x650/0/0/0000206766502_01_rz.jpg
466;Buty Reebok;Reebok ;Flexagon Energy Tr 2.0 FW8315 Maroon/Glapnk/Pugry3 ;Damskie@Sportowe;Nowy model marki Reebok. Do charakteru butów pasuje cholewka: Materiał - Materiał. Wkładka to materiał. Podeszwa przyjazna dla stopy: wysokogatunkowe tworzywo. Buty wzbogacono o technologię EVA, FuelFoam. Codzienna, wygodna propozycja w dobrym stylu. ;139,00 ;https://www.eobuwie.com.pl/media/catalog/product/cache/image/650x650/0/0/0000206766465_01_rz.jpg
467;Buty SPRANDI;Sprandi ;WP07-01421-01 White ;Damskie@Sportowe;Nowy model marki Sprandi. Wygodnie wyprofilowana cholewka to Materiał - Materiał. We wnętrzu wkładka: materiał. Materiał podeszwy to wysokogatunkowe tworzywo. Codzienna, wygodna propozycja w dobrym stylu. ;139,99 ;https://www.eobuwie.com.pl/media/catalog/product/cache/image/650x650/5/9/5903698225296_01_rz.jpg
468;Trekkingi JACK WOLFSKIN;Jack Wolfskin ;Vojo 3 Texapore Mid W 4042471 Tarmac Grey/Pink ;Damskie@Sportowe;Nowa propozycja marki Jack Wolfskin. Cholewka o podwyższonej odporności Skóra naturalna - Welur, Materiał - Materiał. Wkładka to materiał. Podeszwa o dobrej trakcji to wysokogatunkowe tworzywo. W butach zastosowano technologię EVA, Texapore. Fason posiada ozdobę, na która składa się srebrny metal. Dobre buty dla wymagających użytkowników. ;419,00 ;https://www.eobuwie.com.pl/media/catalog/product/cache/image/650x650/0/0/0000207531390_01_mg_1.jpg
469;Tenisówki VANS;Vans ;Old Skool VN000D3HBKA Black ;Damskie@Sportowe;Wygodne trampki marki Vans. W cholewce dominuje Skóra ekologiczna - Skóra ekologiczna, Materiał - Materiał. Podeszwa butów to guma. To buty, które będą podstawą wielu stylizacji. ;209,00 ;https://www.eobuwie.com.pl/media/catalog/product/cache/image/650x650/0/0/0000198004446_vans-old_skool_vd3hbka_black_black_kc_01.jpg
470;Trampki CONVERSE;Converse ;CT A/S Seasnl H 1J793 Charcoal ;Damskie@Sportowe;Przyciągające uwagę Converse. W cholewce dominuje Materiał - Materiał. Materiał podeszwy to guma. Ponadczasowa klasyka gatunku. ;199,00 ;https://www.eobuwie.com.pl/media/catalog/product/cache/image/650x650/0/0/0000191157330_01_pac_1.jpg
471;Buty BRUGI;Brugi ;2SA9 Azzurro/Azurro N5X ;Damskie@Sportowe;Klasyczna propozycja marki Brugi. Szybkoschnąca cholewka to Materiał - Materiał. Wygodę noszenia podnosi wyściółka: materiał. Wkładka to materiał. Podeszwa to: guma. Idealne obuwie dla fanów sportów wodnych. ;29,00 ;https://www.eobuwie.com.pl/media/catalog/product/cache/image/650x650/0/0/0000199659744_zo.jpg
472;Buty PROWATER;ProWater ;PROL-20-34-014 Yellow ;Damskie@Sportowe;Modna propozycja marki ProWater. Odporna na wilgoć cholewka to Materiał - Materiał. Wygodę noszenia podnosi wyściółka: materiał. Komfort noszenia podnosi wkładka: materiał. Głównym składnikiem podeszwy jest wysokogatunkowe tworzywo. Idealne obuwie dla fanów sportów wodnych. ;29,00 ;https://www.eobuwie.com.pl/media/catalog/product/cache/image/650x650/0/0/0000206984876_1_.jpg
473;Buty SPEEDO;Speedo ;Zanpa Af 8-055700299 Black/White ;Damskie@Sportowe;Modna propozycja marki Speedo. Cholewka szybkoschnąca, to Materiał - Materiał, Tworzywo - Wysokogatunkowe tworzywo. We wnętrzu butów wyściółka: materiał. We wnętrzu butów znajduje się wkładka: materiał. Podeszwa to: wysokogatunkowe tworzywo. Idealne obuwie dla fanów sportów wodnych. ;79,00 ;https://www.eobuwie.com.pl/media/catalog/product/cache/image/650x650/0/0/0000200379838_01_jf.jpg
474;Buty ARENA;Arena ;Sharm 2 8043111 Clear ;Damskie@Sportowe;Udana propozycja marki Arena. Cholewka o właściwościach szybkoschnących, to Tworzywo - Guma wysokogatunkowa. Komfort noszenia podnosi wkładka: guma. Wkładka to guma. Podeszwa butów to: guma. W butach zastosowano technologię EVA. Idealne obuwie dla amatorów spędzania czasu nad wodą. ;49,00 ;https://www.eobuwie.com.pl/media/catalog/product/cache/image/650x650/0/0/0000198023867_arena-8043111_sharm_2_clear_ai_1.jpg
475;Trampki CONVERSE;Converse ;C Taylor A/S Hi M3310C Black Monoch ;Damskie@Sportowe;PropozycjaConverse w monochromatycznym wydaniu, znanym z pierwszych modeli tejmarki. Powracające do mody, wykonane zostały w całości w kolorzeczarnym. Idealnie dopasują się do stylizacji z niemal każdymzestawem. Uniwersalne i ponadczasowe trampki dla kobiet ceniącychsobie dobry styl i wygodę zarazem. Cholewka płócienna, jest trwała i przewiewna, dając stopie możliwość oddychania. Ochronny nosek z tworzywa orazlogo na wewnętrznej stronie cholewki sygnowane nazwiskiem ChuckaTaylora. ;209,00 ;https://www.eobuwie.com.pl/media/catalog/product/cache/image/650x650/0/0/0000002848570_01_jc.jpg
476;Sneakersy VANS;Vans ;Ski8-Hi Mte 2.0 Dx VN0A4P3I2US1 (Mte) Dress Blues/Jasper ;Damskie@Sportowe;Klasyczna propozycja marki Vans. Cholewka wyprofilowana z najlepszych surowców: Skóra naturalna - Lakierowana, Materiał - Materiał. Wkładka to materiał. Materiał podeszwy to wysokogatunkowe tworzywo. Model wyposażono w technologię MTE 360™, Prima Loft, Ultra Cush. Fason podkreślają detale: srebrny metal. Stylowe i przyjemne w noszeniu. ;469,00 ;https://www.eobuwie.com.pl/media/catalog/product/cache/image/650x650/0/0/0000207852983_01_rz.jpg
477;Buty NIKE;NIKE ;Air Max 270 React (GS) BQ0103 401 Midnight Navy/Metallic Silver ;Damskie@Sportowe;Wygodny fason marki NIKE. Wygodnie wyprofilowana cholewka to Skóra ekologiczna - Skóra ekologiczna, Materiał - Materiał, Tworzywo - Wysokogatunkowe tworzywo. Wkładka to materiał. Podeszwa - wysokogatunkowe tworzywo. Buty wzbogacono o technologię Nike Air, Nike React. Ten model będzie doskonałym uzupełnieniem codziennego stroju. ;579,00 ;https://www.eobuwie.com.pl/media/catalog/product/cache/image/650x650/0/0/0000207996939_01_rz.jpg
478;Trekkingi SALOMON;Salomon ;Outblast Ts Cswp W 407950 21 V0 Black/Black/Black ;Damskie@Sportowe;Przeznaczone do wycieczek outdoorowych buty marki Salomon. Wytrzymała cholewka to Materiał - Materiał, Tworzywo - Wysokogatunkowe tworzywo. Komfort noszenia podnosi wkładka: materiał. Podeszwa o dobrej trakcji to wysokogatunkowe tworzywo. Model wyposażono w technologię 3M Thinsulate, Contagrip, EnergyCell+, EVA, Sockliner, Thinsulate, Waterproof. Idealne buty na bardziej wymagający teren. ;509,00 ;https://www.eobuwie.com.pl/media/catalog/product/cache/image/650x650/0/0/0000201251126_01_kl.jpg
479;Buty NIKE;NIKE ;Zoom Pulse CT1629 002 Vast Grey/University Gold/Pink ;Damskie@Sportowe;Propozycja marki NIKE. Wygodnie wyprofilowana cholewka to Skóra ekologiczna - Skóra ekologiczna. Komfort noszenia podnosi wkładka: materiał. Podeszwa przyjazna dla stopy: wysokogatunkowe tworzywo. W butach zastosowano technologię Nike Air, Nike Zoom. Codzienna, wygodna propozycja w dobrym stylu. ;499,00 ;https://www.eobuwie.com.pl/media/catalog/product/cache/image/650x650/0/0/0000208157865_01_pl.jpg
480;Buty NIKE;NIKE ;M2K Tekno CJ9583 100 White/White/Metallic Silver ;Damskie@Sportowe;Wygodny fason marki NIKE. Wygodnie wyprofilowana cholewka to Skóra naturalna - Licowa, Skóra ekologiczna - Skóra ekologiczna. Komfort noszenia podnosi wkładka: materiał. Materiał podeszwy to wysokogatunkowe tworzywo. Ten model będzie doskonałym uzupełnieniem codziennego stroju. ;399,00 ;https://www.eobuwie.com.pl/media/catalog/product/cache/image/650x650/0/0/0000208230445_01_jb_kopia.jpg
481;Sneakersy PUMA;Puma ;R78 Sl 374127 04 Peachskin/Puma White ;Damskie@Sportowe;Wygodny fason marki Puma. Cholewka solidnie wykończona - Skóra ekologiczna - Skóra ekologiczna. Komfort noszenia podnosi wkładka: materiał. Podeszwa przyjazna dla stopy: wysokogatunkowe tworzywo. W butach zastosowano technologię EVA, SoftFoam. Codzienna, wygodna propozycja w dobrym stylu. ;239,00 ;https://www.eobuwie.com.pl/media/catalog/product/cache/image/650x650/0/0/0000207349452_01_rz_1.jpg
482;Trampki CONVERSE;Converse ;CT Ox 132174C Black ;Damskie@Sportowe;Przyciągające uwagę Converse. Lekki wygląd zawdzięczają cholewce: Skóra naturalna - Licowa. Podeszwa to guma. Ponadczasowa klasyka gatunku. ;219,00 ;https://www.eobuwie.com.pl/media/catalog/product/cache/image/650x650/7/4/743578-converse-132174c-cz-001_kopia.jpg
483;Trampki CONVERSE;Converse ;CT All Star M7650-22 White ;Damskie@Sportowe;Marka Converse to niekwestionowany lider na rynku obuwia sportowego. Kultowe trampki znane są na całym świecie z jakości wykonania i ciekawego wzornictwa.  Gumowana podeszwa zabezpiecza przed upadkiem na śliskich powierzchniach. Najlepsze jakościowo materiały,  z których wykonano cholewę i podeszwę sprawiają, że żadne inne trampki nie moga równać się  z butami firmy Converse. Biały model to świetny wybór do ubrań w różnym stylu - sprawdzi się w trakcie porannego joggingu, w szkole, ale także jako dodatek do marynarki w mniej oficjalnych sytuacjach.;209,00 ;https://www.eobuwie.com.pl/media/catalog/product/cache/image/650x650/0/0/0000005426577_01_pp.jpg
484;Buty NIKE;NIKE ;Sb Charge Suede (Gs) CT3112 400 Obsidian/White/Obsidian/Black ;Damskie@Sportowe;Lekkie, sznurowane buty marki NIKE. Wierzchnią część cholewki stanowi Skóra naturalna - Licowa, Zamsz. We wnętrzu materiał, co sprawia, że buty zachowują dobre właściwości higieniczne Nie zabrakło chłonnej wkładki, to materiał. W podeszwie zastosowano wysokogatunkowe tworzywo. Buty wzbogacono o technologię SolarSoft. Buty zapewniają zdrowy rozwój stopy i komfort noszenia. ;149,00 ;https://www.eobuwie.com.pl/media/catalog/product/cache/image/650x650/0/0/0000207464681_01_wj.jpg
485;Buty NIKE;NIKE ;Air Max Verona CU7846 600 Barely Rose/Barely Rose/White ;Damskie@Sportowe;Propozycja marki NIKE. Cholewka solidnie wykończona - Skóra naturalna - Licowa, Skóra ekologiczna - Skóra ekologiczna, Materiał - Materiał. We wnętrzu wkładka: materiał. Podeszwa przyjazna dla stopy: wysokogatunkowe tworzywo. Buty wzbogacono o technologię Air Max, Nike Air. Codzienna, wygodna propozycja w dobrym stylu. ;349,00 ;https://www.eobuwie.com.pl/media/catalog/product/cache/image/650x650/0/0/0000207824867_01_rz.jpg
486;Buty Reebok;Reebok, Reebok Classic ;Ex-O-Fit Hi 3478 Black Int ;Damskie@Sportowe;Miejski styl i wygoda od marki Reebok. Cholewka miękko układa się na stopie Skóra naturalna - Licowa. W środku buty posiadają wyściółkę - materiał. We wnętrzu butów znajduje się wkładka: materiał. Podeszwa - wysokogatunkowe tworzywo. Ten model będzie doskonałym uzupełnieniem codziennego stroju. ;289,00 ;https://www.eobuwie.com.pl/media/catalog/product/cache/image/650x650/0/0/0000198761134_reebok-3478_black_int_ap_001.jpg
487;Sneakersy VANS;Vans ;Ultrarange Exo Hi VN0A4UWJ2WI1 (Mte) Navy/Navy ;Damskie@Sportowe;Uniwersalna propozycja marki Vans. Wygodnie wyprofilowana cholewka to Skóra naturalna - Zamsz, Materiał - Materiał. We wnętrzu butów materiał. Komfort noszenia podnosi wkładka: materiał. Podeszwa - wysokogatunkowe tworzywo. Model wyposażono w technologię MTE 360™, Ultra Cush. Fason podkreślają detale: srebrny metal. Kobiece i przyjazne dla stopy, będą bazą dla całego stroju. ;489,00 ;https://www.eobuwie.com.pl/media/catalog/product/cache/image/650x650/0/0/0000207852969_01_mk.jpg
488;Buty NIKE;NIKE ;Air Max 90 CZ3950 100 White/Black/Pure Platinum ;Damskie@Sportowe;Nowy model marki NIKE. Wygodnie wyprofilowana cholewka to Skóra naturalna - Licowa, Skóra ekologiczna - Skóra ekologiczna, Materiał - Materiał. Wkładka to materiał. Podeszwa - wysokogatunkowe tworzywo. Buty wzbogacono o technologię Max Air, TPU. Ten model będzie doskonałym uzupełnieniem codziennego stroju. ;599,00 ;https://www.eobuwie.com.pl/media/catalog/product/cache/image/650x650/0/0/0000208064811_01_rz.jpg
489;Buty Reebok;Reebok, Reebok Classic ;Cl Lthr 3912 Black ;Damskie@Sportowe;Nowy model marki Reebok. Wygodnie wyprofilowana cholewka to Skóra naturalna - Licowa, Materiał - Materiał. Komfort noszenia podnosi wkładka: materiał. Podeszwa przyjazna dla stopy: wysokogatunkowe tworzywo. Buty wzbogacono o technologię EVA. Jeśli ciągle pozostajesz w ruchu wybierz buty na płaskiej podeszwie. ;219,00 ;https://www.eobuwie.com.pl/media/catalog/product/cache/image/650x650/0/0/0000198787738_reebok-3912_black_kc_01.jpg
490;Buty adidas;adidas, adidas Originals ;Pro Model J FV5724 Ftwwht/Cblack/Gold.F ;Damskie@Sportowe;Zgrabne trzewiki firmy adidas. Wierzchnia część cholewki to Skóra naturalna - Licowa, Skóra ekologiczna - Skóra ekologiczna. We wnętrzu butów materiał. Wkładka: materiał znajduje się we wnętrzu butów. Podeszwa: wysokogatunkowe tworzywo daje odpowiednie podparcie stopie. Model wyposażono w technologię Ortholite. Komfortowe wyprofilowane, nie krepują ruchów stopy. ;209,00 ;https://www.eobuwie.com.pl/media/catalog/product/cache/image/650x650/0/0/0000206768209_01_rz_1.jpg
491;Buty Reebok;Reebok, Reebok Classic ;Classic Leather 50149 Black ;Damskie@Sportowe;Wygodny fason marki Reebok. Do charakteru butów pasuje cholewka: Skóra naturalna - Licowa, Materiał - Materiał. Wkładka to materiał. Podeszwa - wysokogatunkowe tworzywo. Buty wzbogacono o technologię EVA. Jeśli ciągle pozostajesz w ruchu wybierz buty na płaskiej podeszwie. ;169,00 ;https://www.eobuwie.com.pl/media/catalog/product/cache/image/650x650/0/0/0000197991778_01_rz.jpg
492;Buty NIKE;NIKE ;Air Max 200 (GS) AT5627 008 Off Noir/Iced Lilac/Smoke Grey ;Damskie@Sportowe;Propozycja marki NIKE. Cholewka solidnie wykończona - Skóra ekologiczna - Skóra ekologiczna, Materiał - Materiał. We wnętrzu wkładka: materiał. Podeszwa - wysokogatunkowe tworzywo. Model wyposażono w technologię Cushlon, Max Air. Ten model będzie doskonałym uzupełnieniem codziennego stroju. ;359,00 ;https://www.eobuwie.com.pl/media/catalog/product/cache/image/650x650/0/0/0000208129862_01_pl.jpg
