ID;Nazwa;Marka;Model;Kategoria;Opis;Cena;URL_zdjecia
1;Sneakersy EA7 EMPORIO ARMANI;EA7 Emporio Armani ;X8X027 XK050 M701 Triple Black/Gold ;Męskie@Półbuty;Klasyczna propozycja marki EA7 Emporio Armani. Cholewka wyprofilowana z najlepszych surowców: Skóra ekologiczna - Skóra ekologiczna, Materiał - Materiał, Tworzywo - Wysokogatunkowe tworzywo. Posiadają wyściółkę - to materiał. Wkładka to materiał. Materiał podeszwy to wysokogatunkowe tworzywo. Buty na co dzień - ponadczasowe i uniwersalne. ;679,00 ;https://www.eobuwie.com.pl/media/catalog/product/cache/image/650x650/0/0/0000206624154_1_.jpg
2;Buty adidas;adidas, adidas Originals ;Superstar EG4958 Ftwwht/Cblack/Ftwwht ;Męskie@Półbuty;Klasyczna propozycja marki adidas. Lekki wygląd zawdzięczają cholewce: Skóra naturalna - Pokryta tworzywem, Licowa. We wnętrzu butów materiał. Wkładka to materiał. Podeszwa to wysokogatunkowe tworzywo. Te buty to miejski styl w dobrym wydaniu. ;279,00 ;https://www.eobuwie.com.pl/media/catalog/product/cache/image/650x650/0/0/0000206693594_01_jc.jpg
3;Sneakersy NEW BALANCE;New Balance ;CM997HFV Bordowy ;Męskie@Półbuty;Modna propozycja marki New Balance. W cholewce dominuje Skóra naturalna - Zamsz, Materiał - Materiał. Posiadają wyściółkę - to materiał. Wkładka to materiał. Podeszwa to wysokogatunkowe tworzywo. Buty na co dzień - ponadczasowe i uniwersalne. ;319,00 ;https://www.eobuwie.com.pl/media/catalog/product/cache/image/650x650/0/0/0000207743878_01_kt.jpg
4;Sneakersy NEW BALANCE;New Balance ;ML565SGN Zielony ;Męskie@Półbuty;Przyciągające uwagę buty marki New Balance. Lekki wygląd zawdzięczają cholewce: Skóra naturalna - Licowa, Zamsz, Materiał - Materiał. Wewnętrzna wyściółka to materiał. Komfort noszenia podnosi wkładka: materiał. Materiał podeszwy to wysokogatunkowe tworzywo. Te buty to miejski styl w dobrym wydaniu. ;249,00 ;https://www.eobuwie.com.pl/media/catalog/product/cache/image/650x650/0/0/0000200501352_01_gh.jpg
5;Sneakersy RAGE AGE;Rage Age ;RA-15-02-000073 108 ;Męskie@Półbuty;Przyciągające uwagę buty marki Rage Age. Lekki wygląd zawdzięczają cholewce: Skóra naturalna - Licowa. Posiadają wyściółkę - to materiał, skóra ekologiczna. We wnętrzu butów znajduje się wkładka: skóra ekologiczna. Materiał podeszwy to wysokogatunkowe tworzywo. Te buty to miejski styl w dobrym wydaniu. ; 479,00 ;https://www.eobuwie.com.pl/media/catalog/product/cache/image/650x650/0/0/0000207499874_01_rz.jpg
6;Sneakersy TOMMY HILFIGER;Tommy Hilfiger ;B2285RANSON 8C1 FM0FM03232 Twilight 005 ;Męskie@Półbuty;Modna propozycja marki TOMMY HILFIGER. W cholewce dominuje Skóra naturalna - Zamsz, Materiał - Materiał. We wnętrzu butów materiał. Wkładka to materiał. Podeszwa to wysokogatunkowe tworzywo. Buty na co dzień - ponadczasowe i uniwersalne. ;249,00 ;https://www.eobuwie.com.pl/media/catalog/product/cache/image/650x650/0/0/0000207171022_01_rz.jpg
7;Sneakersy CALVIN KLEIN;Calvin Klein ;Parker B4F2281 Black ;Męskie@Półbuty;Modna propozycja marki Calvin Klein. Lekki wygląd zawdzięczają cholewce: Materiał - Materiał. We wnętrzu butów materiał. Komfort noszenia podnosi wkładka: skóra ekologiczna. Podeszwa to wysokogatunkowe tworzywo. Te buty to miejski styl w dobrym wydaniu. ; 459,00 ;https://www.eobuwie.com.pl/media/catalog/product/cache/image/650x650/0/0/0000207763906_01_mk.jpg
8;Sneakersy PUMA;Puma ;Vista Mid Wtr 369783 01 Puma Black/Puma White ;Męskie@Półbuty;Modna propozycja marki Puma. W cholewce dominuje Skóra naturalna - Licowa, Zamsz, Materiał - Materiał. Wewnętrzna wyściółka to futerko, ocieplenie. Wkładka to materiał. Materiał podeszwy to wysokogatunkowe tworzywo. W butach zastosowano technologię CMEVA, SoftFoam. Stylowe i przyjemne w noszeniu buty codzienne. ;229,00 ;https://www.eobuwie.com.pl/media/catalog/product/cache/image/650x650/0/0/0000201258613_01_pp.jpg
9;Sneakersy NEW BALANCE;New Balance ;ML311CB2 Szary ;Męskie@Półbuty;Klasyczna propozycja marki New Balance. W cholewce dominuje Skóra naturalna - Zamsz, Materiał - Materiał. Posiadają wyściółkę - to materiał. We wnętrzu butów znajduje się wkładka: materiał. Materiał podeszwy to wysokogatunkowe tworzywo. Model wyposażono w technologię EVA. Stylowe i przyjemne w noszeniu buty codzienne. ;189,00 ;https://www.eobuwie.com.pl/media/catalog/product/cache/image/650x650/0/0/0000207744752_01_rz.jpg
10;Buty NIKE;NIKE ;Air Max 90 Ltr CZ5594 100 White/White/White ;Męskie@Półbuty;Modna propozycja marki NIKE. Cholewka wyprofilowana z najlepszych surowców: Skóra naturalna - Licowa, Materiał - Materiał. Wewnętrzna wyściółka to materiał. Komfort noszenia podnosi wkładka: materiał. Podeszwa to wysokogatunkowe tworzywo. Model wyposażono w technologię Air Max, Max Air, Nike Air. Buty na co dzień - ponadczasowe i uniwersalne. ;479,00 ;https://www.eobuwie.com.pl/media/catalog/product/cache/image/650x650/0/0/0000208060158_01_rz.jpg
11;Sneakersy BIG STAR;Big Star ;EE174159 Navy ;Męskie@Półbuty;Modna propozycja marki BIG STAR. Cholewka wyprofilowana z najlepszych surowców: Skóra ekologiczna - Skóra ekologiczna. We wnętrzu butów materiał. Komfort noszenia podnosi wkładka: materiał. Materiał podeszwy to wysokogatunkowe tworzywo. Stylowe i przyjemne w noszeniu buty codzienne. ;99,00 ;https://www.eobuwie.com.pl/media/catalog/product/cache/image/650x650/0/0/0000207433632_01_rz.jpg
12;Trekkingi MERRELL;Merrell ;Intercept J73705 Moth Brown ;Męskie@Półbuty;Uniwersalne trekkingi Intercept przeznaczone do codziennego użytku, idealnie sprawdzą się również na mniej wymagających, górskich szlakach. Wykorzystanie technologii Merrell Air Cushion, gwarantuje wygodę oraz wyjątkową amortyzację. Podeszwa zewnętrza Vibram, posiada właściwości antypoślizgowe zapewniając bezpieczeństwo i komfort podczas stawiania kolejnych kroków. ;299,00 ;https://www.eobuwie.com.pl/media/catalog/product/cache/image/650x650/8/7/879816_merrell-j73705_br_zowy_gk_1.jpg
13;Trekkingi SALOMON;Salomon ;Xa Collider 411135 38 V0 Red Ochre/Black/Cherry Tomato ;Męskie@Półbuty;W kolekcji marki Salomon na uwagę zasługuje ten model. Wytrzymała cholewka to Skóra ekologiczna - Skóra ekologiczna, Materiał - Materiał. Wkładka to materiał. Podeszwa odpowiednia do mokrych i śliskich powierzchni: wysokogatunkowe tworzywo. W butach zastosowano technologię Contagrip, EnergyCell+, Ortholite. To bezpieczne obuwie terenowe. ;319,00 ;https://www.eobuwie.com.pl/media/catalog/product/cache/image/650x650/0/0/0000208142410_01_pa.jpg
14;Sneakersy TOGOSHI;Togoshi ;TG-12-05-000295 609 ;Męskie@Półbuty;Klasyczna propozycja marki Togoshi. Cholewka wyprofilowana z najlepszych surowców: Skóra naturalna - Licowa, Zamsz, Materiał - Materiał. Wewnętrzna wyściółka to materiał. Komfort noszenia podnosi wkładka: materiał. Podeszwa to wysokogatunkowe tworzywo. Model wyposażono w technologię CoolMax. Buty na co dzień - ponadczasowe i uniwersalne. ;419,00 ;https://www.eobuwie.com.pl/media/catalog/product/cache/image/650x650/0/0/0000207565883_01_ki.jpg
15;Sneakersy TOMMY JEANS;Tommy Jeans ;Midcut Lace Up Vulc EM0EM00485BDS Black BDS ;Męskie@Półbuty;Przyciągające uwagę buty marki Tommy Jeans. Cholewka wyprofilowana z najlepszych surowców: Materiał - Materiał. Wewnętrzna wyściółka to materiał. We wnętrzu butów znajduje się wkładka: materiał. Wygodę zwiększa odpowiednia podeszwa: wysokogatunkowe tworzywo. Te buty to miejski styl w dobrym wydaniu. ;219,00 ;https://www.eobuwie.com.pl/media/catalog/product/cache/image/650x650/0/0/0000207161092_01_ts.jpg
16;Trekkingi THE NORTH FACE;The North Face ;Back To Berkeley Low Wp NF0A4OBSU6V1 Coffee Brown/Tnf Black ;Męskie@Półbuty;Buty outdoorowe marki The North Face. Cholewka butów to Skóra naturalna - Nubuk. Wkładka to materiał. Podeszwa o dobrej trakcji to wysokogatunkowe tworzywo. Buty wzbogacono o technologię DryVent™, EVA, Icepick, Ortholite, TPU, Winter Grip. Dobre buty dla wymagających użytkowników. ;599,00 ;https://www.eobuwie.com.pl/media/catalog/product/cache/image/650x650/0/0/0000207580299_01_rz.jpg
17;Sneakersy CALVIN KLEIN JEANS;Calvin Klein Jeans ;Joele B4S0716 Black ;Męskie@Półbuty;Klasyczna propozycja marki Calvin Klein Jeans. Lekki wygląd zawdzięczają cholewce: Skóra ekologiczna - Skóra ekologiczna, Materiał - Materiał. Posiadają wyściółkę - to materiał, skóra ekologiczna. We wnętrzu butów znajduje się wkładka: materiał. Wygodę zwiększa odpowiednia podeszwa: wysokogatunkowe tworzywo. Stylowe i przyjemne w noszeniu buty codzienne. ;289,00 ;https://www.eobuwie.com.pl/media/catalog/product/cache/image/650x650/0/0/0000207762978_01_rz.jpg
18;Sneakersy TOMMY HILFIGER;Tommy Hilfiger ;Iconic Suede Runner FM0FM03001 Desert Sky DW5 ;Męskie@Półbuty;Przyciągające uwagę buty marki TOMMY HILFIGER. W cholewce dominuje Skóra naturalna - Zamsz, Skóra ekologiczna - Skóra ekologiczna. Wewnętrzna wyściółka to materiał. We wnętrzu butów znajduje się wkładka: materiał. Podeszwa to wysokogatunkowe tworzywo. Te buty to miejski styl w dobrym wydaniu. ;309,00 ;https://www.eobuwie.com.pl/media/catalog/product/cache/image/650x650/0/0/0000207371019_01_rz.jpg
19;Buty adidas;adidas, adidas Originals ;Continental 80 G27707 Cblack/Scarle/Conavy ;Męskie@Półbuty;Przyciągające uwagę buty marki adidas. W cholewce dominuje Skóra naturalna - Licowa, Skóra ekologiczna - Skóra ekologiczna. We wnętrzu butów materiał. Wkładka to materiał. Materiał podeszwy to wysokogatunkowe tworzywo. Buty wzbogacono o technologię EVA, Ortholite. Buty na co dzień - ponadczasowe i uniwersalne. ;279,00 ;https://www.eobuwie.com.pl/media/catalog/product/cache/image/650x650/0/0/0000200855547_01_kch.jpg
20;Sneakersy NEW BALANCE;New Balance ;ML574SKD Czerwony ;Męskie@Półbuty;Klasyczna propozycja marki New Balance. Lekki wygląd zawdzięczają cholewce: Skóra naturalna - Zamsz, Materiał - Materiał. Wewnętrzna wyściółka to materiał. We wnętrzu butów znajduje się wkładka: materiał. Wygodę zwiększa odpowiednia podeszwa: wysokogatunkowe tworzywo. Model wyposażono w technologię ENCAP. Buty na co dzień - ponadczasowe i uniwersalne. ;349,00 ;https://www.eobuwie.com.pl/media/catalog/product/cache/image/650x650/0/0/0000208050654_01_bs_kopia.jpg
21;Półbuty CATERPILLAR;CATerpillar ;Instruct P722310 Coffee ;Męskie@Półbuty;Klasyczna propozycja marki CATerpillar. W cholewce dominuje Skóra naturalna - Nubuk, Materiał - Materiał. Wewnętrzna wyściółka to materiał. Wkładka to materiał. Podeszwa to wysokogatunkowe tworzywo. Buty wzbogacono o technologię Ease. Buty na co dzień - ponadczasowe i uniwersalne. ;279,00 ;https://www.eobuwie.com.pl/media/catalog/product/cache/image/650x650/0/0/0000200361833_01_mn.jpg
22;Półbuty MERRELL;Merrell ;Jungle Moc J60825 Czarny ;Męskie@Półbuty;Półbuty Jungle Moc stworzono z myślą o mężczyznach, ceniących sobie solidne wykonanie i styl. Model ten stanowi idealne uzupełnienie miejskiego outfitu. Cholewkę wykonano z wysokiej jakości zamszu, natomiast wnętrze obszyto przyjemnym w dotyku materiałem. Wkładka z pianki EVA zapewnia komfort noszenia, zaś zastosowany w butach system Merrell Select Fresh niweluje przykre zapachy. ;209,00 ;https://www.eobuwie.com.pl/media/catalog/product/cache/image/650x650/7/5/750166-merrell-j60825-czarny-01_kopia.jpg
23;Półbuty BUGATTI;Bugatti ;312-85406-4100-4100 Dark Blue ;Męskie@Półbuty;Przyciągające uwagę buty marki Bugatti. Lekki wygląd zawdzięczają cholewce: Skóra naturalna - Licowa. Wewnętrzna wyściółka to materiał. Wkładka to skóra. Materiał podeszwy to wysokogatunkowe tworzywo. Buty na co dzień - ponadczasowe i uniwersalne. ;319,00 ;https://www.eobuwie.com.pl/media/catalog/product/cache/image/650x650/0/0/0000207915794_01_jb_kopia.jpg
24;Półbuty SERGIO BARDI;Sergio Bardi ;MI08-C535-537-16EO Grey ;Męskie@Półbuty;Klasyczna propozycja marki Sergio Bardi. W cholewce dominuje Skóra naturalna - Nubuk. Wewnętrzna wyściółka to materiał, skóra. Komfort noszenia podnosi wkładka: skóra. Wygodę zwiększa odpowiednia podeszwa: wysokogatunkowe tworzywo. Stylowe i przyjemne w noszeniu buty codzienne. ;199,99 ;https://www.eobuwie.com.pl/media/catalog/product/cache/image/650x650/5/9/5903698145587_01_rz.jpg
25;Sneakersy FILA;Fila ;Disruptor Low 1010262.1FG White ;Męskie@Półbuty;Fila Disruptor 2 są butem, który idealnie trafia w gusta współczesnej młodzieży. To m. in. powrót tego modelu na rynek spowodował olbrzymie zainteresowanie marką Fila i modą, którą można było obserwować w połowie lat 90. Chodzi oczywiście o trend ugly shoes lub, jak kto woli, dad shoes. Podobnie jak 25 lat temu, tak i teraz są hitem sprzedażowym, szczególnie wśród kobiet. W 2018 roku Fila Disruptor 2 zostały okrzyknięte butem roku – nasze klientki oceniają Fila Disruptor 2 jako wygodne i warte swojej ceny.Białe Fila Disruptor na nogach gwiazdPopularność Fila Disruptor 2 wynika nie tylko z ich wyglądu i wygody. Promocji sprzyjał także widok tego modelu na nogach największych światowych gwiazd i influencerów. Szlak przecierał guru mody ulicznej ostatnich lat, projektant Gosha Rubichinskiy, na wybiegach prezentując kolekcje marki Fila. W Fila Disruptor 2 chodziły także Emily Ratajkowski czy Dakota Fanning, a w Polsce nosiła je na przykład Marcelina Zawadzka. Właściwie od premiery Fila Disruptor 2 stały się jednym z ulubionych butów influencerek, instagramerek, a także każdej zwracającej uwagę na modę kobiety, która podąża za trendami.Prostota dzięki materiałomCholewka butów wykonana jest z białej skóry oraz materiałów syntetycznych, które nadają obuwiu luksusowego wyglądu, a przy obecnych trendach pasują do wielu damskich stylizacji i codziennego użytku. Zawdzięczamy to barwie buta, uniwersalnemu kolorowi białemu, a także prostej, ale przyciągającej wzrok konstrukcji. Pomimo masywnego wyglądu but jest lekki. Dzięki zastosowanej piance EVA obuwie waży zaledwie 378 gramów.  ;309,00 ;https://www.eobuwie.com.pl/media/catalog/product/cache/image/650x650/0/0/0000200728674_01_ts_1.jpg
26;Sneakersy NEW BALANCE;New Balance ;U410CB Granatowy ;Męskie@Półbuty;Klasyczne sneakersy z nowej kolekcji New Balance przypadną do gustu kobietom ceniącym modne i wygodne dodatki! Granatowa cholewka z przewiewnego materiału została wzmocniona wstawkami z licowej skóry. Miękki język niweluje nacisk klasycznego sznurowania. Tekstylna wyściółka oraz wkładka pozwalają stopie oddychać. Elastyczna podeszwa środkowa lekko amortyzuje, natomiast antypoślizgowy bieżnik odznacza się bardzo dobrą przyczepnością. Lekkie zakrzywienie obuwia pozwala na płynniejszy ruch. Szare logo New Balance podkreśla markę produktu. ;219,00 ;https://www.eobuwie.com.pl/media/catalog/product/cache/image/650x650/8/0/803577_new_balance_u410cb_classics_niebieski_ac_01.jpg
27;Sneakersy NEW BALANCE;New Balance ;GM500KSW Czarny ;Męskie@Półbuty;Przyciągające uwagę buty marki New Balance. Lekki wygląd zawdzięczają cholewce: Skóra ekologiczna - Skóra ekologiczna, Materiał - Materiał. Wewnętrzna wyściółka to materiał. Wkładka to materiał. Materiał podeszwy to wysokogatunkowe tworzywo. Buty na co dzień - ponadczasowe i uniwersalne. ;199,00 ;https://www.eobuwie.com.pl/media/catalog/product/cache/image/650x650/0/0/0000200373423_01_kt.jpg
28;Sneakersy ARMANI EXCHANGE;Armani Exchange ;XUX017 XCC68 K512 Op. White/Multicolor ;Męskie@Półbuty;Klasyczna propozycja marki Armani Exchange. Lekki wygląd zawdzięczają cholewce: Skóra ekologiczna - Skóra ekologiczna, Materiał - Materiał. Posiadają wyściółkę - to materiał, tworzywo. Wkładka to materiał. Wygodę zwiększa odpowiednia podeszwa: wysokogatunkowe tworzywo. Buty na co dzień - ponadczasowe i uniwersalne. ; 449,00 ;https://www.eobuwie.com.pl/media/catalog/product/cache/image/650x650/0/0/0000207923317_01_mg.jpg
29;Tenisówki VANS;Vans ;Old Skool VN000D3HY28 Black/White ;Męskie@Półbuty;Przyciągające uwagę Vans. Cholewka butów to Skóra naturalna - Licowa, Materiał - Materiał. Materiał podeszwy to guma. Ponadczasowa klasyka gatunku. ;259,00 ;https://www.eobuwie.com.pl/media/catalog/product/cache/image/650x650/0/0/0000197850310-vans-old_skool_d3hy28_black_white-ap-001.jpg
30;Sneakersy NEW BALANCE;New Balance ;Classics U410SKG Czarny ;Męskie@Półbuty;Klasyczna propozycja marki New Balance. Cholewka wyprofilowana z najlepszych surowców: Skóra naturalna - Licowa, Zamsz. Posiadają wyściółkę - to materiał. We wnętrzu butów znajduje się wkładka: materiał. Buty na co dzień - ponadczasowe i uniwersalne. ;199,00 ;https://www.eobuwie.com.pl/media/catalog/product/cache/image/650x650/7/2/726815_new_balance_u410skg__01_kopia.jpg
31;Sneakersy NEW BALANCE;New Balance ;ML515OTY Szary ;Męskie@Półbuty;Przyciągające uwagę buty marki New Balance. W cholewce dominuje Skóra naturalna - Zamsz, Materiał - Materiał. Posiadają wyściółkę - to materiał. Wkładka to materiał. Wygodę zwiększa odpowiednia podeszwa: wysokogatunkowe tworzywo. Buty na co dzień - ponadczasowe i uniwersalne. ;199,00 ;https://www.eobuwie.com.pl/media/catalog/product/cache/image/650x650/0/0/0000207027763_01_kt.jpg
32;Sneakersy ECCO;ECCO ;Astir 52320452302 True Navy/Ombre/Marine/Medieval ;Męskie@Półbuty;Modna propozycja marki ECCO. Cholewka wyprofilowana z najlepszych surowców: Skóra naturalna - Licowa. Posiadają wyściółkę - to materiał, skóra. Wkładka to skóra. Materiał podeszwy to poliuretan. Model wyposażono w technologię DIP, PHORENE™, PU (Poliuretan). Buty na co dzień - ponadczasowe i uniwersalne. ;749,00 ;https://www.eobuwie.com.pl/media/catalog/product/cache/image/650x650/0/0/0000207697980_01_sw.jpg
33;Sneakersy LANETTI;Lanetti ;MP40-9063Y Brown ;Męskie@Półbuty;Klasyczna propozycja marki Lanetti. W cholewce dominuje Skóra ekologiczna - Skóra ekologiczna, Materiał - Materiał. Wewnętrzna wyściółka to materiał. Wkładka to materiał. Wygodę zwiększa odpowiednia podeszwa: wysokogatunkowe tworzywo. Stylowe i przyjemne w noszeniu buty codzienne. ;119,99 ;https://www.eobuwie.com.pl/media/catalog/product/cache/image/650x650/5/9/5903419733307_01_mt.jpg
34;Trampki CONVERSE;Converse ;All Star Ox M7652C Optical White ;Męskie@Półbuty;Modna propozycja marki Converse. Lekki wygląd zawdzięczają cholewce: Materiał - Materiał. Wewnętrzna wyściółka to materiał. Komfort noszenia podnosi wkładka: materiał. Podeszwa to guma. Stylowe i przyjemne w noszeniu buty codzienne. ;199,00 ;https://www.eobuwie.com.pl/media/catalog/product/cache/image/650x650/0/0/0000076522222_01_ts.jpg
35;Tenisówki BIG STAR;Big Star ;DD174162 Grey ;Męskie@Półbuty;Przyciągające uwagę buty marki BIG STAR. Lekki wygląd zawdzięczają cholewce: Materiał - Materiał. Posiadają wyściółkę - to materiał. Komfort noszenia podnosi wkładka: materiał. Podeszwa to guma. Stylowe i przyjemne w noszeniu buty codzienne. ;69,00 ;https://www.eobuwie.com.pl/media/catalog/product/cache/image/650x650/0/0/0000200912387_1_mn.jpg
36;Tenisówki BUGATTI;Bugatti ;325-89804-6900-1000 Black ;Męskie@Półbuty;Klasyczna propozycja marki Bugatti. Cholewka wyprofilowana z najlepszych surowców: Materiał - Materiał. Posiadają wyściółkę - to materiał. We wnętrzu butów znajduje się wkładka: materiał. Wygodę zwiększa odpowiednia podeszwa: guma. Stylowe i przyjemne w noszeniu buty codzienne. ;139,00 ;https://www.eobuwie.com.pl/media/catalog/product/cache/image/650x650/0/0/0000208005715_01_wj.jpg
37;Tenisówki BIG STAR;Big Star ;GG174030 Red ;Męskie@Półbuty;Klasyczna propozycja marki BIG STAR. Lekki wygląd zawdzięczają cholewce: Skóra ekologiczna - Skóra ekologiczna. Wewnętrzna wyściółka to materiał. Wkładka to materiał. Wygodę zwiększa odpowiednia podeszwa: guma. Stylowe i przyjemne w noszeniu buty codzienne. ;99,00 ;https://www.eobuwie.com.pl/media/catalog/product/cache/image/650x650/0/0/0000207433748_01__rz.jpg
38;Sneakersy EA7 EMPORIO ARMANI;EA7 Emporio Armani ;X8X070 XK165 M701 Triple Black/Gold ;Męskie@Półbuty;Klasyczna propozycja marki EA7 Emporio Armani. W cholewce dominuje Skóra ekologiczna - Skóra ekologiczna, Materiał - Materiał. We wnętrzu butów materiał. Wkładka to materiał. Materiał podeszwy to wysokogatunkowe tworzywo. Buty na co dzień - ponadczasowe i uniwersalne. ;889,00 ;https://www.eobuwie.com.pl/media/catalog/product/cache/image/650x650/0/0/0000207287778_01_rz.jpg
39;Sneakersy NEW BALANCE;New Balance ;ML370NBW Granatowy ;Męskie@Półbuty;Klasyczna propozycja marki New Balance. W cholewce dominuje Skóra ekologiczna - Skóra ekologiczna, Materiał - Materiał. We wnętrzu butów materiał. We wnętrzu butów znajduje się wkładka: materiał. Wygodę zwiększa odpowiednia podeszwa: wysokogatunkowe tworzywo. Stylowe i przyjemne w noszeniu buty codzienne. ;229,00 ;https://www.eobuwie.com.pl/media/catalog/product/cache/image/650x650/0/0/0000200373034_01_jf.jpg
40;Sneakersy PEPE JEANS;Pepe Jeans ;Tinker Zero Second PMS30659 Grey 945 ;Męskie@Półbuty;Modna propozycja marki Pepe Jeans. Cholewka wyprofilowana z najlepszych surowców: Skóra naturalna - Zamsz, Materiał - Materiał. Wewnętrzna wyściółka to materiał. We wnętrzu butów znajduje się wkładka: materiał. Podeszwa to wysokogatunkowe tworzywo. Buty na co dzień - ponadczasowe i uniwersalne. ;259,00 ;https://www.eobuwie.com.pl/media/catalog/product/cache/image/650x650/0/0/0000208070928_01_pa-2.jpg
41;Sneakersy VANS;Vans ;Sk8-Hi Mte 2.0 Dx VN0A4P3I2NF1 (Mte) Apricot/Black ;Męskie@Półbuty;Przyciągające uwagę buty marki Vans. W cholewce dominuje Skóra naturalna - Licowa, Materiał - Materiał. Wkładka to materiał. Podeszwa to wysokogatunkowe tworzywo. W butach zastosowano technologię MTE 360™, Prima Loft, Ultra Cush. Stylowe i przyjemne w noszeniu. ;459,00 ;https://www.eobuwie.com.pl/media/catalog/product/cache/image/650x650/0/0/0000207853010_01_rz.jpg
42;Sneakersy LASOCKI FOR MEN;Lasocki For Men ;MB-TARO-01 Cobalt Blue ;Męskie@Półbuty;Modna propozycja marki Lasocki For Men. Cholewka wyprofilowana z najlepszych surowców: Skóra naturalna - Zamsz, Materiał - Materiał. Posiadają wyściółkę - to materiał. Wkładka to materiał. Materiał podeszwy to wysokogatunkowe tworzywo. Model wyposażono w technologię Light Outsole. Te buty to miejski styl w dobrym wydaniu. ;179,99 ;https://www.eobuwie.com.pl/media/catalog/product/cache/image/650x650/5/9/5903419729768_01_rz.jpg
43;Sneakersy CALVIN KLEIN JEANS;Calvin Klein Jeans ;Ron S0506 Indigo/Silver ;Męskie@Półbuty;Przyciągające uwagę buty marki Calvin Klein Jeans. Lekki wygląd zawdzięczają cholewce: Materiał - Materiał, Tworzywo - Wysokogatunkowe tworzywo. We wnętrzu butów materiał. We wnętrzu butów znajduje się wkładka: materiał. Wygodę zwiększa odpowiednia podeszwa: wysokogatunkowe tworzywo. Stylowe i przyjemne w noszeniu buty codzienne. ;359,00 ;https://www.eobuwie.com.pl/media/catalog/product/cache/image/650x650/0/0/0000201055021_01_pl.jpg
44;Sneakersy NEW BALANCE;New Balance ;MT574ATD Czarny ;Męskie@Półbuty;Klasyczna propozycja marki New Balance. W cholewce dominuje Skóra naturalna - Zamsz. Posiadają wyściółkę - to materiał. Komfort noszenia podnosi wkładka: materiał. Wygodę zwiększa odpowiednia podeszwa: wysokogatunkowe tworzywo. Model wyposażono w technologię ENCAP, EVA. Buty na co dzień - ponadczasowe i uniwersalne. ;279,00 ;https://www.eobuwie.com.pl/media/catalog/product/cache/image/650x650/0/0/0000207744233_01_rz.jpg
45;Buty NIKE;NIKE ;Air Max 200 CT1262 102 White/Laser Orange/Eggplant ;Męskie@Półbuty;Przyciągające uwagę buty marki NIKE. Lekki wygląd zawdzięczają cholewce: Skóra ekologiczna - Skóra ekologiczna, Materiał - Materiał. Wewnętrzna wyściółka to materiał. Wkładka to materiał. Wygodę zwiększa odpowiednia podeszwa: wysokogatunkowe tworzywo. Buty wzbogacono o technologię Air Max, Cushlon, Max Air, TPU. Te buty to miejski styl w dobrym wydaniu. ;529,00 ;https://www.eobuwie.com.pl/media/catalog/product/cache/image/650x650/0/0/0000207997028_01_mg.jpg
46;Buty adidas;adidas, adidas Originals ;Zx Flux FW0028 Blue/Ftwwht/Solred ;Męskie@Półbuty;Przyciągające uwagę buty marki adidas. Lekki wygląd zawdzięczają cholewce: Materiał - Materiał, Tworzywo - Wysokogatunkowe tworzywo. Posiadają wyściółkę - to materiał. Komfort noszenia podnosi wkładka: materiał. Materiał podeszwy to wysokogatunkowe tworzywo. W butach zastosowano technologię Torsion, TPU. Te buty to miejski styl w dobrym wydaniu. ;319,00 ;https://www.eobuwie.com.pl/media/catalog/product/cache/image/650x650/0/0/0000206873910_01_rz.jpg
47;Buty NIKE;NIKE ;Air Max 270 AH8050 002 Black/Anthracite/White ;Męskie@Półbuty;Przyciągające uwagę buty marki NIKE. W cholewce dominuje Materiał - Materiał, Tworzywo - Wysokogatunkowe tworzywo. Posiadają wyściółkę - to materiał. We wnętrzu butów znajduje się wkładka: materiał. Wygodę zwiększa odpowiednia podeszwa: wysokogatunkowe tworzywo. Buty wzbogacono o technologię Max Air. Stylowe i przyjemne w noszeniu buty codzienne. ;539,00 ;https://www.eobuwie.com.pl/media/catalog/product/cache/image/650x650/0/0/0000206704962_01_wj.jpg
48;Sneakersy TOMMY JEANS;Tommy Jeans ;Midcut Lace Up Vulc EM0EM00485 White YBR ;Męskie@Półbuty;Modna propozycja marki Tommy Jeans. Cholewka wyprofilowana z najlepszych surowców: Materiał - Materiał. We wnętrzu butów materiał. We wnętrzu butów znajduje się wkładka: materiał. Wygodę zwiększa odpowiednia podeszwa: wysokogatunkowe tworzywo. Te buty to miejski styl w dobrym wydaniu. ;249,00 ;https://www.eobuwie.com.pl/media/catalog/product/cache/image/650x650/0/0/0000207167452_01_rz.jpg
